,Nome da Música,link,album,letra,artista
184,Milord,/edith-piaf/milord.html,20 Chansons D'Or,"Allez, venez, Milord! Vous asseoir à ma table Il fait si froid, dehors Ici c'est confortable Laissez-vous faire, Milord Et prenez bien vos aises Vos peines sur mon coeur Et vos pieds sur une chaise Je vous cunnais, Milord Vous n'm'avez jamais vue Je ne suis qu'une fille du port Qu'une ombre de la rue Pourtant j'vous ai frôlé Quand vous passiez hier Vous n'étiez pas peu fier Dame! Le ciel vous comblait Votre foulard de soie Flottant sur vos épaules Vous aviez le beau rôle On aurait dit le roi Vous marchiez en vainqueur Au bras d'une demoiselle Mon Dieu! ... Qu'elle était belle J'en ai froid dans le coeur  Allez, venez, Milord! Vous asseoir à ma table Il fait si froid, dehors Ici c'est confortable Laissez-vous faire, Milord Et prenez bien vos aises Vos peines sur mon coeur Et vos pieds sur une chaise Je vous connais, Milord Vous n'm'avez jamais vue Je ne suis qu'une fille du port Qu'une ombre de la rue  Dire qu'il suffit parfois Qu'il y ait un navire Pour que tout se déchire Quand le navire s'en va Il emmenait avec lui La douce aux yeux si tendres Qui n'a pas su comprendre Qu'elle brisait votre vie L'amour, ça fait pleurer Comme quoi l'existence Ça vous donne toutes les chances Pour les reprendre après  Allez, venez, Milord! Vous avez l'air d'un môme! Laissez-vous faire, Milord Venez dans mon royaume Je soigne les remords Je chante la romance Je chante les milords Qui n'ont pas eu de chance! Regardez-moi, Milord Vous n'm'avez jamais vue Mais... vous pleurez, Milord? Ça... j'l'aurais jamais cru!  Eh ben, voyons, Milord! Souriez-moi, Milord! Mieux qu' ça! Un petit effort Voilà, c'est ça! Allez, riez, Milord! Allez, chantez, Milord! La-la-la  Mais oui, dansez, Milord! La-la-la... Bravo Milord! La-la-la... Encore Milord! ... La-la-la",Edith Piaf
185,Miséricorde,/edith-piaf/misericorde.html,Au Carnegie Hall,"Plus jamais ne prierai Plus jamais ne rirai Avec leurs boniments Ils ont tué mon amant Le bourdon peut sonner Le curé, marmonner C’est pas ça qui le fera Revenir dans mes bras D’un petit air réfléchi Et la voix décidée Il a dit: “Allons-y!” “Faut défendre ses idées!” Mais malgré sa grande gueule Et ses yeux qu’il planquait Je n’étais pas toute seule A chiâler sur le quai…  Miséricorde! Miséricorde! Les petites croix blanches Ont des dimanches Qui ne sont pas gais  Le ciel bleu d’un petit bal Du côté de Bougival Dans mes yeux étonnés Continue de tourner…  Rien qu’à voir les péniches On rêvait de voyager Pour ceux qui ne sont pas riches Il suffit de rêver Le jardin qu’on aurait Serait plein de lilas… Et le gosse qu’on aurait S’appellerait Jean-François… Les beaux rêves sont gratuits Moi, le seul qui me reste C’est l’odeur de sa veste Quand je dansais contre lui  Y a plus que ça qui me rapproche De celui que j’adorais Mais la vie est si moche Que même ça, je l’oublierai…  Miséricorde! Miséricorde! Miséricorde!",Edith Piaf
186,Mon Amant de La Coloniale,/edith-piaf/mon-amant-de-la-coloniale.html,1935-1942 / 1936-1945,"Il était fort et puis si tendre Que dès notre première nuit Je sentais que je ne pourrais plus me reprendre Et pour toujours, j’étais à lui Je voyais toutes les femmes lui sourire Moi, je me cramponnais à son bras Et je les regardais comme pour leur dire: “Il est à moi, et je le lâche pas!”  C’était un gars de la Coloniale Il avait là, partant du front Et descendant jusqu’au menton Une cicatrice en diagonale Des cheveux noirs, des yeux si pâles La peau brûlée par le soleil J’en ai plus jamais vu de pareils A mon amant de la Coloniale  Des fois quand il avait la fièvre Il parlait trop et j’avais peur Je mettais la main sur ses lèvres Pour pas connaître le fond de son coeur Car je sentais que dans son âme Y’avait des larmes et du cafard Longtemps j’ai cru que c’était une femme Quand j’ai compris, c’était trop tard…  Lorsque j’ai connu ma rivale Alors j’ai serré fort mes bras Pour que cette grande garce de la Coloniale Lui foute la paix et ne me le vole pas Et lui, il m’avait dit: “Je reste” Mais un beau jour, il est reparti Vers ce pays que je déteste Dont il rêvait souvent la nuit  C’était un gars de la Coloniale Il portait là, partant du front Et descendant jusqu’au menton Une cicatrice en diagonale Je reverrai plus ses beaux yeux pâles Ses yeux qui n’ont pas leur pareil Il est reparti vers son soleil Mon bel amant de la Coloniale…",Edith Piaf
187,Mon Amant de Saint-jean,/edith-piaf/mon-amant-de-saint-jean.html,,"Je ne sais pourquoi j'allais danser A Saint-Jean au musette, Mais quand un gars m'a pris un baiser, J'ai frissonné, j'étais chipée Comment ne pas perdre la tête, Serrée par des bras audacieux Car l'on croit toujours Aux doux mots d'amour Quand ils sont dits avec les yeux Moi qui l'aimais tant, Je le trouvais le plus beau de Saint-Jean, Je restais grisée Sans volonté Sous ses baisers.  Sans plus réfléchir, je lui donnais Le meilleur de mon être Beau parleur chaque fois qu'il mentait, Je le savais, mais je l'aimais. Comment ne pas perdre la tête, Serrée par des bras audacieux Car l'on croit toujours Aux doux mots d'amour Quand ils sont dits avec les yeux Moi qui l'aimais tant, Je le trouvais le plus beau de Saint-Jean, Je restais grisée Sans volonté Sous ses baisers.  Mais hélas, à Saint-Jean comme ailleurs Un serment n'est qu'un leurre J'étais folle de croire au bonheur, Et de vouloir garder son cœur. Comment ne pas perdre la tête, Serrée par des bras audacieux Car l'on croit toujours Aux doux mots d'amour Quand ils sont dits avec les yeux Moi qui l'aimais tant, Mon bel amour, mon amant de Saint-Jean, Il ne m'aime plus C'est du passé N'en parlons plus.",Edith Piaf
188,Mon Ami M'a Donné,/edith-piaf/mon-ami-ma-donne.html,30 Anniversaire: l' Intégrale 1946-1963,"Mon ami m’a donné une fleur Une fleur que j’ai mise à mon coeur Sur mon coeur plein de lui Que la rose était belle Dans mon coeur plein de lui Le bonheur a fleuri  Mon ami m’a donné un baiser Près du coeur, doucement l’a posé A mon coeur plein d’amour Que sa lèvre était douce Ce baiser plein d’amour L’ai donné à mon tour  Mon ami m’a donné un serment Le serment de m’aimer si longtemps Si longtemps que les fleurs Pousseront sur la terre Si longtemps que la fleur Restera sur mon coeur  Mon ami m’a donné du pleurer Du pleurer que n’ai pas mérité Pour essuyer mes pleurs J’ai pris la rose blanche J’ai pris la rose fleur Qui était sur mon coeur  Mon ami viendra me voir demain Plus de fleurs et beaucoup de chagrin J’irai voler des fleurs Dans les jardins du monde J’irai voler des fleurs La plus belle à mon coeur  En prison si l’on veut me jeter Je dirai à qui va me juger Faites battre tambours Et dressez la potence Plutôt que perdre amour Je volerai la France Et le roi dans sa cour Plutôt que perdre amour…",Edith Piaf
189,Mon Apéro,/edith-piaf/mon-apero.html,1935-1942 / 1936-1945,"On peut donner des leçons de morale Quand on possède bonne soupe et bon feu Mais quand on ne possède que peau de balle On prend son plaisir où l’on peut Dans le quartier, on me blague Je suis un pilier de bistrot C’est vrai qu’avec les pochards, je divague Chaque fois que j’ai le coeur trop gros D’autres cherchent des trucs compliqués Mais comme j’ai horreur du chiqué Moi, c’est au bord du comptoir Que je prends tous les soirs Mon apéro…  Je discute avec le patron Je l’appelle par son petit nom Ben c’est un bon gros Comme les mâles je lui dis: “Arthur, vas-y!” Et je te lui joue la tournée au zanzi Le phono joue une java L’ennui doucement s’en va Tout me semble beau Et je noie mon ennui profond Pour une heure tout au fond D’un apéro…  Sur mes seize ans, comme j’étais belle gosse Tous les gars me faisaient du boniment Alors je me suis mise à faire la noce C’est venu, je ne sais pas comment Y me payaient tout sans rien dire J’avais voiture et hôtel Mais il fallait toujours sourire Le coeur barbouillé de fiel Et je rêvais d’un petit mécano Qui ne m’offrirait que des bécots Alors, pour chasser le noir Je buvais dans tous les bars Des apéros…  Grimpée sur un tabouret Trempé dans mon gobelet Un chalumeau Et devant l’air fatigué des danseurs Je me sentais prise par le chazes du chausseur Plus que moi riche d’amour Il embrassait chaque jour Une dactylo Et je n’avais pour consoler Mon coeur si désolé Que les apéros…  Mais les cocktails me tournaient la tête Alors j’ai bientôt plaqué le métier Me revoilà, bon Dieu que la vie est bête, Revenue dans mon vieux quartier La revoilà ma petite église Et chez moi rien n’a changé... rien! Rien, sinon mon coeur, cette prison grise, A qui tout reste étranger Hélas, le bonheur n’a qu’un temps Voyant que l’amour foutait le camp Je suis revenue au comptoir Où l’on me payait le soir Des apéros…  Je ne crois plus à rien du tout Patron, encore un coup! Et du costaud C’est embêtant, oui, quand je revois les cieux Et dans mon rêve je pêche des rêves bleus Affalée par le coups durs J’ai pas mis la main sur le bon numéro Le numéro… Et mon coeur vide d’amour N’a plus son vrais secours: Les apéros…",Edith Piaf
190,Mon Coeur Est Au Coin D'une Rue,/edith-piaf/mon-coeur-est-au-coin-dune-rue.html,Tu es Partout - 1935-1947,"Mon coeur est au coin d’une rue Et roule souvent à l’égout Pour le broyer, les chiens se ruent Les chiens sont des hommes, des loups… On les entend dire: “Je t’aime” Sont-ils sincères un seul moment? Leurs aveux sont toujours les mêmes Quand leur désir montre ses dents  Comme vous toutes, oui, mesdames, Croyant à l’amour, au serment, Le bonheur inondait mon âme En mon coeur chantait le printemps Par les soirs de mélancolie Je frissonnais sous le désir Il disait que j’étais jolie Je pensais ne jamais vieillir  Hélas, un soir, quelle tristesse, Mon amant n’est pas revenu Sa lettre écrite sans tendresse Demeura pour moi l’inconnu Jamais je n’ai compris le drame Plus rien, ni rien dans mon cerveau En est-il une qui me blâme D’avoir rouler jusqu’au ruisseau?...  Mon coeur est au coin d’une rue Et roule souvent à l’égout Pour le broyer, les chiens se ruent Les chiens sont des hommes, des loups… Mon corps est déjà leur pâture Ma chair ne se révolte pas Mon Dieu, que votre créature Ne souffre plus… Reprenez-la…",Edith Piaf
191,Mon Dieu,/edith-piaf/mon-dieu.html,A L'Olympia 1961,"Mon Dieu! Mon Dieu! Mon Dieu! Laissez-le-moi Encore un peu Mon amoureux!  Un jour, deux jours, huit jours... Laissez-le-moi Encore un peu A moi...  Et le temps de s'adorer De se le dire Et le temps de se fabriquer Des souvenirs.  Mon Dieu! Oh oui... mon Dieu! Laissez-le-moi Remplir un peu Ma vie...  Mon Dieu! Mon Dieu! Mon Dieu! Laissez-le-moi Encore un peu Mon amoureux Six mois, trois mois, deux mois... Laissez-le-moi Pour seulement Un mois...  Et le temps de commencer Ou de finir Le temps d'illuminer Ou de souffrir  Mon Dieu! Mon Dieu! Mon Dieu! Même si j'ai tort Laissez-le-moi Un peu... Même si j'ai tort Laissez-le-moi Encore...",Edith Piaf
192,Mon Homme,/edith-piaf/mon-homme.html,,"Sur cette terre, ma seule joie, mon seul bonheur C’est mon homme. J’ai donné tout ce que j’ai, mon amour et tout mon coeur A mon homme Et même la nuit, Quand je rêve, c’est de lui, De mon homme. Ce n’est pas qu’il est beau, qu’il est riche ni costaud Mais je l’aime, c’est idiot, Je me fout des coups Je me prend mes sous, Je suis à bout Mais malgré tout Que voulez-vous  Je l’ai telle ment dans la peau Que j’en de viens marteau, Dès qu’il s’approche c’est fini Je suis à lui Quand ses yeux sur moi se posent Ça me rend toute chose Je l’ai telle ment dans la peau Qu’au moindre mot Je me ferait faire n’importe quoi Je tuerais, ma foi Je sens qu’il me rendrait infâme Mais je ne suis qu’une femme Et, je l’ai telle ment dans la peau…  Pour le quitter c’est fou ce que m’ont offert D’autres hommes. Entre nous, voyez-vous ils ne valent pas très cher Tous les hommes La femme à vrai dire N’est faite que pour souffrir Par les hommes. Dans les bals, j’ai couru, afin de l’oublier j’ai bu Rien à faire, j’ai pas pu Quand je me dit: “Viens” Je suis comme un chien Y’a pas moyen C’est comme un lien Qui me retient.  Je l’ai telle ment dans la peau Que j’en suis dingo. Que celle qui n’a pas aussi Connu ceci Ose venir la première Me je ter la pierre. En avoir un dans la peau C’est le pire des maux Mais c’est connaître l’amour Sous son vrai jour Et je dis qu’il faut qu’on pardonne Quand une femme se donne A l’homme qu’elle a dans la peau…",Edith Piaf
193,Mon Légionnaire,/edith-piaf/mon-legionnaire.html,1935-1942 / 1936-1945,"Il avait de grands yeux très clairs Où parfois passaient des éclairs Comme au ciel passent des orages. Il était plein de tatouages Que j’ai jamais très bien compris, Son cou portait: “pas vu, pas pris” Sur son coeur on lisait: “personne” Sur son bras droit un mot: “raisonne”.  Je sais pas son nom, je ne sais rien de lui Il m’a aimée toute la nuit Mon légionnaire! Et me laissant à mon destin Il est parti dans le matin Plein de lumière! Il était mince il était beau, Il sentait bon le sable chaud Mon légionnaire! Y’avait du soleil sur son front Qui mettait dans ses cheveux blonds De la lumière!  Bonheur perdu, bonheur enfui, Toujours je pense à cette nuit, Et l’envie de sa peau me ronge. Parfois je pleure et puis je songe Que lorsqu’il était sur mon coeur, J’aurais dû crier mon bonheur… Mais je n’ai rien osé lui dire. J’avais peur de le voir sourire!  On l’a trouvé dans le désert, Il avait ses beaux yeux ouverts, Dans le ciel passaient des nuages. Il a montré ses tatouages En souriant et il a dit, Montrant son cou: “pas vu, pas pris” Montrant son coeur: “ici personne” Il ne savait pas… Je lui pardonne.  Je rêvais pourtant que le destin Me ramènerait un beau matin Mon légionnaire! Qu’on s’en irait loin tous les deux Dans quelque pays merveilleux Plein de lumière! Il était mince il était beau, On l’a mis sous le sable chaud Mon légionnaire! Y’avait du soleil sur son front Qui mettait dans ses cheveux blonds De la lumière!",Edith Piaf
194,Mon Manège à Moi,/edith-piaf/mon-manage-a-moi.html,L'Immortelle,"Tu me fais tourner la tête Mon manege a moi, c'est toi Je suis toujours à la fête Quand tu me tiens dans tes bras  Je ferai le tour du monde Ca ne tournerait pas plus que ça La terre n'est pas assez ronde Pour m'etourdir autant que toi.  Ah c'qu'on est bien tous les deux Quand on est ensemble nous deux Quelle vie on a tous les deux Quand on s'aime comme nous deux On pourrait changer de planete Tant que j'ai mon coeur pres du tien J'entends les flonflons de la fete Et la terre n'y est pour rien  Ah oui, parlons-en de la terre! Pour qui elle se prend la terre? Ma parole y'a qu'elle sur terre! Y'a qu'elle pour faire tant de mystere Mais pour nous y a pas de probleme Car c'est pour la vie qu'on s'aime Et si y'avait pas de vie meme Nous on s'aimerait quand meme Car....  Tu me fais tourner la tete Mon manege a moi, c'est toi Je suis toujours a la fete Quand tu me tiens dans tes bras  Je ferai le tour du monde Ca ne tournerait pas plus que ca La terre n'est pas assez ronde Pour m'etourdir autant que toi.  Je ferai le tour du monde Ca ne tournerait pas plus que ca La terre n'est pas assez ronde Mon manege a moi, c'est toi",Edith Piaf
195,Mon Vieux Lucien,/edith-piaf/mon-vieux-lucien.html,At the Paris Olympia,"Quelle chance que t’as D’avoir, Lucien, Un vieux copain Comme moi Moi, tu me connais J’aime rigoler Et m’amuser, Pas vrai? Alors ce soir Histoire de rire Et tu peux me croire Sans réfléchir Comme ça pour voir Et sans prévenir J’ai dit aux copains: “On va chez Lucien”  Quelle chance que t’as D’avoir, Lucien, Un vieux copain Comme moi Tu peux te vanter Lorsque j’y pense D’avoir de la chance Tu sais! Mais tu ne dis rien Tu me laisses parler Je te connais bien Tu me fais marcher Moi ça ne fait rien Tu peux y aller Mais maintenant, ça va Et dis-moi pourquoi Tu fais cette tête-là Comme ça Mais… Regarde-moi… T’as les yeux gonflés Je t’ai réveillé? Ah non! T’écrivais à ta Bien-aimée… Qu’est-ce que tu caches là? Là... dans ton tiroir… Eh ben, quoi, fais voir! ... Tu voulais me faire peur?!... Ah… Ha! Ce que t’es blagueur!  Quelle chance que t’as D’avoir, Lucien, Un vieux copain Comme moi Mai je te connais Mieux que personne C’est ce qui t’étonne, Pas vrai? Un autre que moi Ne comprendrait pas Mais moi je devine Que tu me taquines Tu veux peut-être Finir ta lettre… Je vais le dire aux copains, Et puis, tu nous rejoins…  Quelle chance que t’as C’est pas pour dire Que j’aime bien rire Crois-moi! Un autre que moi Aurait marché A ton ciné Pas moi! Allez, au revoir A tout à l’heure T’en fais une tête, sacré farceur! Ah non! Bien sûr que j’ai pas peur! Toi y a pas de danger De te voir un jour Souffrir et mourir D’amour…  Lucien!... Eh bien quoi, Lucien!... Donne-moi ce que t’as dans la main! Ah! Ce t’agréable, d’être ton copain! Ah non, Lucien! Allez… Viens!...",Edith Piaf
196,Monsieur Et Madame,/edith-piaf/monsieur-et-madame.html,Je T'Ai Dans la Peau,"Monsieur, Madame son rentrés de voyage Ils on fêté vingt ans de mariage Il sort un pyjama de ses bagages Tandis qu’elle met du gras sur son visage Monsieur se couche, ferme les yeux, Baille un grand coup: “...bonsoir, chérie” Madame éteint: “...pousse-toi un peu!” Elle vient s’étendre près de lui.  Mais dans le noir il ne dort pas Tout seul il retourne là-bas: Il rêve à la fille aux yeux bleus Il rêve à sa bouche sensuelle Il pense à son corps merveilleux Ses mains si petites et si belles Il entend sa voix et son rire Il pousse un soupir malheureux Monsieur ne dort pas, il s’étire Il rêve à la fille aux yeux bleus…  Madame non plus, dans son petit coin Ne peut dormir, elle est bien loin: Elle rêve au garçon aux yeux bleus Elle rêve à sa bouche sensuelle Elle pense à son corps merveilleux Ses mains si puissantes et si belles  Monsieur prend Madame dans ses bras Ils ferment les yeux tous les deux Ils disent: “Je t’aime” tout bas Et vivent un rêve merveilleux Monsieur et Madame sont heureux Il y a des ménages curieux…",Edith Piaf
197,Monsieur Incognito,/edith-piaf/monsieur-incognito.html,Récital Bobino 1963,"Monsieur Incognito Qu’est-ce que vous faites ici ce soir A vous promenez dans le noir Devant ma station de métro? Monsieur Incognito N’est-ce pas vous à ce qu’il paraît Qui donnez l’amour, les baisers Comme ça à tout propos?  Laissez-moi un peu vous regarder Votre costume couleur d’automne Vos chaussures noires bien cirées Vous ressemblez aux autres hommes… Monsieur Incognito Vous avez l’air plutôt gentil Avec votre air en cheveux gris Et sans dire un seul mot Puisqu’on est là rien que tous les deux On peut parler et s’expliquer Je vous le dis droit dans les yeux J’y crois pas à votre conte de fées Quand j’étais seule, désespérée Pas trace de vous dans ma vie Maintenant que tout est arrangé Faudrait peut-être que je vous remercie!  Monsieur Incognito Qu’est-ce que vous faites ici ce soir A vous promenez dans le noir Devant ma station de métro? Monsieur Incognito N’est-ce pas vous à ce qu’il paraît Qui donnez l’amour, les baisers Comme ça à tout propos?  Je n’aime pas votre petit sourire Votre costume, ni votre voix Votre regard qui semble dire Au revoir, à la prochaine fois… Monsieur Incognito Partez, vous n’avez pas de veine Car avec moi, y a pas de prochaine, D’au revoirs, ni de bientôts Monsieur Incognito Vous me regardez secouant la tête Drôlement avant de disparaître Soudain, j’ai froid dans le dos… Partez!...",Edith Piaf
198,Monsieur Lenoble,/edith-piaf/monsieur-lenoble.html,30 Anniversaire: l' Intégrale 1946-1963,"Monsieur Lenoble est très triste Depuis que sa femme l’a quitté Avec un tout jeune artiste Qu’elle a connu cet été Et monsieur Lenoble écoute La mélodie qu’elle aimait Ces quelques notes goutte à goutte L’empoisonnent à jamais La-la-la…  T’as pas profité de ta chance Mon ami, mon ami Tu avais trop de confiance C’est fini, c’est fini T’avais une femme merveilleuse Si jolie, si jolie T’as pas su la rendre heureuse T’es tout seul, elle est partie…  Monsieur Lenoble raisonne Il pense à tout ce qu’il a fait Ses intentions étaient bonnes Même s’il n’était pas parfait Peut-être pas très bon caractère Il s’emportait pour un rien Mais au bureau, ses confrères Le trouvaient un homme très bien Très bien… très bien… très bien…  T’as pas profité de ta chance Mon ami, mon ami Tu avais trop de confiance C’est fini, c’est fini T’avais une femme merveilleuse Si jolie, si jolie T’as pas su la rendre heureuse T’es tout seul, elle est partie…  Monsieur Lenoble se mouche Met sa chemise de nuit Ouvre le gaz et se couche Demain, tout sera fini Et monsieur Lenoble pense A celle qu’il adorait Et monsieur Lenoble pense A celle qu’il adorait…  T’as pas profité de ta chance Mon ami Tu avais trop de confiance C’est fini… T’avais une femme merveilleuse Si jolie… T’as pas su la rendre heureuse Tu avais trop de confiance… Trop de confiance… trop de confiance Confiance… Confiance…",Edith Piaf
199,Monsieur Saint-pierre,/edith-piaf/monsieur-saint-pierre.html,1935-1942 / 1936-1945,"Y’a pas à dire, j’aime bien la vie Et un peu trop les beaux garçons Moi, j’ai un coeur qui se multiplie Et ça me fait de drôles d’additions Et j’arrive pas à avoir honte Je suis tranquillement un fille de rien Mais quand faudra rendre des comptes Je me demande si tout se passera bien Et ça me fait peur, car on m’a dit Qu’on me prendrait pas au paradis.  Ô mon bon monsieur Saint-Pierre Moi, je vous cause à ma manière Vous pouvez me passer un savon Et me traiter de tous les noms Vous pouvez me faire perdre mon sac Celui que j’ai volé rue du Bac Mais retenez ma place au paradis On m’a tellement dit que c’était joli Regardez-moi bien Je suis si pauvre Regardez mes mains Des mains de pauvre Et regardez tous mes péchés Et mon vieux coeur las de tricher Y’a des tas de noms écrits dessus C’est pas de ma faute ils m’ont tous plu Ô mon bon monsieur Saint-Pierre Je ne sais pas faire de prière Mais on dit que vous êtes si gentil Retenez ma place au paradis.  Y’a pas à dire j’aimais la vie, Mais maintenant ça m’avance à quoi, Me voilà toute froide et toute raidie Entre quatre planches de bois. Vraiment mon âme n’est pas fière Devant la porte de cristal Où j’entrevois derrière Saint-Pierre Une éternité d’idéal, Je ne suis qu’une âme de rien du tout, Je ne sais même pas me mettre à genoux.  Ô mon bon monsieur Saint-Pierre Moi je vous cause à ma manière, Vous pouvez m’enlever mes désirs Me priver de tous mes souvenirs Et même me confisquer mon clip, Celui que m’a payé le beau Philippe, Mais donnez-moi ma place au paradis, On m’a tellement dit que c’était joli. Regardez-moi bien Je suis si pauvre, Regardez mes mains, Des mains de pauvre, Et regardez tous mes péchés Et mon vieux coeur las de tricher, De tous les noms écrits dessus Y’en a plus qu’un, celui de Jésus. Ô mon bon monsieur Saint-Pierre Je ne sais pas faire de prière, Alors mettons que je n’ai rien dit Mais gardez-moi au paradis.",Edith Piaf
200,Musique A Tout Va,/edith-piaf/musique-a-tout-va.html,A L'Olympia 1962,"Si je vous dis que derrière ça Derrière cette musique à tout va Y a le passé dans ses haillons Qui vient mendier à ma chanson Si je vous dis que derrière ça Y vos péchés qui n’oublient pas Et vos anciens rêves d’amour Qui battent, battent le tambour Regardez-les monter sur scène Ce sont vos joies, ce sont vos peines Et ces remords qui font la chaîne Pour qu’on trébuche sur leurs pas Si je vous dis que derrière ça Derrière cette musique à tout va Y a ce qu’on tue et ne meurt pas Oh! Sûr, que vous ne me croirez pas…  Si je vous dis que devant ça Devant cette musique à tout va Tout ce passé soudain renaît De la poussière, des regrets Si je vous dis que devant ça Comme une armée de petits soldats Y a des “je t’aimée” qui vont dansant Et des baisers de vingt printemps Allez, ne bercez plus la tête Rien ne demeure et ce qu’on jette Il reste à vivre d’autres fêtes Qui flamberont en feux de joie  Si je vous dis que devant ça Devant cette musique à tout va Je vois ces choses qu’on ne voit pas Oh! Sûr, que vous ne me croirez pas… Mais je les vois, mais je les vois Oui je les vois, oui je les vois Devant cette musique à tout va Ahahaha…",Edith Piaf
