,Nome da Música,link,album,letra,artista
131,Le Chant Du Pirate,/edith-piaf/le-chant-du-pirate.html,Une Vie em Chansons,"Marchant par-dessus les tempêtes Courant dans la vague et le vent Chassant les blanches goélettes C’est nous ça, les gaillards d’avant C’est nous qui sommes les corsaires Brigands tout comme étaient nos pères  REFRAIN: Ho-hisse et Ho! Miséricorde! Pour nous tenir au bout d’une corde Faudra d’abord nous attraper Faudra d’abord nous aborder… Ho-hisse-ho! Pavillon noir! Ho-hisse-ho! Pavillon haut! Tant que le vent pousse la frégate Y a du bon temps pour les pirates Tant que la mer est par-dessous C’est le corsaire qui tient le bon bout! Ho-hisse-ho! Pavillon noir! Ho-hisse-ho! Pavillon haut!  Tant pis pour les yeux de ta mère Tant pis pour la reine et le roi Tant mieux si tu deviens corsaire Jésus était un hors-la-loi Viens donc fréquenter les étoiles Dormir dans le ventre des voiles  REFRAIN",Edith Piaf
132,Le Chasseur de L'hôtel,/edith-piaf/le-chasseur-de-lhotel.html,,"Le chasseur de l'hôtel Aime d'un amour pauvre Une certaine mademoiselle Couverte de bijoux  Elle habite au numéro vingt Une chambre avec salle de bains Et traîne avec un petit chien, Un amant qui ne lui sert à rien Et puis des tas d'admirateurs Qui lui envoient chaque jour des fleurs Des fleurs que porte le chasseur Et ça lui fait bien mal au coeur  Le chasseur de l'hôtel Quand il rentre chez lui Rêve à sa demoiselle Pendant toute la nuit  Le chasseur de l'hôtel Qui n'a pas quatre sous Est, c'est bien naturel, Quatre fois plus jaloux  Il n'en peut plus de voir toujours Ces inutiles singer l'amour Et un soir qu'il avait ses nerfs Il a sorti son revolver Mais l'autre a tiré le premier A preuve qu'il fallait s'en méfier Surtout que par dessus l'marché La brute, il avait bien visé  Le chasseur de l'hôtel N'eut qu'à fermer les yeux Pour arriver au ciel Où vont les malheureux  Le chasseur de l'hôtel Par les chemins du ciel Cherchait sa demoiselle Et s'ennuyait sans elle  Or, un jour plein de merveilleux Le pauvre n'en crut pas ses yeux Car sa demoiselle était là Sur un nuage de gala Et même, elle semblait lui sourire Car maint'nant elle savait sourire Y a pas à dire, y a un bon Dieu Un bon Dieu pour les amoureux  Le chasseur de l'hôtel La serra dans ses bras En remerciant le ciel Et puis, se réveilla.",Edith Piaf
133,Le Chemin Des Forains,/edith-piaf/le-chemin-des-forains.html,Ses Plus Grands Succes,"Ils ont troué la nuit D’un éclair de paillettes d’argent Ils vont tuer l’ennui Pour un soir dans la tête des gens A danser sur un fil, à marcher sur les mains Ils vont faire des tours à se briser les reins Les forains…  Une musique en plein vent Un petit singe savant Qui croque une noisette en rêvant Sur l’épaule d’un vieux musicien Qui lui, ne rêve de rien.  Ils ont troué la nuit D’un grand rire entremêlé de pleurs Ils ont tué l’ennui Par l’écho de leur propre douleur Ils ont pris la monnaie dans le creux de leurs mains Ils ont plié bagages et repris leur chemin Les forains…  Leurs gestes d’enfants joyeux Et leurs habits merveilleux Pour toujours sont gravés dans les yeux Des badauds d’un village endormi Qui va rêver cette nuit  Va rêver cette nuit D’un éclair de paillettes d’argent Qui vient tuer l’ennui Dans le coeur et la tête des gens Mais l’ombre se referme au détour du chemin Et Dieu seul peut savoir où ils seront demain Les forains… Qui s’en vont dans la nuit…",Edith Piaf
134,Le Chevalier de Paris,/edith-piaf/le-chevalier-de-paris.html,La Môme de Paris,"(Ah! Les pommiers doux)  Le grand chevalier du coeur de Paris Se rappelait plus du goût des prairies. Il faisait la guerre avec ses amis Dedans la fumée, Dedans les métros, Dedans les pavés, Dedans les bistrots. Il ne savait pas qu’il en était saoul. Il ne savait pas qu’il dormait debout. Paris le tenait par la peau du cou.  REFRAIN: Ah! Les pommiers doux, Rondes et ritournelles. J’ai pas peur des loups, Chantonnait la belle. Ils ne sont pas méchants Avec les enfants Qu’ont le coeur fidèle Et les genoux blancs…  Sous un pommier doux, il l’a retrouvée, Croisant le soleil avec la rosée. Vivent les chansons pour les Bien-aimées. Je me souviens d’elle au sang de velours. Elle avait des mains qui parlaient d’amour Et tressait l’argile avec les nuages Et pressait le vent contre son visage Pour en exprimer l’huile des voyages.  REFRAIN  “Adieu mon Paris”, dit le chevalier. “J’ai dormi cent ans, debout sans manger Les pommes d’argent de mes doux pommiers.” Alors le village a crié si fort Que toutes les filles ont couru dehors Mais le chevalier n’a salué qu’elle Au sang de velours, au coeur tant fidèle, Chevalier fera la guerre en dentelles.  REFRAIN",Edith Piaf
135,Le Ciel Est Fermé,/edith-piaf/le-ciel-est-ferme.html,,"Fatigué des gens de la terre, Le Bon Dieu, qui est surmené, Réfléchit entre deux mystères, Et décida de démissionner. Il éteignit quelques étoiles, Ferma le ciel de haut en bas, Et d’un nuage, fit une voile Qui prit le vent et qui l’emporta.  Et voilà le soleil de travers… Tous les hommes qui marchent la tête en bas… Et la terre qui s’enroule à l’envers… Et la mer qui s’embête et s’en va… Mais les prières… Les prières continuent à monter Car tous les hommes… Tous les hommes continuent à prier…  Et c’est là qu’elles sont embêtées, Les prières qui n’ont rien demandé... Et c’est là qu’on les voit faire la queue, Les prières qui attendent le Bon Dieu… Alors, comme elles n’ont rien à faire Les prières, Elles se font des confidences: - Vous venez pourquoi, vous? - Moi, je viens de la part d’un dénommé Roméo, et d’une certaine Juliette… - Qu’est-ce qu’on leur fait comme ennuis, sur cette terre? On veut pas les laisser s’aimer tranquilles? Pas commode d’arranger leur histoire… Et vous? - Moi, pour un gars qu’a de gros ennuis avec son percepteur… Je vois d’ailleurs pas ce que je peux faire pour lui! Mpfff!... Enfin… - Et vous? - Moi, secret professionnel! - Et vous, là-bas? - Moi, Hah! Je viens de la part d’un fou! Enfin, d’un poète… C’est la même chose! D’abord, ce qu’il demande avec la terre, c’est impossible! Et puis, prêcher la bonté, ça fait démodé... - Racontez-nous! C’est peut-être drôle?! - Si vous voulez! De toutes façons, ça changera jamais rien! Alors, voilà:  “Je sais bien que je vous dérange, Mais voilà: j’ai besoin de vous! S’il vous plaît, prêtez-moi des anges! Il en faudrait un petit peu partout… Pour le soleil… un par personne! Et pour l’amour… Oh! S’il vous plaît! Tout plein d’amour aux mains des hommes Pour qu’ils en fassent de grand bouquets...”  Et voilà le Bon Dieu revenu. Le tonnerre a perdu son emploi. Le soleil est passé par-dessus Et voilà que la terre marche droit. Ouvre les portes, Que l’on porte Le soleil dans les blés, Que la terre, Toute la terre Tourne enfin sans trembler Et l’amour a poussé dans les champs Et les hommes le cueillaient en chantant. Les amants ne mourraient plus jamais C’est pour ça que tout le monde s’aimait…  Quel dommage pour les filles, les garçons Que tout ça ne soit qu’une chanson…",Edith Piaf
136,Le Contrebandier,/edith-piaf/le-contrebandier.html,,"Il était né sur la frontière, Là-haut dans le Nord où c'qu'y a du vent. Contrebandier tout comme son père, Il avait la fraud' dans le sang. Il attendait les nuits sans lune - Quand il fait sombre, on passe bien mieux. - Pour s'faufiler par les grandes dunes Où l'vent de la mer nous pique les yeux.  Ohé, la douane ! Ohé, les gabelous ! Lâchez tous les chiens Et puis planquez-vous Au fond de vos cabanes. Regardez sur la dune L'homme qui passe là-bas. Il est pourtant seul Mais vous n'l'aurez pas. Il s'fout d'la douane Au fond de vos cabanes, Allez, planquez-vous Et lâchez les chiens. Ohé, les gabelous ! Ohé, la douane !  Quand il avait rien d'autre à faire, Les nuits où qu'il faisait trop clair, Il changeait les poteaux frontières Et foutait le monde à l'envers Ou bien, d'autres fois, en plein passage, Quand il avait bu un bon coup, Il poussait de vrais cris sauvages Et v'là qu'je passe dépêchez-vous.  Ohé, la douane ! Ohé, les gabelous ! Lâchez tous les chiens Et puis planquez-vous Au fond de vos cabanes. Regardez sur la dune L'homme qui passe là-bas. C'est moi, moi tout seul, Mais vous n'm'aurez pas. J'me fous d'la douane Au fond de vos cabanes. Allez, planquez-vous Et lâchez les chiens. Ohé, les gabelous ! Ohé, la douane !  Il pouvait pas s'mettre dans la tête Qu'la loi des hommes, c'est très sérieux. C'était comme une sorte de poète Et ces types-là, c'est dangereux. Alors une nuit qu'y avait d'la lune, Qu'y baladait pour son plaisir, Ils l'ont étendu sur la dune A coup d'fusil pour en finir.  Ohé, la douane ! Ohé, les gabelous ! Planquez tous vos chiens Et puis amenez-vous. Du fond de vos cabanes, C'est d'la belle ouvrage, Seulement, ce soir, Ce n'était qu'un homme. Il travaillait pas. T'entends, la douane ? Alors, fallait pas... Et puis planquez-vous Au fond de vos cabanes. Ohé, les gabelous ! Ohé, la douane !",Edith Piaf
137,Le Diable de La Bastille,/edith-piaf/le-diable-de-la-bastille.html,L'Immortelle,"C’est incroyable mais vrai Invraisemblable mais vrai C’est le diable qui dansait Au quatorze juillet Place de la Bastille C’est incroyable mais vrai Invraisemblable mais vrai Il savait bien le malin Qu’il tenait dans ses mains Le destin d’une fille Car il est joli garçon Il connaît bien la chanson A la flamme des lampions Au son de l’accordéon Il est méconnaissable Et la fille n’a rien vu Elle ne l’a pas reconnu Tourbillonnant dans ses bras Elle trouvait ce soir-là Que c’était formidable  A dix-huit ans on a le droit De se tromper à ce point-là Tant le démon a l’air si bon On peut l’aimer sans se damner  C’est incroyable mais vrai Invraisemblable mais vrai C’est le diable qui dansait Au quatorze juillet Place de la Bastille C’est incroyable mais vrai Invraisemblable mais vrai Il savait bien le malin Qu’il tenait dans ses mains Le destin d’une fille Vraiment il se régalait Il rigolait, rigolait Puisque la vie était belle Elle trouvait naturel Qu’il ait envie de rire Elle s’est abandonnée C’était vraiment bon marché C’était vraiment trop facile Une âme aussi docile Y avait pas de quoi rire  C’est incroyable mais vrai C’est le diable qui dansait C’est le diable qui riait C’est le diable que j’aimais Le diable que j’aimais Le diable que j’aimais Le diable que j’aimais…",Edith Piaf
138,Le Disque Usé,/edith-piaf/le-disque-use.html,,"Impasse de la gouttière, Dans la ruelle aux matelots, Où n’entre pas la lumière, Y a un vilain caboulot. La figure triste et pâle Une servante aux yeux bleus Rêve aux plus belles escales Et à des ciels merveilleux. Chaque sifflet des bateaux Lui dit: “Ton attente est vaine” Mais dans un coin un phono Chante sa vieille rengaine.  Tant qu‘y’a de la vie y’a de l’espoir Vos désirs, vos rêves Seront exaucés un soir Avant que votre vie s’achève Le bonheur viendra vous voir Il faut l’attendre sans trêve Chassez les papillons noirs Tant qu‘y’a de la vie y’a de l’espoir.  Il était beau comme un ange, Des cheveux blonds comme le miel, Son regard était étrange, Plus bleu que le bleu du ciel. Il appela la servante Et lui dit: “Je te cherchais” Elle répondit, tremblante: “Y’a longtemps que j’attendais.” Il l’a serrée dans ses bras, “Quand je serai capitaine...” Et le vieux disque, tout bas, Chante sa vieille rengaine.  Tant qu‘y’a de la vie y’a de l’espoir Vos désirs, vos rêves Seront exaucés un soir Avant que votre vie s’achève Le bonheur viendra vous voir Il faut l’attendre sans trêve Chassez les papillons noirs Tant qu‘y’a de la vie, y’a de l’espoir.  Impasse de la gouttière, Dans la ruelle aux matelots, Où n’entre pas la lumière, Y’a un vilain caboulot. Elle attend, fière et hautaine, Elle attend, depuis vingt ans, Elle attend son capitaine, Et son regard est confiant. Chaque sifflet des bateaux Lui dit: “Ton attente est vaine” Mais elle écoute le phono Raclant sa vieille rengaine.  Tant qu‘y’a de la vie y’a de l’esp… Y’a de l’esp… Y’a de l’esp… Vos désirs, vos rêves Seront exaucés un soir Avant que votre vie s’achève Le bonheur viendra vous voir Il faut l’attendre sans trêve Chassez les papillons noirs. Tant qu‘y’a de la vie y’a de l’esp… Tant qu‘y’a de la vie y’a de l’esp… Tant qu‘y’a de la vie y’a de l’esp…",Edith Piaf
139,Le Droit D'aimer,/edith-piaf/le-droit-daimer.html,A L'Olympia 1962,"Qu’ils se lèvent ou qu’ils meurent Ces soleils rouges ou gris Et que tournent les heures Et que passe la vie A la face des hommes Au mépris de leurs lois Jamais rien ni personne M’empêchera d’aimer. J’en ai le droit d’aimer J’en ai le droit A la face des hommes Au mépris de leurs lois Jamais rien ni personne M’empêchera d’aimer.  A souhaiter des noces Comme celles des gosses En âge de l’amour Je l’ai voulu ce droit! Par des matins d’ivresse Et des nuits de détresse, Luttant pour cet amour, Je l’ai conquis ce droit! Par la peur de tout perdre Au risque de me perdre Pour que vive l’amour Je l’ai payé ce droit!  Bien que le temps n’efface Ni les deuils ni les joies Quoi qu’on dise ou qu’on fasse Tant que mon coeur battra Quelle que soit la couronne Les épines ou la croix Jamais rien ni personne M’empêchera d’aimer… J’en ai le droit d’aimer J’en ai le droit… A la face des hommes, Au mépris de leurs lois, Jamais rien ni personne M’empêchera d’aimer… De t’aimer… D’être aimée… D’être aimée…",Edith Piaf
140,Le Fanion de La Légion,/edith-piaf/le-fanion-de-la-legion.html,1935-1942 / 1936-1945,"Tout en bas, c'est le Bled immense Que domine un petit fortin. Sur la plaine, c'est le silence, Et là-haut, dans le clair matin, Une silhouette aux quatre vents jette Les notes aiguës d'un clairon, Mais, un coup de feu lui répond.  Ah la la la, la belle histoire. Y a trente gars dans le bastion, Torse nu, rêvant de bagarres, Ils ont du vin dans leurs bidons, Des vivres et des munitions. Ah la la la, la belle histoire. Là-haut sur les murs du bastion, Dans le soleil plane la gloire Et dans le vent claque un fanion. C'est le fanion de la légion !  Les ""salopards"" tiennent la plaine, Là-haut, dans le petit fortin. Depuis une longue semaine, La mort en prend chaque matin. La soif et la fièvre Dessèchent les lèvres. A tous les appels de clairon, C'est la mitraille qui répond.  Ah la la la, la belle histoire, Ils restent vingt dans le bastion, Le torse nu, couverts de gloire, Ils n'ont plus d'eau dans leurs bidons Et presque plus de munitions. Ah la la la, la belle histoire, Claquant au vent sur le bastion Et troué comme une écumoire, Il y a toujours le fanion, Le beau fanion de la légion !  Comme la nuit couvre la plaine, Les ""salopards"", vers le fortin Se sont glissés comme des hyènes Ils ont lutté jusqu'au matin : Hurlements de rage, Corps à corps sauvages, Les chiens ont eu peur des lions. Ils n'ont pas pris la position.  Ah la la la, la belle histoire, Ils restent trois dans le bastion, Le torse nu, couverts de gloire, Sanglants, meurtris et en haillons, Sans eau ni pain, ni munitions. Ah la la la, la belle histoire, Ils ont toujours dans le bastion Mais ne peuvent crier victoire : On leur a volé le fanion, Le beau fanion de la légion !  Mais tout à coup, le canon tonne : Des renforts arrivent enfin. A l'horizon, une colonne Se profile dans le matin Et l'echo répète l'appel des trompettes Qui monte vers le mamelon. Un cri de là-haut lui répond.  Ah la la la, la belle histoire, Les trois qui sont dans le bastion, Sur leurs poitrines toutes noires Avec du sang crénom de nom Ont dessiné de beaux fanions. Ah la la la, la belle histoire, Ils peuvent redresser leurs fronts Et vers le ciel crier victoire. Au garde-a-vous sur le bastion, Ils gueulent ""présent la légion.""",Edith Piaf
141,Le Gitan Et La Fille,/edith-piaf/le-gitan-et-la-fille.html,Milord,"Le gitan dit à la fille:  Qu’importe le prix de l’amour Pour toi j’irai finir mes jours Derrière les grilles J’irai piller les gens de la ville Pour t’offrir une robe de satin Tu ne diras plus que je suis un vaurien Un inutile… Mes mains tout à l’heure si fortes Seront plus douces que le bois De la guitare qui joue pour toi Devant ta porte…  Le gitan dit à la fille:  Qu’importe le prix de l’amour Pour toi j’irai finir mes jours Derrière le grilles J’irai tuer ceux qui te regardent Quand le doux soleil du matin Se glisse dans le creux de tes reins Et s’y attarde… Et là, je te dirai “je t’aime” Comme on dit le nom de Jésus Je le crierai dans la rue Comme un blasphème…  Le gitan a dit à la fille:  Qu’importe le prix de l’amour Pour toi j’irai finir mes jours Derrière les grilles. Autour de toi je ferai l’ombre Pour être le seul à te voir Pour être seul sous ton regard Et m’y confondre… Et quand la mort viendra défaire Les chaînes forgées par l’amour Pour toi j’irai finir mes jours Au fond de la terre…",Edith Piaf
142,Le Grand Voyage Du Pauvre Nègre,/edith-piaf/le-grand-voyage-du-pauvre-negre.html,1935-1942 / 1936-1945,"Soleil de feu sur la mer Rouge Pas une vague, rien ne bouge Dessus la mer un vieux cargo Qui s’en va jusqu’à Bornéo Et dans la soute pleure un nègre, Un pauvre nègre, un nègre maigre, Un nègre maigre dont les os Semblent vouloir trouer la peau.  Oh yo… Oh yo… Monsieur Bon Dieu c’est pas gentil Moi pas vouloir quitter pays Moi vouloir voir le grand bateau Qui crache du feu et marche sur l’eau Et sur le pont moi j’ai dormi Alors bateau il est parti Et capitaine a dit comme ça: “Nègre au charbon il travaillera” Monsieur Bon Dieu c’est pas gentil Moi pas vouloir quitter pays. Oh yo… Oh yo…  Toujours plus loin autour du monde Le vieux cargo poursuit sa ronde. Le monde est grand… Toujours des ports… Toujours plus loin… Encore des ports… Et dans la soute pleure un nègre, Un pauvre nègre, un nègre maigre, Un nègre maigre dont les os Semblent vouloir trouer la peau.  Oh yo… Oh yo… Monsieur Bon Dieu, c’est pas gentil, Y’en a maintenant perdu pays. Pays à moi, très loin sur l’eau Et moi travaille au fond bateau; Toujours ici comme dans l’enfer, Jamais plus voir danser la mer, Jamais plus voir grand ciel tout bleu, Et pauvre nègre malheureux. Monsieur Bon Dieu, c’est pas gentil, Moi pas vouloir quitter pays. Oh yo… Oh yo…  Au bout du ciel, sur la mer calme, Dans la nuit claire, il voit des palmes, Alors il crie: “C’est mon pays!” Et dans la mer il a bondi. Et dans la vague chante un nègre, Un pauvre nègre, un nègre maigre, Un nègre maigre dont les os Semblent vouloir trouer la peau.  Oh yo… Oh yo… Monsieur Bon Dieu, toi bien gentil, Ramener moi dans mon pays. Mais viens Bon Dieu… Viens mon secours, Moi pas pouvoir nager toujours. Pays trop loin pour arriver Et pauvre nègre fatigué. Ça y est… Fini!... Monsieur Bon Dieu!... Adieu pays… Tout le monde adieu… Monsieur Bon Dieu, c’est pas gentil, Moi pas vouloir quitter pays. Oh yo… Oh yo…",Edith Piaf
143,Le Marseillaise,/edith-piaf/le-marseillaise.html,,"Allons enfants de la patrie, Le jour de gloire est arriv Contre nous de la tyrannie L'tendard sanglant est lev Entendez vous dans les campagnes, Mugir ces froces soldats? Ils viennent jusque dans nos bras Egorger nos fils, nos compagnes!   Refrain  Aux armes, citoyens! Formez vos bataillons! Marchons! Marchons! Qu'un sang impur Abreuve nos sillons!  Amour sacr de la patrie, Conduis, soutiens nos bras vengeurs! Libert, Libert cherie, Combats avec tes defenseurs! Sous nos drapeaux, que la victoire Accoure tes males accents! Que tes ennemis expirants Voient ton triomphe et notre gloire!   Refrain  Nous entrerons dans la carrire Quand nos ains n'y seront plus; Nous y trouverons leur poussire Et la trace de leurs vertus. Bien moins jaloux de leur survivre Que de partager leur cercueil, Nous aurons le sublime orgueil De les venger ou de les suivre!  Refrain",Edith Piaf
144,Le Mauvais Matelot,/edith-piaf/le-mauvais-matelot.html,,"Dans le port de Marseille Y’a un joli bateau Dans le port de Marseille Y’a un joli bateau Dans le vent sur l’eau Dans la cale du navire Loin du ciel tout au fond Dans la cale du navire Y’a un mauvais garçon Oh oh oh tout près de l’eau oh oh oh oh La fille du capitaine Est descendue le voir La fille du capitaine Est descendue le voir Comme il fait noir Mon coeur a de la peine Dis-moi joli garçon Pourquoi chargé de chaînes Es-tu là tout au fond Oh oh oh si près de l’eau oh oh oh oh Je suis fils de la terre Mon père est laboureur Je suis fils de la terre Et la mer me fait peur Oh oui bien peur Je suis dans la Marine Sans l’avoir demandé Je suis dans la Marine Et ne sais pas nager Oh oh oh j’ai peur de l’eau oh oh oh oh Je veux revoir ma mère Et les beaux champs de blé Je veux revoir ma mère Et les beaux champs de blé Blonds et dorés Faites tomber mes chaînes Je vous épouserai Faites tomber mes chaînes Je vous emmènerai Oh oh oh bien loin de l’eau oh oh oh oh Dans la cale du navire Le capitaine en pleurs Dans la cale du navire Le capitaine en pleurs Oh quel malheur Il m’a volé ma fille M’a déchiré le coeur Il m’a volé ma fille Et volé mon honneur Oh oh oh, vilain matelot oh oh oh oh Dans le port de Marseille Y’a un joli bateau Dans le port de Marseille Y’a un joli bateau Dansant sur l’eau Y’a plus de capitaine Le capitaine est mort Trop grande fut sa peine A sauté par-dessus bord Oh oh oh il dort dans l’eau oh oh oh oh.",Edith Piaf
145,Le Métro de Paris,/edith-piaf/le-metro-de-paris.html,Milord,"Des escaliers mécaniques Portillons automatiques Couloirs de correspondance Heures de pointe et d’affluence Portières en mosaïque Labyrinthe fantastique Et toujours, en courant, Des gens qui vont et viennent Et encore, en courant, Les mêmes gens qui reviennent Et le métro qui flânait sous Paris Doucement s’élance et puis s’envole S’envole sur les toits de Paris  Des midinettes qui trottinent Des ouvriers qui cheminent Des dactylos qui se pressent Des militaires qui s’empressent Des employés qui piétinent Des amoureux qui butinent Et toujours, en courant, Des gens qui vont et qui viennent Et encore, en courant, Le mêmes gens qui reviennent Et le métro qui flânait sous Paris Doucement s’élance et puis s’envole S’envole sur les toits de Paris  Des escaliers mécaniques Portillons automatiques Des bruits de pas qui résonnent Dans les couloirs monotones Basilique fantastique Dans le faubourg électrique Le métro de Paris Gigantesque ver luisant Sur les toits de Paris A tissé des fils d’argent Et doucement Il s’étire sur les toits de Paris Et glisse, glisse, glisse, glisse, glisse…",Edith Piaf
146,Le Noël de La Rue,/edith-piaf/le-noel-de-la-rue.html,Je T'Ai Dans la Peau,"Petit bonhomme où t’en vas-tu Courant ainsi sur tes pieds nus Je cours après le Paradis Car c’est Noël à ce qu’on dit…  Le Noël de la rue C’est la neige et le vent Et le vent de la rue Fait pleurer les enfants La lumière et la joie Sont derrière les vitrines Ni pour toi, ni pour moi C’est pour notre voisine Mon petit, amuse-toi bien En regardant, en regardant Mais surtout, ne touche à rien En regardant de loin… Le Noël de la rue C’est le froid de l’hiver Dans les yeux grands ouverts Des enfants de la rue  Collant aux vitres leurs museaux Tous les petits font le gros dos Ils sont blottis comme des Jésus Que Sainte-Marie aurait perdus…  Le Noël de la rue C’est la neige et le vent Et le vent de la rue Fait pleurer les enfants Ils s’en vont reniflant, Il s’en vont les mains vides Nez en l’air et cherchant Une étoile splendide Mon petit, si tu la vois Tout en marchant, tout en marchant Chauffes-y tes petits doigts Tout en marchant bien droit Le Noël de la rue C’est au ciel de leur vie Une étoile endormie Qui n’est pas descendue…",Edith Piaf
147,Le Petit Brouillard,/edith-piaf/le-petit-brouillard.html,A L'Olympia 1962,Toujours ce sale petit brouillard Toujours ce sale petit cafard Qui vous transperce jusqu’aux os Et qui se colle à votre peau  Il me semble le voir encore Le soir où son copain du port Lui apporta le faux passeport Et son visa pour Buenos Aires J’ignore ce qu’il avait fait Je n’avais compris qu’une chose Que sa dernière chance était Qu’il prenne ce navire à l’aube Et quand vint l’heure du départ Je reçus son dernier regard Dans le petit matin blafard Déchiré par les sirènes  Toujours ce sale petit brouillard Toujours ce sale petit cafard Qui nous transperce jusqu’aux os Et qui se colle à votre peau  La passerelle était levée Et c’est quand je l’ai cru sauvé Que des hommes sont arrivés Et l’on fait redescendre à terre J’ignore ce qu’il avait fait Mais pour ne pas me compromettre Il passa menottes aux poignets Sans avoir l’air de me connaître Et depuis qu’ils l’ont emmené Je pense à lui des jours entiers En regardant les longs courriers Diminuer et disparaître  Toujours ce sale petit brouillard Toujours ce sale petit cafard Toujours ce sale petit brouillard Toujours ce sale petit cafard Toujours ce sale petit brouillard Toujours ce sale petit cafard…,Edith Piaf
