,Nome da Música,link,album,letra,artista
0,À L'enseigne de La Fille Sans Coeur,/edith-piaf/a-lenseigne-de-la-fille-sans-coeur.html,Une Vie em Chansons,"Le ciel est bleu, le vent du large Creuse la mer bien joliment Vers le port montant à la charge Galoppent seize escadrons blancs C'est un port tout au bord du monde Dont les rues s'ouvrent sur l'infini Mais de là comme la terre est ronde, On ne voit pas les Etats-Unis. Tout le monde s'en fout, 'y a du bonheur 'y a un bar chez Rita la blonde Tout le monde s'en fout, 'y a du bonheur À l'enseigne de la Fille Sans Coeur! L'accordéon joue en majeur Les refrains de ce vaste monde 'y a la belle blonde, Cette rose en fleur, À l'enseigne de la Fille Sans Coeur. Dans ce petit bar, c'est là qu'elle règne On voit flamber sa toison d'or Sa bouche est comme un fruit qui saigne Mais on dit que son coeur est mort Pourtant les gars sont là, tout drôles: Les p'tits, les durs, les malabars Qui entrent en roulant des épaules 'y en a qui sont venus d'Dakkar. 'y en a d'Anvers, 'y en a d'Honfleur, Bourlinguant parfois jusqu'aux pôles Ils la regardent, c'est tout leur bonheur, Mais pas un ne connaît ses faveurs L'accordéon joue en majeur Tous les airs: les tristes, les drôles... 'y a des gars qui jouent leur bonheur À l'enseigne de la Fille Sans Coeur. Le patron connaissait la musique: Il aimait le son des écus Il disait à sa fille unique: ""Fuis l'amour, c'est du temps perdu!"" Mais un soir, la mer faisait rage... On vit entrer un étranger Aux beaux yeux d'azur sans nuages C'est alors que tout a changé... Il a regardé la fille sans coeur Elle était comme un ciel d'orage Quelqu'un a fait: ""'y a un malheur"" On entendait battre les coeurs. L'accordéon joue en mineur Un refrain dans le vent sauvage 'y a une fille le visage en pleurs À l'enseigne de la Fille Sans Coeur. Il a dit: ""C'est toi, ma divine!"" Elle répondit: ""Je suis à toi..."" Il l'a serrée sur sa poitrine Elle a pleuré entre ses bras. Les autre alors mélancoliques Sont partis avec un soupir... Le vent chantait sur l'Atlantique Pour ce coeur qui venait de s'ouvrir Ils ont filé vers leur grand bonheur Le patron dut fermer boutique On l'a vu boire toutes ses liqueurs À l'enseigne de la Fille Sans Coeur Oui, mais l'Etat, cet accapareur, Qu'a toujours les sens du comique A mis le bureau du Percepteur À l'enseigne de la Fille Sans Coeur...",Edith Piaf
1,A Quoi Ça Sert L'amour,/edith-piaf/a-quoi-ca-sert-lamour.html,A L'Olympia 1962,"À quoi ça sert, l'amour ? On raconte toujours Des histoires insensées À quoi ça sert d'aimer ?  L'amour ne s'explique pas ! C'est une chose comme ça ! Qui vient on ne sait d'où Et vous prend tout à coup.  Moi, j'ai entendu dire Que l'amour fait souffrir, Que l'amour fait pleurer, À quoi ça sert d''aimer ?  L'amour, ça sert à quoi ? À nous donner d'la joie Avec des larmes aux yeux... C'est triste et merveilleux !  Pourtant on dit souvent L'amour c'est décevant Qu'il y en a un sur deux Qui n'est jamais heureux...  Même quand on l'a perdu L'amour qu'on a connu Vous laisse un goût du miel - L'amour c'est éternel !  Tout ça c'est très joli, Mais quand tout est fini Il ne vous reste rien Qu'un immense chagrin...  Tout ce qui, maintenant, Te semble déchirant Demain, sera pour toi Un souvenir de joie !  En somme, si j'ai compris, Sans amour dans la vie, Sans ses joies, ses chagrins, On a vécu pour rien ?  Mais oui! Regarde-moi ! à chaque fois j'y crois ! Et j'y croirai toujours... Ça sert à ça l'amour !  Mais toi, t'es le dernier ! Mais toi, t'es le premier ! Avant toi y' avait rien Avec toi, je suis bien !  C'est toi que je voulais ! C'est toi qu'il me fallait ! Toi que j'aimerai toujours... Ça sert à ça l'amour !",Edith Piaf
2,Adieu Mon Coeur,/edith-piaf/adieu-mon-coeur.html,Une Vie em Chansons,Adieu mon coeur On te jette au malheur Tu n`auras pas mes yeux Pour mourir... Adieu mon coeur Les échos du bonheur Font tes chants tristes Autant qu`un repentir  Autrefois tu respirais le soleil d`or Tu marchais sur des trésors On était vagabonds. On aimait les chansons. Ç`a fini dans les prisons.  Adieu mon coeur On te jette au malheur. Tu n`auras pas mes yeux Pour mourir... Adieu mon coeur Les échos du bonheur Font tes chants tristes Autant qu`un repentir... Un repentir...,Edith Piaf
3,Autumn Leaves,/edith-piaf/autumn-leaves.html,Une Vie em Chansons,"The falling leaves Drift by the window The autumn leaves All red and gold I see your lips The summer kisses The sunburned hands I used to hold. Since you went away The days grow long... And soon I'll hear Old winter songs But I miss you most of all My darling, when autumn leaves start to fall... C'est une chanson Qui nous ressemble Toi qui m'aimais Et je t'aimais Nous vivions tous les deux ensemble Tou qui m'aimais Moi qui t'aimais Mais la vie sépare Ceux qui s'aiment Tout doucement Sans faire de bruit Et la mer efface sur le sable Les pas des amants désunis. Since you went away The days grow long... And soon I'll hear Old winter songs But I miss you most of all My darling, when autumn leaves start to fall...",Edith Piaf
4,Avant L'heure,/edith-piaf/avant-lheure.html,30 Anniversaire: l' Intégrale 1946-1963,"Avant l’heure, c’est pas l’heure Après l’heure, c’est plus l’heure Je l’ai rencontré un peu trop tard Il avait déjà vu Germaine Il m’a aimée pendant cinq semaines Je me foutais du tiers comme du quart Et puis un jour, il a compris Il m’a menti encore trois semaines Puis il est allé vers Germaine. Ah mes enfants! Qu’est-ce que j’ai pris!... Je lui en veux pas… Que faire à ça? Avant l’heure, c’est pas l’heure Après l’heure, c’est plus l’heure Quand on dit “moins le quart”, c’est moins le quart! Je l’ai rencontré un peu trop tard!  Pierre aime la femme de Jean Jean aime la femme de Pierre La femme de Pierre aime un sergent La femme de Jean aime un notaire Qu’est-ce qu’ils espèrent Ces pauvres gens? Si la femme de Pierre avait vu le sergent Avant de rencontrer Pierre… Si la femme de Jean avait vu le notaire Avant de rencontrer Jean… Ce serait une toute autre affaire! ‘y aurait du bonheur à Nogent Au lieu qu’on y pleure…  L’heure, c’est l’heure…  Avant l’heure, c’est pas l’heure Après l’heure, c’est plus l’heure Quand on dit “moins le quart”, c’est moins le quart! Je l’ai rencontré un peu trop tard!  Trop tard!...",Edith Piaf
5,Avant Nous,/edith-piaf/avant-nous.html,30 Anniversaire: l' Intégrale 1946-1963,"Un printemps meurt, en vient un autre Et tout change, et tout est pareil Le bonheur n’est pas le nôtre Pas plus que le soleil Écoute, écoute dans le monde Cet orchestre de coeurs battants De partout ils se répondent Depuis combien de temps?  Avant nous D’autres amants ont dit: “Je t’aime” Comme nous… Avant nous D’autres ont souffert, ont trahi même Comme… Non! Ne crois pas ça! Ne crois pas ça! L’amour n’est pas cette misère L’amour, c’est toi entre mes bras… Avant nous D’autres ont dansé sur des “Je t’aime” Comme nous… Avant nous D’autres se sont quittés quand même Comme… Non! Pas comme nous...Ne crois pas ça! On a dansé sur toute la terre Et l’on dansera sur ces mots-là  Aimons-nous Comme ceux-là qui tant s’aimèrent Comme nous Et comme ceux qui nous suivront Et comme ceux qui s’aimeront Après nous…",Edith Piaf
6,Avec Ce Soleil,/edith-piaf/avec-ce-soleil.html,At the Paris Olympia,"Avec ce soleil on avait envie De ne pas parler De boire de la vie A petites goulées Sous le ciel superbe Le long du talus, mâchant un brin d’herbe Et jupe collée, elle regardait D’un air triomphant Ce jeune homme imberbe Ou encore presqu’enfant Qui la désirait Il aurait fallu presque rien, peut-être Un geste de lui Un sourire d’elle qui lui dise “viens” Il aurait fallu presque rien, peut-être Qu’un oiseau s’enfuie Avec un bruit d’ailes pour que tout soit bien…  Pour que par-dessus le toit de l’usine Le long des murs gris Pour que par-dessus la route voisine Et ses pavés gris Pour que par-dessus toutes les collines Pour que par-dessus toutes les forêts Pour que monte au ciel sans cloches et sans noces Un amour de gosses Qui purifierait… Mais c’étaient déjà deux enfants durcis Qui ne croyaient plus d’avoir à se dire Que les mots des grands… Que la vie déjà, broyait sans merci Qui ne savaient plus ni rêver, ni rire Coeur indifférent…  Et ce jour encore Le long du talus Le coquelicots avec les bleuets En vain attendirent Une main cruelle Qui les cueillerait…",Edith Piaf
7,Bal Dans Ma Rue,/edith-piaf/bal-dans-ma-rue.html,Une Vie em Chansons,"Ce soir, il y a bal dans ma rue Jamais encore, on n’avait vu Une telle gaieté, une telle cohue Il y a bal dans ma rue Et dans le petit bistrot Où la joie coule à flots Sept musiciens perchés sur un tréteau Jouent pour les amoureux Qui tournent deux par deux Le rire aux lèvres et les yeux dans les yeux Ce soir, il y a bal dans ma rue Tout le monde se sent un peu ému Peut-être bien qu’on a trop bu Il y a bal dans ma rue  Il était si beau que lorsqu’il me sortait Aussitôt tout le monde sur lui se retournait J’étais si fière de lui, j’ai pas pu résister A ma meilleure amie, un jour je l’ai présenté Ils se sont mariés ce matin Ils formaient un couple épatant Et moi, j’étais témoin… Et voilà pourquoi…  Ce soir, il y a bal dans ma rue Jamais encore on n’avait vu Une telle gaieté, une telle cohue Il y a bal dans ma rue Et dans le petit bistrot Où la joie coule à flots Sept musiciens perchés sur un tréteau Jouent pour les amoureux Qui tournent deux par deux Le rire aux lèvres et les yeux dans les yeux Ce soir, il y a bal dans ma rue Jamais encore on n’avait vu Une telle gaieté, une telle cohue Il y a bal dans ma rue… Y a eu bal dans ma rue…",Edith Piaf
8,Boulevard Du Crime,/edith-piaf/boulevard-du-crime.html,La Môme de Paris,"Sur le boulevard du Crime Pour voir la pantomime Ce soir on se bouscule Au théâtre des Funambules Les amours de Pierrot Ça fait pleurer Margot Et rire dans la tourmente Le Paris de mille huit cent trente Masques sont vert damasques Et la foule coasse Au milieu du carnaval des grimaces  Mais dans la foule qui rit de Pierrot Il y a toujours un Arlequin Dans la vie, faut des arlequins Sans quoi l’amour ce ne serait que des mots Aussi lorsque Pierrot sourit C’est là-haut vers les amants du paradis…  Sur le boulevard du Crime Pour voir la pantomime Ce soir on se bouscule Au théâtre des Funambules Les amours de Pierrot Ça fait pleurer Margot Et rire dans la tourmente Le Paris de mille huit cent trente Masques sont vert damasques Pour des danses fantasques Et la foule coasse Au milieu du carnaval des grimaces  Mais tous ces gens qui rient de Pierrot Il n’y a que lui, pleure pour de vrai Puisque la femme qu’il aimait Est partie ce soir sans un mot Aussi lorsque Pierrot sourit Tout là-haut pleurent les amants du paradis…  Sur le boulevard du Crime Pour voir la pantomime Ce soir on se bouscule Au théâtre des Funambules Les malheurs de Pierrot Sous les cris, les bravos Font rire dans la tourmente Le Paris de mille huit cent trente Quel talent fantastique Qu’il est drôle et comique Ça, c’est un vrai Pierrot Allez! Vas-y! Refais ton numéro…  Tout là-haut pleurent les amants du paradis.",Edith Piaf
9,Bravo Pour Le Clown,/edith-piaf/bravo-pour-le-clown.html,Die Grossen Erfolge: Die Grossen Chansons,"Un clown est mon ami Un clown bien ridicule Et dont le nom s’écrit En gifles majuscules Pas beau pour un empire Plus triste qu’un chapeau Il boit d’énormes rires Et mange des bravos  Pour ton nez qui s’allume Bravo! Bravo! Tes cheveux que l’on plume Bravo! Bravo! Tu croques des assiettes Assis sur un jet d’eau Tu ronges des paillettes Tordu dans un tonneau Pour ton nez qui s’allume Bravo! Bravo! Tes cheveux que l’on plume Bravo! Bravo!  La foule aux grandes mains S’accroche à ses oreilles Lui vole ses chagrins Et vide ses bouteilles Son coeur qui se dévisse Ne peut les attrister C’est là qu’ils applaudissent La vie qu’il a ratée!  Pour ta femme infidèle Bravo! Bravo! Et tu fais la vaisselle Bravo! Bravo! Ta vie est un reproche Qui claque dans ton dos Ton fils te fait les poches Et toi, tu fais l’idiot Pour ta femme infidèle Bravo! Bravo! Et tu fais la vaisselle Bravo! Bravo!  Le cirque est déserté Le rire est inutile Mon clown est enfermé Dans un certain asile Succès de camisole Bravos de cabanon Des mains devenues folles Lui battent leur chanson  Je suis roi et je règne Bravo! Bravo! J’ai des rires qui saignent Bravo! Bravo! Venez, que l’on m’acclame J’ai fait mon numéro Tout en jetant ma femme Du haut du chapiteau Bravo! Bravo! Bravo! Bravo!",Edith Piaf
10,Browning,/edith-piaf/browning.html,1935-1942 / 1936-1945,"Y’avait qu’à regarder sa figure Et tout de suite on comprenait Monsieur Browning qu’on l’appelait Un nom qui sentait l’aventure C’était le roi du revolver Il en avait de magnifiques Qu’il avait ramenés d’Amérique Où qu’on fabrique les vrais gangsters Il nous racontait son histoire Son premier crime et puis la gloire Browning Browning Il nous montrait des tas de photos Prises en première page des journaux Browning Browning Il nous disait: “Vous autres en France Vous manquez encore d’expérience” Browning Browning Avec ça pas besoin d’être fort C’est le maladroit qu’a toujours tort Et vive Browning  Parce qu’il avait de l’élégance Et des costumes de cinéma Il nous regardait de haut en bas Avec mépris et insolence Et toutes nos femmes elles l’admiraient “Ah! comment c’est qu’il a d’allure Et ce type là quelle envergure” Mais nous les hommes il nous courait C’était toujours la même histoire Son premier crime et puis la gloire Browning Browning On le voyait sur les grands journaux Juste à côté de Greta Garbo Browning Browning A l’écouter on devenait bête On n’avait plus que ça dans la tête Browning Browning Et nous pensions “Marre à la fin Il nous ennuie l’Américain Et son Browning”  Pour nous apprendre la vraie manière Pour nous donner une bonne leçon Il a tenu ce brave garçon A nous montrer son savoir-faire C’est dans une salle de restaurant Qu’il a voulu faire l’expérience Mais le pauvre type n’a pas eu de chance, Comme il sortait ses instruments Il a roulé sous la banquette Avec un petit trou dans la tête Browning Browning Oh ça n’a pas claqué bien fort Mais tout de même il en est mort Browning Browning Et puis quelqu’un dans le silence A dit “Maintenant à quoi que tu penses Browning Browning” Il pense plus rien puisqu’il est mort Tu parlais trop… ben t’as eu tort Bye-Bye, Browning.",Edith Piaf
11,C'est à Hambourg,/edith-piaf/cest-a-hambourg.html,Au Carnegie Hall,"C’est à Hambourg, à Santiago A White Chapel, ou Bornéo C’est à Hambourg, à Santiago A Rotterdam, ou à Frisco…  Hello boy! You come with me? Amigo! Te quiero mucho! Liebling! Kom dort mit mir!  C’est à Hambourg, au ciel de pluie Quand les nuages vont à pas lents Comme s’en vont les lourds chalands Le long des quais, crevant d’ennui C’est à Hambourg ou bien ailleurs Qu’à tous les gars en mal d’amour Qu’à tous les gars, depuis toujours, Moi je balance du rêve en plein coeur…  C’est à Hambourg, à Santiago A White Chapel, ou Bornéo C’est à Hambourg, à Santiago A Rotterdam, ou à Frisco…  C’est à Hambourg, au ciel de pluie Qu’il a posé ses mains sur moi Et qu’il m’a fait crier de joie En me serrant fort contre lui M’a dit “je t’aime!” à plus finir “Laisse donc là tous tes marins! Laisse donc la mer, et puis viens! Moi, j’ai du bonheur à t’offrir...”  “Ma petite gueule...”  C’est à Hambourg, au ciel de pluie Dans les bastringues à matelots Que je trimballe encore ma peau Les bras ouverts à l’infini… Car moi je suis comme la mer, J’ai le coeur trop grand pour un seul gars J’ai le coeur trop grand et c’est pour ça Que j’ai pris l’amour sur toute la terre…  C’est à Hambourg, à Santiago A White Chapel, ou Bornéo…  So long, boy… Adios, amigo… Nacher, Schatz… Au revoir, petite gueule!...",Edith Piaf
12,C'est de La Faute à Tes Yeux,/edith-piaf/cest-de-la-faute-a-tes-yeux.html,,"J’avais tant d’amour pour un homme Il en avait si peu pour moi C’est peu de chose la vie, en somme Je l’ai tué, tant pis pour moi…  Tout ça… C’est de la faute à ses yeux Aux tiédeurs des matins A son corps près du mien Tout ça… C’est de la faute aux beaux jours C’est de la faute à l’amour Le ciel était trop bleu…  L’avocat qui prit ma défense Conta notre roman d’amour Et pour prouver mon innocence Il en salit les plus beaux jours…  Tout ça… C’est de la faute à tes yeux Aux tiédeurs des matins A son corps près du mien Tout ça… C’est de la faute aux beaux jours C’est de la faute à l’amour Mon ciel était trop bleu…  Le juge avait un air sévère Ses yeux n’avaient pas d’horizon D’une voix grave et sans colère M’a condamnée à la prison  Tout ça… C’est de la faute à mes yeux Ils ont vu dans les tiens Que dansait mon chagrin Tout ça… C’est de la faute aux beaux jours Et j’ai vu mon amour Pleurer sur mon ciel bleu…",Edith Piaf
13,C'est L'amour,/edith-piaf/cest-lamour.html,Die Grossen Erfolge: Die Grossen Chansons,"C’est l’amour qui fait qu’on aime C’est l’amour qui fait rêver C’est l’amour qui veut qu’on s’aime C’est l’amour qui fait pleurer…  Mais tous ceux qui croient qu’ils s’aiment Ceux qui font semblant d’aimer Oui, tous ceux qui croient qu’ils s’aiment Ne pourront jamais pleurer…  Dans l’amour, il faut des larmes, Dans l’amour, il faut donner…  Et ceux qui n’ont pas de larmes Ne pourrons jamais aimer… Il faut tant, et tant de larmes Pour avoir le droit d’aimer…  Mon amour, oh toi que j’aime Tu me fais souvent pleurer…  J’ai donné, donné mes larmes J’ai pleuré pour mieux t’aimer J’ai payé de tant de larmes Pour toujours le droit d’aimer… Pour toujours… le droit d’aimer!",Edith Piaf
14,C'est La Moindre Des Choses,/edith-piaf/cest-la-moindre-des-choses.html,L' Integrale 1936-1945,"C'était un jour de printemps On n'avait pas le temps De penser au travail de la semaine Pour ne pas être en retard On a sauté dans l' car Qui nous a déposés à Suresnes Ah ! Que tout semblait joli Par ce bel après-midi Et c'est alors que j'ai rencontré Le gars dont j'ai toujours rêvé  Il me dit ""Je vous aime"" Je lui dis ""Moi de même"" C'était la moindre des choses Il me dit ""On s' tutoie ?"" Je lui dis ""Ça va d' soi"" C'était la moindre des choses  Alors, sans bien comprendre Moi, je l'ai suivi Ses yeux étaient si tendres Que mon c?ur fondit Il me dit ""Embrasse-moi"" Je lui dis ""Tiens, sers-toi"" C'était la moindre des choses  Tous les deux on s' donnait L'air de crâner D' pas s'en faire Mais au fond, on était Deux timides Lui vis-à-vis d' ses copains Il prenait l'air malin J' l'écoutais, je le trouvais splendide Tant qu'on était au dancing Il tenait à son standing Mais quand on s'est r'trouvés sur le quai C'était plus l' même, sa voix tremblait  Il m'a dit ""Viens, p'tite tête"" Je lui dis ""Je suis prête"" C'était la moindre des choses Il m'a dit ""Toute la nuit"" Alors, moi, j'ai dit oui C'était la moindre des choses  On a marché dans l'ombre Tout le long du chemin Et comme il faisait sombre Il tenait ma main Il me dit ""C'est sérieux"" J'ai rien dit, c'était mieux C'était la moindre des choses  Quand le matin est venu Il avait l'air ému De quelque chose qu'il voulait pas dire Il reprenait l'air faraud Oui, mais ça sonnait faux J' voyais qu'il se forçait à sourire Moi, j'avais le c?ur bien gros Oui, bien sûr, c'était trop beau C'était l' moment de se dire adieu Et j'avais des larmes dans les yeux  Il me dit ""Sois docile Car vois-tu, notre idylle C'était la moindre des choses On se voit, on se quitte Et puis on oublie vite C'est bien la moindre des choses"" Mais comme j'ouvrais la porte Dans le matin bleu Il m' dit ""T'es la plus forte Reste, si tu veux"" Et depuis ce beau jour On n' fait qu'un pour toujours C'était la moindre des choses !",Edith Piaf
15,C'est Lui Que Mon Coeur A Choisi,/edith-piaf/cest-lui-que-mon-coeur-a-choisi.html,1935-1942 / 1936-1945,"Je me rappelle plus comment on s’était rencontrés Je ne sais plus si c’est lui qui a parlé le premier Ou bien si c’était moi qu’avais fait les avances Ça n’a pas d’importance Tout ce que je veux me rappeler:  REFRAIN: C’est lui que mon coeur a choisi Et quand y me tient contre lui Dans ses yeux caressants Je vois le ciel qui fout le camp C’est beau c’est épatant Il a pas besoin de parler Il a qu’à me regarder Et je suis à sa merci Je ne peux rien contre lui Car mon coeur l’a choisi  Je ne sais pas s’il est riche ou s’il a des défauts, Mais de l’aimer comme je l’aime, un homme est toujours beau. Et quand on va danser, qu’il pose sur mes hanches Ses belles mains si blanches, Ça me fait froid dans le dos.  REFRAIN  Je sais pas ce qui m’arrivera, si ça durera longtemps, Mais je me fiche du plus tard, je veux penser qu’au présent. En tout cas il m’a dit qu’il m’aimerait toute la vie Ce que la vie sera jolie Si il m’aime… pour tout le temps!",Edith Piaf
16,C'est Merveilleux,/edith-piaf/cest-merveilleux.html,30 Anniversaire: l' Intégrale 1946-1963,Le jour où tu m’as rencontrée Était un jour triste à mourir Et je traînais dans mes pensées Un chagrin à n’en plus finir Mais il a suffi que tu viennes Pour que j’oublie toutes mes peines  C’est merveilleux Quand on est tous les deux Le bonheur nous surveille C’est merveilleux Quand on est amoureux Les beaux jours se réveillent C’est merveilleux La vie est peinte en bleu A grands coups de soleil Puisque je t’aime Et que tu m’aimes C’est merveilleux!  Nous passerons toute la vie A chanter un si grand amour Pour une chanson si jolie La vie n’a pas assez de jours Nous en ferons une harmonie Qui ne sera jamais finie…  C’est merveilleux Quand on est tous les deux Le bonheur nous surveille C’est merveilleux Quand on est amoureux Les beaux jours se réveillent C’est merveilleux La vie est peinte en bleu A grands coups de soleil Puisque je t’aime Et que tu m’aimes C’est merveilleux!,Edith Piaf
17,C'est Peut-être Ça,/edith-piaf/cest-peut-etre-ca.html,30 Anniversaire: l' Intégrale 1946-1963,"C'est peut-être ça L'amour, le grand amour, C'est peut-être ça Qui m'a prise à mon tour, Ce je ne sais trop quoi Qui fait froid dans le dos Et soudain donne chaud Quand tout le monde a froid...  C'est peut-être ça Qui fait battre le cœur Et, pendant des heures, Vous fera rester là Devant un téléphone Pour entendre une voix, Devant un téléphone Qui ne sonnera pas...  C'est peut-être ça, L'amour, le grand amour, C'est peut-être ça Qui m'a prise à mon tour, Ce sentiment brutal, Lorsque tout allait bien, De se sentir très mal Sans savoir d'où ça vient.  C'est peut-être ça Qui fait pleurer de rire Et vous fait courir A minuit sous la pluie, Sous la pluie, sans manteau En gueulant qu'il fait beau, En gueulant que la vie, 'y a rien de plus joli... Avant, juste avant D'aller se foutre à l'eau...  C'est peut-être ça L'amour...Le grand amour !...",Edith Piaf
18,C'est Pour Ça,/edith-piaf/cest-pour-ca.html,Au Carnegie Hall,"Il était une amoureuse Qui vivait sans être heureuse. Son amant ne l'aimait pas. C'est drôle, mais c'était comme ça. Elle courut à la fontaine Afin d'y noyer sa peine Et tout le diable et son train La poussaient dans le chemin.  C'est pour ça que l'amour pleurait dans son coin, C'est pour ça que le ciel n'y comprenait rien. Les jours de lumière, Les mots des prières, Tous en procession, Lui faisaient escorte Mais la fille est morte En criant : \""pardon\"". C'est pour ça que l'amour pleurait dans son coin, C'est pour ça que le ciel n'y comprenait rien...  Toutes les fleurs se fanèrent Et la nuit couvrit la terre Pour chanter le dernier jour De cette morte d'amour. Échappés du noir manège, Les mal-aimés en cortège Partent essayer d'empêcher Le soleil de se lever.  C'est pour ça que l'amour n'avait plus d'amis, C'est pour ça que le ciel cherchait un abri. Les jeux et les rondes, Toutes les joies du monde Voulaient s'en aller Et le cœur des hommes, Tout pourri d'automne Allait se fâner... C'est pour ça que l'amour n'avait plus d'amis, C'est pour ça que le ciel cherchait un abri.  Mais voilà que ma légende Va danser sous les guirlandes. Ça ne pouvait pas durer. L'amour a tout arrangé Et, depuis, c'est lui qui chante. Tant pis pour qui se tourmente. Vous pouvez toujours pleurer. Il est plus fort à chanter...  C'est pour ça qu'on entend les accordéons, C'est pour ça que la rue éclate en chansons. Le chagrin des âmes, Dans tout ce vacarme, On ne l'entend plus. L'amour fait la fête Et chacun, c'est bête, A cœur que veux-tu. C'est pour ça qu'on entend les accordéons, C'est pour ça que la rue éclate en chansons.",Edith Piaf
