,Nome da Música,link,album,letra,artista
201,Scheiße (DJ White Shadow Mugler),/lady-gaga/scheibe-dj-white-shadow-mugler.html,Born This Way (Deluxe Version),I don't speak german But I can if you like (like like like)  Ich bin mir absolut klar Ich trag den Namen Monster I wish we all could be blind It become easy (easy) out there  I'll take you out tonight Do whatever you like I wish I had your mind Your dirty mind  Put on a close night Do whatever you like I wish I had your mind Your dirty mind  I I I I (oh oh oh oh oh)  I don't speak german But I can if you like  Ich bin mir absolut klar Ich trag den Namen Monster I wish we all could be blind It become easy (easy) out there,Lady Gaga
202,Scheiße (Guéna Lg Club Remix),/lady-gaga/scheibe-guena-lg-club-remix.html,Born This Way - The Remix,"Ich schleiban austa be clair Es kumpent madre monstere Aus-be aus-can-be flaugen Begun be uske but-bair  Ich schleiban austa be clair Es kumpent madre monstere Aus-be aus-can-be flaugen Fräulein uske-be clair  Ich schleiban austa be clair Es kumpent madre monstere Aus-be aus-can-be flaugen Begun be uske but-bair  Ich schleiban austa be clair Es kumpent madre monstere Aus-be aus-can-be flaugen Fräulein uske-be clair  Ich schleiban  I don't speak german, but I can if you'd like  But I can if you'd like  I don't speak german, but I can if you'd like  But I can if you'd like  I don't speak german, but I can if you'd like  But I can if you'd like  I don't speak german, but I can if you'd like  But I can if you'd like  I don't speak german, but I can if you'd like  But I can if you'd like  I don't speak german, but I can if you'd like  Ich schleiban austa be clair Es kumpent madre monstere Aus-be aus-can-be flaugen Begun be uske but-bair  Ich schleiban austa be clair Es kumpent madre monstere Aus-be aus-can-be flaugen Fräulein uske-be clair  Ich schleiban austa be clair Es kumpent madre monstere Aus-be aus-can-be flaugen Begun be uske but-bair  I'll take you out tonight Say whatever you like Scheiße-scheiße be mine Scheiße be mine (scheiße be mine)  Put on a show tonight Do whatever you like Scheiße-scheiße be mine Scheiße be mine (scheiße be mine)  When I'm on a mission I rebuke my condition If you're a strong female You don't need permission  I, I wish I got to dance on a single prayer I, I wish I could be strong without somebody there I, I wish I got to dance on a single prayer I, I wish I could be strong without the scheiße, yeh  Oh oh oh oh oh Without the scheiße, yeah Oh oh oh oh oh Without the scheiße, yeah Oh oh oh oh oh Without the scheiße, yeah Oh oh oh oh oh (I don't speak german but I wish I could) Without the scheiße, yeah  Ich schleiban austa be clair Es kumpent madre monstere Aus-be aus-can-be flaugen Begun be uske but-bair  Ich schleiban austa be clair Es kumpent madre monstere Aus-be aus-can-be flaugen Fräulein uske-be clair  Love is objectified by what men say is right Scheiße-scheiße be mine Bullshit be mine (bullshit be mine)  Blonde high-heeled feminist enlisting femmes for this Express your woman-kind Fight for your right (fight for your right)  When I'm on a mission I rebuke my condition If you're a strong female You don't need permission  I, I wish I got to dance on a single prayer I, I wish I could be strong without somebody there I, I wish I got to dance on a single prayer I, I wish I could be strong without the scheiße, yeh  Oh oh oh oh oh Without the scheiße, yeah Oh oh oh oh oh Without the scheiße, yeah Oh oh oh oh oh Without the scheiße, yeah Oh oh oh oh oh (I don't speak german but I wish I could) Without the scheiße, yeah  I, I, I, I, I, I I, I, I, I, I, I speak german I, I, I, I, I, I, but I can if you like  I, I, I, I, I, I I, I, I, I, I, I speak german I, I, I, I, I, I, but I can if you like  I, I wish I got to dance on a single prayer I, I wish I could be strong without permission, yeah I, I wish I got to dance on a single prayer I, I wish I could be strong without the scheiße, yeah  Strong without the scheiße  Oh oh oh oh oh Without the scheiße, yeah Oh oh oh oh oh Without the scheiße, yeah Oh oh oh oh oh Without the scheiße, yeah (I don't speak german but I wish I could) Without the scheiße, yeah  Ich schleiban austa be clair Es kumpent madre monstere Aus-be aus-can-be flaugen Begun be uske but-bair  Ich schleiban austa be clair Es kumpent madre monstere Aus-be aus-can-be flaugen Fräulein uske-be clair (uske-be clair)  But I can if you'd like  I don't speak german, but I can if you'd like  But I can if you'd like  I don't speak german, but I can if you'd like  But I can if you'd like  I don't speak german, but I can if you'd like  But I can if you'd like  I don't speak german, but I can if you'd like",Lady Gaga
203,"Scheiße, Born This Way, The Edge Of Glory (Medley)",/lady-gaga/scheibe-born-this-way-the-edge-of-glory-medley.html,,"I don't speak German, but I can if you'd like, Oh!  Isch lieben aus tubikler E a kat mi madre monster Alsch bi auschke wie falugen Bigon bi uske mugler  Isch lieben aus tubikler E a kat mi madre monster Alsch bi auschke wie falugen Bigon bi uske mugler  Isch lieben aus tubikler E a kat mi madre monster Alsch bi auschke wie falugen Bigon bi uske mugler  I'll take you out tonight Say whatever you like Scheiße-scheiße be mine Scheiße be mine  (Guten Abden, Deutschland)  My mama told me when I was young We are all born superstars She rolled my hair and put my lipstick on In the glass of her boudoir  'There's nothin wrong with lovin who you are' She said, 'cause he made you perfect, babe' 'So hold your head up girl and you'll go far Listen to me when I say'  I'm beautiful in my way 'cause god makes no mistakes I'm on the right track baby I was born this way  No matter gay, straight, or bi Lesbian, transgendered life I'm on the right track baby I was born to survive  There ain't no reason you and me should be alone Tonight yeah baby, tonight, yeah baby But I got a reason that you-hoo should take me home tonight I need a man that thinks it's right when it's so wrong Tonight yeah baby, tonight yeah baby Right on the limit's where we know we both belong tonight  It's hot to feel the rush To brush the dangerous I'm gonna run right to, to the edge with you Where we can both fall far in love  I'm on the edge of glory And I'm hanging on a moment of truth I'm on the edge of glory And I'm hanging on a moment with you I'm on the edge, the edge, the edge, the edge, the edge, the edge I'm on the edge of glory And I'm hanging on a moment with you I'm on the edge with you  Another shot before we kiss the other side Tonight yeah baby, tonight, yeah baby I'm on the edge of something final we call life tonight Alright, alright  Put on your shades 'Cause I'll be dancing in the flames Tonight yeah baby, tonight, yeah baby It isn't a hell if everybody knows my name tonight Alright, alright  It's hot to feel a rush To push the dangerous I'm gonna run right to, to the edge with you Where we can both fall far in love  I'm on the edge of glory And I'm hanging on a moment of truth I'm on the edge of glory And I'm hanging on a moment with you I'm on the edge, the edge, the edge, the edge, the edge, the edge I'm on the edge of glory And I'm hanging on a moment with you I'm on the edge with you  I'm on the edge with you I'm on the edge with you With you, with you  Come one, everyone Put your hands up with me, let's go  I'm on the edge of glory And I'm hanging on a moment of truth I'm on the edge of glory And I'm hanging on a moment with you I'm on the edge, the edge, the edge, the edge, the edge, the edge I'm on the edge of glory And I'm hanging on a moment with you (I'm on the edge with you)  With you  (Beauty is a lie!)",Lady Gaga
204,Scheisse,/lady-gaga/scheibe.html,Born This Way: The Collection,"I don't speak German, But I can if you like. Oh!  Ich schleiban austa be clair Es kumpent madre monstère Aus-be aus-can-be flaugen Begun be üske but-bair  Ich schleiban austa be clair Es kumpent madre monstère Aus-be aus-can-be flaugen fräulein uske-be clair  Ich schleiban austa be clair Es kumpent madre monstère Aus-be aus-can-be flaugen Begun be üske but-bair  Ich schleiban austa be clair Es kumpent madre monstère Aus-be aus-can-be flaugen fräulein uske-be clair  Ich schleiban austa be clair Es kumpent madre monstère Aus-be aus-can-be flaugen Begun be üske but-bair  Ich schleiban austa be clair Es kumpent madre monstère Aus-be aus-can-be flaugen fräulein uske-be clair  I'll take you out tonight Say whatever you like Scheisse-scheisse be mine Scheisse be mine (Scheisse be mine)  Put on a show tonight Do whatever you like Scheisse-scheisse be mine Scheisse be mine (Scheisse be mine)  When I'm on a mission I rebuke my condition If you're a strong female You don't need permission  I, I wish I got to dance on a single prayer I, I wish I could be strong without somebody there I, I wish I got to dance on a single prayer I, I wish I could be strong without the scheisse, yeh  Oh oh oh oh oh Without the scheisse, yeah Oh oh oh oh oh Without the scheisse, yeah Oh oh oh oh oh Without the scheisse, yeah Oh oh oh oh oh (I don't speak German but I wish I could) Without the scheisse, yeah  Ich schleiban austa be clair Es kumpent madre monstere Aus-be aus-can-be flaugen Begun be uske but-bair  Ich schleiban austa be clair Es kumpent madre monstere Aus-be aus-can-be flaugen fräulein uske-be clair  Love is objectified by what men say is right Scheisse-scheisse be mine Bullshit be mine (Bullshit be mine)  Blonde high-heeled feminist enlisting femmes for this Express your woman-kind Fight for your right (Fight for your right)  When I'm on a mission I rebuke my condition If you're a strong female You don't need permission  I, I wish I got to dance on a single prayer I, I wish I could be strong without somebody there I, I wish I got to dance on a single prayer I, I wish I could be strong without the scheisse, yeh  Oh oh oh oh oh Without the scheisse, yeah Oh oh oh oh oh Without the scheisse, yeah Oh oh oh oh oh Without the scheisse, yeah Oh oh oh oh oh (I don't speak German but I wish I could) Without the scheisse, yeah  I, I, I, I, I, I I, I, I, I, I, I don't speak German I, I, I, I, I, I, but I can if you like  I, I, I, I, I, I I, I, I, I, I, I don't speak German I, I, I, I, I, I, but I can if you like  I, I wish I got to dance on a single prayer I, I wish I could be strong without permission, yeah I, I wish I got to dance on a single prayer I, I wish I could be strong without the scheisse, yeah  Oh oh oh oh oh Without the scheisse, yeah Oh oh oh oh oh Without the scheisse, yeah Oh oh oh oh oh Without the scheisse, yeah (I don't speak German but I wish I could) Without the scheisse, yeah  Ich schleiban austa be clair Es kumpent madre monstere Aus-be aus-can-be flaugen Begun be uske but-bair  Ich schleiban austa be clair Es kumpent madre monstere Aus-be aus-can-be flaugen fräulein uske-be clair (uske-be clair)",Lady Gaga
205,Second Time Around,/lady-gaga/second-time-around.html,,"Oh oh oh yeah Babe  Last time I thought we had this talk Boy you were getting ready to leave I thought that baby you were done Cause for a while you could barely look at me  This time I thought that we`d be fine That I`d forget the things that you said I tried crossing out your words  But baby you can not forget the past Oh oh oh oh babe Can not forget the past Oh oh oh oh, Still baby (Babe)  I'm so unpredictable you don't know what to think So unemotional Wonder if I?m even still in love You see I don't know what to tell you now It's always harder the second time around  I'm so unpredictable Just like you used to be So unemotional Boy I can't forget the way you were with me I don't know what to tell you now It's always harder The second time around  The second time around  We tried going back to Joe's That always was our favourite place Long rides baby by the coast Do you remember where we stayed  Last time we were hanging out You were acting kind of strange Now it's the second time around I?m sorry now it's me that feels this way Oh oh oh oh babe (My heart just speaks to me) It`s me that feels this way Oh oh oh babe  I know you are the one that is hurting  I'm so unpredictable You don't know what to think So unemotional Wonder if I'm even still in love You see I don't know what to tell you now It's always harder the second time around  I'm so unpredictable Just like you used to be So unemotional Boy I can't forget the way you were with me I don't know what to tell you now It's always harder the second time around  I`m not sure the best way to say this But I can't pretend to love you no more babe This ferris wheel`s got me crazy Maybe the second time around is not meant for us babe Not meant for us babe hey-yeah!  I'm so unpredictable You don't know what to think So unemotional Wonder if I'm even still in love You see I don't know what to tell you now It's always harder the second time around  I'm so unpredictable Just like you used to be So unemotional Boy I can forget the way you were with me I don't know what to tell you now Its always harder the second time around  I'm so unpredictable You don't know what to think So unemotional Wonder if I'm even still in love You see I don't know what to tell you now It's always harder the second time around  I'm so unpredictable Just like you used to be So unemotional Boy I can forget the way you were with me I don't know what to tell you now It's always harder the second time around  The second time around",Lady Gaga
206,Sexxx Dreams,/lady-gaga/sexxx-dreams.html,ARTPOP,"(Last night) Our lovers quarreled (I was thinking about you) Hurts more than I can say (and it was kinda dirty) Oh my (and the way that you looked at me) Help me here (it was kind of nasty ah) , help me here (it was kind of trashy)  'Cause I can't help my mind from going there  Heard your boyfriend was away This weekend Wanna meet at my place? Heard that we both got nothing to do When I lay in bed I touch myself and think of you  Last night, damn You were in my sexx dreams (You were in my) Doing really nasty things (You were in my dreams) Damn, you were in my sexx dreams (You were in my) Making love in my sexx dreams  We could (I) be caught (just want this to be perfect) We're both convicted criminals of thought ('cause I'm broken) Let's white (by the one before) glove the bed (he was kind of nasty ah) Help me here (and I feel so trashy)  'Cause we can't hide the evidence In our heads  Heard your boyfriend was away This weekend Wanna meet at my place? Heard that we both got nothing to do When I lay in bed I touch myself and think of you  Last night, damn You were in my sexx dreams (you were in my) Doing really nasty things (you were in my dreams) Damn, you were in my sexx dreams (you were in my) Making love in my sexx dreams  (Don't stop the party) Making love in my sexx dreams (Let's keep it naughty yeah) Making love in my sexx dreams (Watch me and to do) making love in my sexx dreams Tomorrow when I run into you Tomorrow when I run into you  You can turn to stone all the color off Then petrified by a woman Love is all I am when I lay with you? I think of him, I think of him  I can't believe I'm telling you this But I've had a couple of drinks and ""oh my God""  Last night damn You were in my sexx dreams (you were in my) Doing really nasty things (You were in my dreams) Damn you were in my sexx dreams (You were in my)  Last night (don't stop the party) , damn you were in my sexx dreams (Let's keep it naughty yeah) doing really nasty things (Watch me and to do) damn You were in my sexx dreams (Tomorrow when I run into you) Making love in my sexx dreams",Lady Gaga
207,Sexy Ugly,/lady-gaga/sexy-ugly.html,,"Hold me daddy, real tight. They'll take our picture in the spotlight. Yeah, I know you love that limelight, And how that DJ's spinning tonight. DJ!  Wish it wash it down, Gonna paint the town pink. We don't care what you think, sorry.  Everybody wants to be like us, Filthy glamorous. Real hot body. Sexy ugly. Rock like us, silly and gorgeous. Real hot body. Sexy ugly.  Hold your mama real tight, She's turning colors in the black light. Soundophobic polite, Don't be afraid to shake that butt right.  Wish it wash it down, Gonna paint the town pink. We don't care what you think, sorry.  Everybody wants to be like us, Filthy glamorous. Real hot body. Sexy ugly. Rock like us, silly and gorgeous. Real hot body. Sexy ugly.  You sex pot. You sex pot. You are a sex pot. You are a sex pot. You sex pot. You sex pot. You are a sex pot. You are a sex pot. You, sex, and pot. Yeah.  Wish it wash it down, Gonna paint the town pink. We don't care what you think, sorry.  Everybody wants to be like us, Filthy glamorous. Real hot body. Sexy ugly. Rock like us, silly and gorgeous. Real hot body. Sexy ugly.  Be like us, Filthy glamorous. Real hot body. Sexy ugly. Rock like us, silly and gorgeous. Real hot body. Sexy ugly.",Lady Gaga
208,Shake Your Kitty,/lady-gaga/shake-your-kitty.html,,"Ow, come here boy  I met a drummer last week I pulled... down With... I want you more  He cried, ""Mother! What'd you do to me?"" I said, ""Mother mother mother's for babies Call me kitty.""  Yeah  Shake your kitty Shake your kitty (meow) Put your arms around me, babe I'm giving you permission to feel me  Shake your kitty Shake your kitty (meow) Put your arms around me, babe I'm giving you permission to feel me  Shake your shake Shake shake Shake your sh-shake Shake it, shake it Shake it, shake it Shake it, shake it  I took a drummer by the hand To the choke ... then We hit the floor With your ... pin And your dark side burns I want you more  He cried, ""Mother! What'd you do to me?"" I said, ""Mother mother mother's for babies Call me kitty.""  Oh, why dontcha  Shake your kitty Shake your kitty (meow) Put your arms around me, babe I'm giving you permission to feel me  Shake your kitty Shake your kitty (meow) Put your arms around me, babe I'm giving you permission to feel me  You'll never call me by my name But I still want you You play some pretty tricky games But I still want you Your best friend drives a fancy car But I still want you You're working every hour But, but I still want you yeah!  If you see a girl this pretty Shake her, shake her, shake her kitty When you see a girl that's pretty Shake it, shake it, shake that kitty  Shake your kitty (meow) Put your arms around me, babe I'm giving you permission to feel me  Shake your kitty Why don't you Shake your kitty (meow) Put your arms around me, babe I'm giving you permission to feel me  When you see a girl this pretty Shake her, shake her, shake her kitty When you see a girl that's pretty Shake your, shake your, shake that kitty  Shake your shake Shake it, shake it Shake it, shake it Shake it, shake",Lady Gaga
209,Shallow (With Bradley Cooper),/lady-gaga/shallow-with-bradley-cooper.html,,"Tell me somethin' girl Are you happy in this modern world? Or do you need more? Is there somethin' else you're searchin' for?  I'm falling In all the good times I find myself longing for change And in the bad times I fear myself  Tell me something boy Aren't you tired tryin' to fill that void? Or do you need more? Ain't it hard keeping it so hardcore?  I'm falling In all the good times I find myself longing for change And in the bad times I fear myself  I'm off the deep end, watch as I dive in I'll never meet the ground Crash through the surface, where they can't hurt us We're far from the shallow now  In the shallow, shallow In the shallow, shallow In the shallow, shallow We're far from the shallow now  Wooaah Woaah  I'm off the deep end, watch as I dive in I'll never meet the ground Crash through the surface, where they can't hurt us We're far from the shallow now  In the shallow, shallow In the shallow, shallow In the shallow, shallow We're far from the shallow now",Lady Gaga
210,Shut Up (Demo),/lady-gaga/shut-up-demo.html,,"Shut my babe up Move it, move it (What?) If you want me you better prove it, prove it (Let's go) I need your measurements to know if, know if (What?) I wanna take you home and do it",Lady Gaga
211,Sine From Above (with Elton John),/lady-gaga/sine-from-above-with-elton-john.html,Chromatica,"When I was young, I prayed for lightning My mother said it would come and find me I found myself without a prayer I lost my love and no one cared When I was young, I prayed for lightning  Yeah, I looked with my face up to the sky But I saw nothing there, no, no, nothing there Yeah, I stared while my eyes filled up with tears But there was nothing there, no, no, nothing  I heard one sine from above (Oh) I heard one sine from above (Oh) Then the signal split in two The sound created stars like me and you Before there was love, there was silence I heard one sine And it healed my heart, heard a sine  Healed my heart, heard a sine Healed my heart, heard a sine  When I was young, I felt immortal And not a day went by without a struggle I lived my days just for the nights I lost myself under the lights When I was young, I felt immortal  Yeah, I looked with my face up to the sky But I saw nothing there, no, no, nothing there Yeah, I stared while my eyes filled up with tears But there was nothing there, no, no nothing  I heard one sine from above (Oh) I heard one sine from above (Oh) Then the signal split in two The sound created stars like me and you Before there was love, there was silence I heard one sine And it healed my heart, heard a sine  Healed my heart, heard a sine Healed my heart, heard a sine  Then the signal split in two The sound created stars like me and you Before there was love, there was silence I heard one sine And it healed my heart, heard a sine  Healed my heart Healed my Heart, heard a sine Healed my Heart, heard a sine",Lady Gaga
212,Sinner's Prayer,/lady-gaga/sinners-prayer.html,Joanne,"I came down the mountain Draggin' on a love affair Put on a pretty little number I am wearing you still It was a hell of a scene at daddy's feast Nobody saw it coming, but the little red devil in me He has a funny way saying forever too fast Don't get mad, can't blame a tramp For something he don't have I get on my knees and beg you  Hear my sinner's prayer I am what I am And I don't wanna break the heart of any other man But you, but you Hear my sinner's prayer It's the only one I know It sure as hell don't rhyme But it's as good as, good as, good as, good as gold  Got a baby sister who looks just like me She wants nothing more than a man to please Maybe she's in too deep Her love for him ain't cheap But it breaks just like a knockoff piece From Fulton Street The man's got a gift for getting what he wants He's thirsty when he drinks Gets on a brink, and throws her off I get on my knees and beg you  Hear my sinner's prayer I am what I am And I don't wanna break the heart of any other man But you, but you Hear my sinner's prayer It's the only one I know It sure as hell don't rhyme But it's as good as, good as, good as, good as gold Good as, good as, good as, good as gold  I can carry you but not your ghosts Wish I had the faith but I don't know oh  Hear my sinner's prayer I am what I am And I don't wanna break the heart of any other man But you, but you Hear my sinner's prayer It's the only one I know It sure as hell don't rhyme But it's as good as, good as, good as, good as gold Good as, good as, good as, good as gold",Lady Gaga
213,Smile (One World: Together At Home),/lady-gaga/smile-one-world-together-at-home.html,,"Smile though your heart is breaking Smile even though it's aching When there are clouds in the sky, you'll get by  If you smile through your fear and sorrow Smile and maybe tomorrow You'll see the Sun come shining through for you  Light up your face with gladness Hide every trace of sadness Although a tear may be ever so near  That's the time you must keep on trying Smile, what's the use of crying? You'll see that life is still worthwhile If you just smile  You'll find that life is still worthwhile If you just smile",Lady Gaga
