,Nome da Música,link,album,letra,artista
62,Dancin' In Circles,/lady-gaga/dancin-in-circles.html,Joanne,"Tap down those boots while I beat around Let's funk downtown Tap down those boots while I beat around Funk me downtown  I lay around, touch myself to pass the time I feel down, I wish you were mine I close my eyes Take a breath and I picture us in a place I can't recognize  In the fire I call your name out (oh-o-oh-oo-ahh-ahh) Up all night tryin' to rub the pain out (oh-o-oh-oo-ahh-ahh)  I'm singin' Baby don't cry Baby don't cry Dancin' in circles, feels good to be lonely  Baby don't cry Baby don't cry Dancin' in circles, feels good to be lonely  Tap down those boots while I beat around Let's funk downtown Tap down those boots while I beat around Funk me downtown  I fool myself Swirl around as if I'm someone else Your hands are mine  I do a trick Pretend that I am you until it clicks I come alive Come alive  In the fire I call your name out (call your name out, call your name out) (oh-o-oh-oo-ahh-ahh) Call your name out Up all night tryin' to rub the pain out (rub the pain out, rub the pain out) (oh-o-oh-oo-ahh-ahh) Rub the pain out  I'm singin' Baby don't cry Baby don't cry Dancin' in circles, feels good to be lonely  Baby don't cry Baby don't cry Dancin' in circles, feels good to be lonely  Tap down those boots while I beat around Let's funk downtown  Hurts inside but not this time All the things that are on my mind Vanish as I touch myself Call out loud for you Oh can your hear me singin'?  Baby don't cry Baby don't cry Dancin' in circles, feels good to be lonely  Baby don't cry Baby don't cry I'm singin' Dancin' in circles, feels good to be lonely  Tap down those boots while I beat around Let's funk downtown",Lady Gaga
63,David Bowie Tribute (Grammy 2016),/lady-gaga/david-bowie-tribute-grammy-2016.html,,"Ground control to Major Tom Commencing countdown, engines on Check ignition, and may God's love be with you  This is ground control to Major Tom You've really made the grade And the papers want to know whose shirts you wear Now it's time to leave the capsule if you dare  Ch-ch-Changes Don't want to be a richer man Time may change me But I can't trace time  Ziggy played guitar Jamming good with Weird and Gilly And the spiders from Mars He played it left hand But made it too far Became the special man Then we were Ziggy's band  Oh don't lean on me man, cause you can't afford the ticket I'm back from Suffragette City Oh don't lean on me man Cause you ain't got time to check it You know my Suffragette City Is outta sight  Suffragette City  You've got your mother in a whirl She's not sure if you're a boy or a girl Rebel Rebel, you've torn your dress Rebel Rebel, your face is a mess Rebel Rebel, how could they know? Hot tramp, I love you so!  There's a brand new dance but I don't know its name Fashion! That people from bad homes do again and again Fashion! Fashion! Turn to the left Fashion! Turn to the right OOh, fashion! We are the goon squad and we're coming to town Beep-beep  Fame, makes a man take things over Fame, lets him loose, hard to swallow Fame, puts you there where things are hollow Fame Is it any wonder I reject you first? Fame, fame, fame, fame  (Under pressure)  Let's dance Put on your red shoes and dance the blues Let's dance To the song they're playin' on the radio If you say run, I'll run with you If you say hide, we'll hide Because my love for you Would break my heart in two If you should fall Into my arms And tremble like a flower  I, I will be king And you, you will be queen Though nothing will drive them away We can beat them, just for one day We can be Heroes, just for one day We can be Heroes, just for one day  We can be Heroes We can be Heroes We can be Heroes We can be Heroes just for one day You and me",Lady Gaga
64,Diamond Heart,/lady-gaga/diamond-heart.html,Joanne,"Young, wild, American Lookin' to be somethin' Out of school go-go'n For a hundred or two  Some asshole broke me in Wrecked all my innocence I'll just keep go-go'n And this dance is on you  One - five - ten Lay a million on me before the end of their song  Young, wild, American C'mon baby, do you have a girlfriend? Rain on me on a million I'm not flawless, but I gotta diamond heart Oh, I I might not be flawless but you know I gotta diamond heart Oh, I I might not be flawless but you know I gotta diamond... heart  Young wild american Head full of jameson Girl's playin' bad 'Cause it doesn't pay to be good  A cruel king made me tough Daddy's girl's never good enough I'll just keep go-go'n 'Cause this dance is on you  One - five - ten Lay a million on me before the end of their song  Young, wild, American C'mon baby, do you have a girlfriend? Rain on me on a million I'm not flawless, but I gotta diamond heart Oh, I I might not be flawless but you know I gotta diamond heart Oh, I I might not be flawless but you know I gotta diamond... heart  Good thing I know what I'm worth Want a good thing put the money down first Better get a good look baby 'Cause soon I'm breaking out of here  Young, wild, American C'mon baby, do you have a girlfriend? Rain on me on a million I'm not flawless, but I gotta diamond heart Oh, I I might not be flawless but you know I gotta diamond heart Oh, I I might not be flawless but you know I gotta diamond... heart",Lady Gaga
65,Diggin' My Grave (Feat. Bradley Cooper),/lady-gaga/diggin-my-grave-feat-bradley-cooper.html,,"You're killin' me baby with the things you do Put me in the ground before we're through Burnin' up this town Spendin' everythin' I've saved Yeah You've been out all night Diggin' my grave  Every little lie you tell can't keep it hid You're just another nail on the coffin lid Someone else is gettin' all the love you never gave Woo Yeah And you've been up all night Diggin' my grave, yeah  So keep on runnin' around Ain't no need to hurry back Cause I'll be gone from here And you'll be all dressed up in black  Six feet under baby that's where I'll be By the time that you're done with me All these tears I cry Drownin' in a tidal wave You've been out all night Diggin' my grave  So keep on runnin' around Ain't no need to hurry back Cause I'll be gone from here And you'll be all dressed up in black Woo  Six feet under baby that's where I'll be By the time that you're done with me All these tears I cry Drownin' in a tidal wave Yeah yeah You've been out all night Diggin' my grave You've been out all night Diggin' my grave  Diggin' my diggin' my diggin' my Diggin' my diggin' my diggin' my Diggin' my diggin' my diggin' my grave Diggin' my diggin' my diggin' my Diggin' my diggin' my diggin' my Diggin' my diggin' my diggin' my grave",Lady Gaga
66,Dirty Ice Cream,/lady-gaga/dirty-ice-cream.html,,"It's too much to mess and it stress me Figure out and too much pressure on us, babe Last night you took me to the mall And then it started to get physical  But we only been on one date, baby Yeah, I know it was fun till you start acting crazy I don't really find it very cute or sexy When you call incessantly or t-t-text me  Don't be dirty ice cream, baby We could fall in love but it's too early to be calling me like that Stop calling, stop calling It's not indecision, just my female intuition Doesn't mean you can be calling me like that Stop calling, stop calling  I can't live with you, yes it's true or live without The kinda guy that I'm about You kiss me like a rockstar and You always wanna hold my hand  But we only been on one date, baby Yeah, I know it was fun till you start acting crazy I don't really find it very cute or sexy When you call incessantly or t-t-text me  Don't be dirty ice cream, baby We could fall in love but it's too early to be calling me like that Stop calling, stop calling It's not indecision, just my female intuition Doesn't mean you can be calling me like that Stop calling, stop calling  Don't be, don't be (dirty ice cream) oh no Don't be, don't be (dirty ice cream) oh no  Don't be dirty ice cream, baby We could fall in love but it's too early to be calling me like that Stop calling, stop calling It's not indecision, just my female intuition Doesn't mean you can be calling me like that Stop calling, stop calling, uh-oh",Lady Gaga
67,Disco Heaven,/lady-gaga/disco-heaven.html,,"Oh, the disco heaven Oh, the disco heaven  Get back, bunny It's getting cold in here little honey We got a show to put on your dress Take a minute for us and relax, relax Cupid's got me, oh with his bow &amp; arrow, baby He'll hit you in the pants, hot pants Get the people to dance and relax, relax  Oh the lights still on, we're dancing Yeah the floor is shaking In this disco heaven (Oh, the disco heaven) The disco heaven  (Oh, the disco heaven)  Oh the lights still on, we're dancing Yeah the floor is shaking In this disco heaven (Oh, the disco heaven) The disco heaven  (Oh, the disco heaven)  Throw your head back, girly Throw it like those girls in the movies We got a show to put on your dress Take a minute for us and relax, relax  The ball is turning, 300 mirrors burning Through the hearts of the crowd In the back hips just banging the track To the music, the music  Oh the lights still on, we're dancing Yeah the floor is shaking In this disco heaven (Oh, the disco heaven) The disco heaven  (Oh, the disco heaven)  Oh the lights still on, we're dancing Yeah the floor is shaking In this disco heaven (Oh, the disco heaven) The disco heaven  (Oh, the disco heaven)  Oh we got that disco D-I-S-C-O And we're in heaven H-E-A-V-E-N Disco heaven  Feels just like heaven Disco heaven Disco heaven  A line up for the dance Yeah bring those fancy pants Y'know there's disco in the air And hairspray everywhere  A disco heaven A disco heaven Disco heaven Disco heaven  Oh the lights still on, we're dancing Yeah the floor is shaking In this disco heaven (Oh, the disco heaven) The disco heaven  (Oh, the disco heaven)  Oh the lights still on, we're dancing Yeah the floor is shaking In this disco heaven (Oh, the disco heaven) The disco heaven  (Oh, the disco heaven)",Lady Gaga
68,Do Me Right,/lady-gaga/do-me-right.html,,"(You know what I like) (Know-Know I-I)  Do it. (Do it, do it)  Feel like getting dirty now, 1, 2, 3 - My pants are down. Not gonna reason, you're gonna do, whatever I like. 'Cause I'm happy as a clam tonight.  I want everything, baby. Everything, baby. You know what I like. (You know what I like)  I need everything, baby. Everything, baby. And you're doing me right.  When you're out with all your friends, And you got money to spend Do me right-right Do me right-right Do me right (do it, do it)  ... I don't wanna In the club, or in the corner. Do me right-right Do me right-right Do me right (do it, do it)  Lick me, slap me, do it, do it. Do me right, there's nothing to it.  It's 'bout time you ice my cake. Wants someone who milks my shake Want to arrest me? Don't interest me, with your talk. Hapiness is a loaded gun.  I want everything, baby. Everything, baby. You know what I like. (You know what I like)  I need everything, baby. Everything, baby. And you're doing me right.  When you're out with all your friends, And you got money to spend Do me right-right Do me right-right Do me right (do it, do it)  ... I don't wanna In the club, or in the corner. Do me right-right Do me right-right Do me right (do it, do it)  When you're out with all your friends, And you got money to spend Do me right-right Do me right-right Do me right (do it, do it)  ... I don't wanna In the club, or in the corner. Do me right-right Do me right-right Do me right (do it, do it)  Lick me, slap me, do it, do it. Do me right, there's nothing to it.  Lick me, slap me, do it, do it. Do me right, there's nothing to it.  I want you in my bed, alright? Can't sleep without my fix tonight.  It's not polite or lady like Can't sleep without my fix tonight.  Do it right, do it right, do it right, Do me right. Do me right.  (Right)  When you're out with all your friends, And you got money to spend Do me right-right Do me right-right Do me right (do it, do it)  ... I don't wanna In the club, or in the corner. Do me right-right Do me right-right Do me right (do it, do it)  When you're out with all your friends, And you got money to spend Do me right-right Do me right-right Do me right (do it, do it)  ... I don't wanna In the club, or in the corner. Do me right-right Do me right-right Do me right (do it, do it)  Lick me, slap me, do it, do it. Do me right, there's nothing to it.  Lick me, slap me, do it, do it. Do me right, there's nothing to it",Lady Gaga
69,Do What U Want (feat. Christina Aguilera),/lady-gaga/do-what-u-want-feat-christina-aguilera.html,,"I feel good, I walk along But then I trip upon myself and I fall, I I stand up, and then I'm ok But then you print that shit That makes me want to scream  So do what you want What you want with my body Do what you want Don't stop, let's party Do what you want What you want with my body Do what you want What you want with my body  Write what you want Say what you want 'bout me If you're wondering, know That I'm not sorry Do what you want What you want with my body What you want with my body  You can't have my heart and You won't use my mind but Do what you want with my body Do what you want with my body You can't stop my voice 'cause You don't own my life but Do what you want with my body Do what you want with my body  My bones hurt From all the shows But I don't feel the pain cause I'm pro, I I sink in Then I'm okay Cause my body belongs to you When I'm on stage  So do what you want What you want with my body Do what you want Don't stop, let's party Do what you want What you want with my body Do what you want What you want with my body  Write what you want Say what you want 'bout me If you're wondering, know That I'm not sorry Do what you want What you want with my body What you want with my body  You can't have my heart and You won't use my mind but Do what you want with my body Do what you want with my body You can't stop my voice 'cause You don't own my life but Do what you want with my body Do what you want with my body  Sometimes I'm scared I suppose If you ever let me go I would fall apart If you break my heart So just take my body And don't stop the party  You can't have my heart and You won't use my mind but Do what you want with my body Do what you want with my body You can't stop my voice 'cause You don't own my life but Do what you want with my body Do what you want with my body  Do what you want with me What you want Lady Gaga What you want with me, Christina What you want with my body Do what you want with me What you want with my body Do what you want with me What you want with my body, world  Help me now What you want with my body, world",Lady Gaga
70,Do What U Want (feat. R. Kelly),/lady-gaga/do-what-u-want-feat-r-kelly.html,ARTPOP,"I feel good, I walk along But then I trip upon myself and I fall, I I stand up, and then I'm ok But then you print that shit That makes me want to scream  So do what you want What you want with my body Do what you want Don't stop, let's party Do what you want What you want with my body Do what you want What you want with my body  Write what you want Say what you want 'bout me If you're wondering, know That I'm not sorry Do what you want What you want with my body What you want with my body  You can't have my heart and You won't use my mind but Do what you want with my body Do what you want with my body You can't stop my voice cause You don't own my life but Do what you want with my body Do what you want with my body  Early morning, longer nights Tom Ford, private flights Crazy schedule, fast life I wouldn't trade it in Cause it's our life (now let's slow it down) I could be the drink in your cup I could be the green in your blunt Your pusha man, yeah I got what you want You want to escape all of the crazy shit You're Marilyn, I'm the president I love to hear you sing, girl  Do what I want Do what I want with your body Do what I want Do what I want with your body Back of the club, taking shots, getting naughty No invitations, it's a private party Do what I want Do what I want with your body Do what I want Do what I want with your body Yeah we taking these haters And we roughin' em up And we lay in the cut like we don't give a fuck  You can't have my heart and You won't use my mind but Do what you want with my body Do what you want with my body You can't stop my voice cause You don't own my life but Do what you want with my body Do what you want with my body  Sometimes I'm scared I suppose If you ever let me go I would fall apart If you break my heart So just take my body And don't stop the party  You can't have my heart and You won't use my mind but Do what you want with my body Do what you want with my body You can't stop my voice cause You don't own my life but Do what you want with my body Do what you want with my body  Do what you want with me What you want with my body Do what you want with me What you want with my body Do what you want with me What you want with my body Do what you want with me What you want with my body world",Lady Gaga
71,Do What U Want (Solo Version),/lady-gaga/do-what-u-want-solo-version.html,,"I feel good, I walk along But then I trip upon myself and I fall, I I stand up, and then I'm ok But then you print that shit That makes me want to scream  So do what you want What you want with my body Do what you want Don't stop, let's party Do what you want What you want with my body Do what you want What you want with my body  Write what you want Say what you want 'bout me If you're wondering, know That I'm not sorry Do what you want What you want with my body What you want with my body  You can't have my heart and You won't use my mind but Do what you want with my body Do what you want with my body You can't stop my voice 'cause You don't own my life but Do what you want with my body Do what you want with my body  My bones hurt From all the shows But I don't feel the pain cause I'm pro, I I sink in Then I'm okay Cause my body belongs to you When I'm on stage  So do what you want What you want with my body Do what you want Don't stop, let's party Do what you want What you want with my body Do what you want What you want with my body  Write what you want Say what you want 'bout me If you're wondering, know That I'm not sorry Do what you want What you want with my body What you want with my body  You can't have my heart and You won't use my mind but Do what you want with my body Do what you want with my body You can't stop my voice 'cause You don't own my life but Do what you want with my body Do what you want with my body  Sometimes I'm scared I suppose If you ever let me go I would fall apart If you break my heart So just take my body And don't stop the party  You can't have my heart and You won't use my mind but Do what you want with my body Do what you want with my body You can't stop my voice 'cause You don't own my life but Do what you want with my body Do what you want with my body  Do what you want with me What you want with my body Do what you want with me What you want with my body Do what you want with me What you want with my body Do what you want with me What you want with my body, world  Help me now What you want with my body Do what you want with my body",Lady Gaga
72,"Do What u Want 2.0 (Feat. R.kelly, Rick Ross, Christina Aguilera)",/lady-gaga/do-what-u-want-2-0-feat-r-kelly-rick-ross-christina-aguilera.html,,"[rick ross] Photos of the boss He just post 'em on a blog Get a lotta views Cause they know we be the top Jean basquiat's In the middle of our hall Ooh, she's my work of art So I pin her to the wall Oh oh, sex and the dope Underneath the waterfall Sight seeing in a space jet As I be paying off the stores Ain't me understated I've got to tag it on your wall Cause under art has crossed the border Cause got together Mouthing in the middle Hanging out the moon Bruce willis on the pillow Hot, pull on a glove Black bottle for a model Oh, I gotta keep a follow Crazy girls on the model Boss  [lady gaga] I, I feel good, I walk alone But then I trip upon myself and I fall I, I stand up, and then I'm okay But then you print some shit That makes me wanna scream  So do what u want What u want with my body Do what u want Don't stop, let's party Do what u want What u want with my body Do what u want What you want with my body  Write what u want Say what u want 'bout me If you're wonderin' Know that I'm not sorry  Do what u want What u want with my body What u want with my body  You can't have my heart And you won't use my mind but Do what u want (with my body) Do what u want with my body You can't stop my voice cause You don't own my life but Do what u want (with my body) Do what u want (with my body)  [r. kelly] Early morning, longer nights Tom ford, private flights Crazy schedule, fast life I wouldn't trade it in 'cause it's our life (let's slow it down)  I could be the drink in your cup I could be the green in your blunt Your pusher man, yea I got what you want You wanna escape all of the crazy shit You're the marilyn, I'm the president And I love to hear you sing, girl  Do what I want Do what I want with your body Do what I want Do what I want with your body Back of the club, takin' shots, gettin naughty No invitations, it's a private party Do what I want Do what I want with your body Do what I want Do what I want with your body Yea we takin' these haters And we roughin em up And we layin' the club like We don't give a fuck  [lady gaga] You can't have my heart And you won't use my mind but Do what u want (with my body) Do what u want with my body You can't stop my voice cause You don't own my life but Do what u want (with my body) Do what u want (with my body)  [christina aguilera] My bones hurt From all the shows But I don't feel the pain cause I'm pro, I I sink in Then I'm okay Cause my body belongs to you When I'm on stage  [lady gaga] Write what you want Say what you want 'bout me If you're wondering, know That I'm not sorry Do what you want What you want with my body What you want with my body  [gaga&amp;aguilera] You can't have my heart and You won't use my mind but Do what you want with my body Do what you want with my body You can't stop my voice cause You don't own my life but Do what you want with my body Do what you want with my body  [lady gaga] Do what you want with me What you want lady gaga What you want with me, christina What you want with my body Do what you want with me What you want with my body Do what you want with me What you want with my body, world  Help me now What you want with my body, world",Lady Gaga
73,Don't Give Up (The Midway State feat. Lady Gaga),/lady-gaga/dont-give-up-the-midway-state-feat-lady-gaga.html,Regravação de Peter Gabriel,"In this proud land we grew up strong We were wanted all along I was taught to fight, taught to win I never thought I could fail  No fight left or so it seems I am a man whose dreams have all deserted I've changed my face, i've changed my name But no one wants you when you lose  Don't give up Cause you have friends Don't give up You're not beaten yet Don't give up I know you can make it good  Though I saw it all around Never thought I could be affected Thought that we'd be the last to go It is so strange the way things turn  Drove the night toward my home The place that I was born, on the lakeside As daylight broke, I saw the earth The trees had burned down to the ground  Don't give up You still have us Don't give up We don't need much of anything Don't give up Cause somewhere there's a place Where we belong  Rest your head You worry too much It's going to be alright  When times get rough You can fall back on us Don't give up Please don't give up  Got to walk out of here I can't take anymore Going to stand on that bridge Keep my eyes down below  Whatever may come And whatever may go That rivers flowing That rivers flowing  Moved on to another town Tried hard to settle down For every job, so many men So many men no-one needs  Don't give up Cause you have friends Don't give up You're not the only one Don't give up You still have us  Don't give up We're proud of who you are Don't give up 'Cause I believe there's the a place Where we belong",Lady Gaga
74,Don't Wait To Long (With Tony Bennett),/lady-gaga/dont-wait-to-long-with-tony-bennett.html,,"You are the summer and I am the autumn Don't wait too long Your song's beginning while Mine has been sung Don't wait too long  Fall is a lovely time of the year When the leaves turn to gold and brown But soon fall is ending and winter is near And the leaves start tumblin' down  Why must the moments go by in such haste? Don't wait too long Winter is coming, I've no time to waste Don't wait too long  So while my heart's gay and foolish And free and still can sing its song Share every precious moment with me Don't wait too long",Lady Gaga
