,Nome da Música,link,album,letra,artista
124,I'll Never Love Again,/lady-gaga/ill-never-love-again.html,,"Wish I could I could have said goodbye I would have said what I wanted to Maybe even cried for you  If I knew it would be the last time I would have broke my heart in two Tryin' to save a part of you  Don't wanna feel another touch Don't wanna start another fire Don't wanna know another kiss No other name falling off my lips Don't wanna give my heart away To another stranger Or let another day begin Won't even let the sunlight in No I'll never love again I'll never love again Oouu oou oou  When we first met I never thought that I would fall I never thought that I'd find myself lyin' in your arms And I wanna pretend that it's not true Oh, baby that you're gone Cause my world keeps turnin' and turnin' and turnin' and I'm not movin' on  Don't wanna feel another touch Don't wanna start another fire Don't wanna know another kiss No other name falling off my lips Don't wanna give my heart away To another stranger Or let another day begin Won't even let the sunlight in No I'll never love  I don't wanna know this feeling unless it's you and me I don't wanna waste a moment And I don't wanna give somebody else the better part of me I would rather wait for you  Don't wanna feel another touch Don't wanna start another fire Don't wanna know another kiss Baby unless they are your lips Don't want to give my heart away to another stranger Or let another day begin Won't even let the sunlight in Oh I'll never love again Love again I'll never love again I'll never love Again  I won't I won't I swear I can't I wish I could but I just won't I'll never love again I'll never love Again",Lady Gaga
125,If I Ever Lose My Faith,/lady-gaga/if-i-ever-lose-my-faith.html,,You could say I lost my faith in science and progress you could say I lost my belief in the holy church you could say I lost my sense of direction you could say all of this and worse but  if I ever lose my faith in you there'd be nothing left for me to do   I could be lost inside their lies without a trace but everytime I close my eyes I see your face  never saw no miracle of science that didn't go from a blessing to a curse never saw no military solution that didn't end up as something worse but let me say this first  if I ever lose my faith in you (if I ever lose my faith in you) there'd be nothing left for me to do (there'd be nothing left for me to do)  if I ever lose my faith if I ever lose my faith if I ever lose my faith if I ever lose my faith... in you,Lady Gaga
126,Imagine,/lady-gaga/imagine.html,Regravação de John Lennon,"Imagine there's no heaven It's easy if you try No hell below us Above us only sky  Imagine all the people Living for today  Imagine there's no countries It isn't hard to do Nothing to kill or die for And no religion too  Imagine all the people Living life in peace  You may say, I'm a dreamer But I'm not the only one I hope someday that you'll join us And the world will live as one  Imagine no possessions I wonder if you can Nothing to kill or die for A Brotherhood of man  Imagine all of the people Sharing all the world  You may say, I'm a dreamer But I'm not the only one I hope someday that you will join us And the world will live as one  Imagine all the people Imagine all the people Imagine we'll live in love and peace And happiness  Imagine it was simple Imagine",Lady Gaga
127,Is That Alright?,/lady-gaga/is-that-alright.html,,"Life is so simple A little boy a little girl Laughing and loving Tryin' to figure out the world It felt like summer When I kissed you in the rain And I know your story But tell me again  Nothing you say wouldn't interest me All of your words are like poems to me I would be honored if you would take me as I am  I want you to look right in my eyes To tell me you love me, to be by my side I want you at the end of my life Wanna see your face when I fall with grace At the moment I die Is that alright? Is that alright?  I hope you're still with me When I'm not quite myself And I pray that you'll lift me When you know I need help It's a warm celebration of all of our years I dream of our story of our fairytale  Family dinners and family trees Teachin' the kids to say thank you and please Knowing if we stay together that things will be right  I want you to look right in my eyes To tell me you love me, to be by my side I want you at the end of my life Wanna see your face when I fall with grace At the moment I die Is that alright? Is that alright? Is that alright?",Lady Gaga
128,It Don't Mean a Thing (If It Ain't Got That Swing) (With Tony Bennett),/lady-gaga/it-dont-mean-a-thing-if-it-aint-got-that-swing-with-tony-bennett.html,,"It don't mean a thing, if it ain't got that swing Dooa doa doa doa doa doaa doa doa No, it don't mean a thing, all you gotta do is swing Dooa doa doa doa doa doaa doa doa Makes no diff'rence if it's sweet or it's hot Give all that rhythm ev'rything you've got  Oh, It don't mean a thing, if it ain't got that swing Dooa doa doa doa doa doaa Tony Gaga It's makes no diff'rence if it's sweet or hot Just give all that rhythm ev'rything you've got  Oh, It don't mean a thing, if it ain't got that swing Dooa doa doa doa doa doaa doa doa Dooa doa doa doa doa doaa doa doa Dooa doa doa doa doa doaa doa doa",Lady Gaga
129,"Jewels N' Drugs (feat. T.I., Too $hort & Twista)",/lady-gaga/jewels-drugs-feat-t-i-too-short-twista.html,ARTPOP,"(T.I.) Yeah It's about that time, yeah Time to take off partna, alright Hustle gang, uh huh, G-D-O-D Get your doe or die partna Yup, let go Still bankhead shawty, yeah you know what it is Pocket full of numbers, rubber bands and bills Came up from a round, that's a dandiville Fixin to do a deal about, bout 60 mil You ain't live that life you perpetrate You ain't have to beat no murder case Beat no, man you prob couldn't get a O of everyday Round my way cat Get murdered playing Ain't no rules, play dirty man Put something through your jersey man If your partna want some We can do it again Ok, H-U-S-T-L-E G-G-A-N-G that way Just pull up, pull up, hop out, hop out All about the dollar better go and ask Gaga, Gaga, Gaga, Gaga, Gaga  (Lady Gaga) Don't want your jewels, I want your drugs Don't want your money, want your love Don't want your jewels, I want your drugs Want your jewels, I want your drugs Don't want your money, want your love  I admit that my habit's expensive And you may find it quite offensive But I won't die at the hands of another I'm your mother-sister, your father-brother This family is stupid attractive If you surveyed the way we've acted Keep it coming, I'm coming around like your friend now I think you should shut up and sit down  (Lady Gaga) Don't want your jewels, I want your drugs Don't want your money, want your love Don't want your jewels, I want your drugs Want your jewels, I want your drugs Don't want your money, want your love  (Too $hort) Airbody want that money, what you want? High as Hell trying to have some fucking fun You don't need 'em but the diamonds make it shine Tried to kick it just can't find the time It's the middle of the week, this ain't even the weekend Red carpet events, every time you see pimps It's good pussy in the passenger seat My lil' homies hang with me I be passing 'em freaks, bitch  (Lady Gaga) Jewels N' Drugs play that hustle Smother 'em, if you wanna be bad Slap honey on a young pancake We know how to make that money Jewels N' Drugs play that hustle Smother 'em, if you wanna be bad Ain't nothing if it ain't family We know how to make that money  (Twista) Come and show me the gateway into your love I feel like the money could never do it like the club I feel like a diamond can never do it like a drug And I want it so come on and take it with me So that I can hit it, I can admit it I'm influenced by desire when I approach her I try to provoke her by giving money and jewelry and accessories Instead of the recipe with a legacy of taking her to Another place when I get it Hold up Twista going in warp speed breaking atoms Blowing O.G. has got me creating anti matter Let her pop it and smoke on it with me now I got her because she's ready to party and then Move to the club Because you know the way I think is an anomaly And Ima be strange as Lady Gaga Probably a dollar be the business But I'd rather be in an outer dimension when I be Talking about jewels N' drugs  (Lady Gaga) Jewels N' Drugs play that hustle Smother 'em, if you wanna be bad Slap honey on a young pancake We know how to make that money Jewels N' Drugs play that hustle Smother 'em, if you wanna be bad Ain't nothing if it ain't family We know how to make that money",Lady Gaga
130,Jo Calderone's Monologue,/lady-gaga/jo-calderones-monologue.html,,"""Hey. My name is Jo Calderone and I was an asshole. Gaga? Yeah her. Lady Gaga. She left me. She said it always starts out good and then the guys, meaning me, I'm one of the guys, we get crazy. I did. I got crazy, but she's fucking crazy too, right? I mean, she's fucking crazy. For example, she gets out of the bed, puts on the heels. She goes into the bathroom. I hear the water go on. She comes out of the bathroom, dripping wet. She still has the heels on. And what's with the hair? At first it was sexy but now I'm just confused. She said I'm just like the last one. I'm not like the last one... And I think it's great, you know? I think it's really fucking great that she's such a star, a big beautiful star in the sky, but how am I supposed to shine? I mean, I think I'd be okay with it, you know, if I felt like she really was being herself with me. And maybe she is. I'm starting to think she is, 'cause when she gets on the stage, she holds nothing back ? that spotlight, that big rounded spotlight follows her everywhere she goes. Sometimes I think it follows her home. I know it does. I got to get in there. When she fucks, it's like she covers her face 'cause she doesn't want me to see, but she can't stand to have one honest moment where nobody's watching. I want her to be real, but she says, 'Jo,I'm not real. I'm theater and you and I... This is just rehearsal. I got to get in there.""",Lady Gaga
131,Joanne,/lady-gaga/joanne.html,Joanne,"Take my hand, stay Joanne Heaven's not ready for you Every part of my aching heart Needs you more than the angels do  Girl, where do you think you're goin'? Where do you think you're goin', goin', girl? Girl, where do you think you're goin'? Where do you think you're goin', goin', girl?  If you could I know that you'd stay We both know things don't work that way I promised I wouldn't say goodbye So I grin and my voice gets thin  Girl, where do you think you're goin'? Where do you think you're goin', goin', girl? Girl, where do you think you're goin'? Where do you think you're goin', goin', girl?  Honestly, I know where you're goin' And baby, you're just movin' on And I'll still love you even if I can't see you anymore Can't wait to see you soar  Girl, where do you think you're goin'? Where do you think you're goin', goin', girl? Girl, where do you think you're goin'? Where do you think you're goin', goin', girl?",Lady Gaga
132,Joanne (Where do You Think You're Goin') (Piano Version),/lady-gaga/joanne-where-do-you-think-youre-goin-piano-version.html,,"Take my hand, stay Joanne Heaven's not ready for you Every part of my aching heart Needs you more than the angels do  Girl, where do you think you're goin'? Where do you think you're goin', goin', girl? Girl, where do you think you're goin'? Where do you think you're goin', goin', girl?  If you could I know that you'd stay We both know things don't work that way I promised I wouldn't say goodbye So I grin and my voice gets thin  Girl, where do you think you're goin'? Where do you think you're goin', goin', girl? Girl, where do you think you're goin'? Where do you think you're goin', goin', girl?  Honestly, I know where you're goin' And baby, you're just movin' on And I'll still love you even if I can't see you anymore Can't wait to see you soar  Girl, where do you think you're goin'? Where do you think you're goin', goin', girl? Girl, where do you think you're goin'? Where do you think you're goin', goin', girl?  Call me, Joanne Xo, Joanne Xo Xo, Joanne",Lady Gaga
133,John Wayne,/lady-gaga/john-wayne.html,Joanne,"It's like, I just love a cowboy You know I'm just like, I just, I know, it's bad But I'm just like Can I just like Hang off the back of your horse And can you go a little faster?  3 Am, mustang speedin' Two lovers, headed for a dead end Too fast Hold tight He laughs Runnin' through the red lights Hollerin' over, rubber spinnin' Big swig, toss another beer can Too lit Tonight Prayin' on the moonlight  Every john is just the same I'm sick of their city games I crave a real wild man I'm strung out on john wayne  (dat - doo - deet - doe) (dat - doo - deet - doe Dat - doo - deet - doe) Baby let's get high, john wayne (dat - doo - deet - doe) (dat - doo - deet - doe Dat - doo - deet - doe) Baby let's get high, john wayne  Blue collar and a red-state treasure Love junkie on a three-day bender His grip, so hard Eyes glare trouble Like a mug shot Charged up, 'cause the man's on a mission  1-2 Ya, the gears are shiftin' He called, I cried We broke Racin' through the moonlight  Every john is just the same I'm sick of their city games I crave a real wild man I'm strung out on john wayne  (dat - doo - deet - doe) (dat - doo - deet - doe Dat - doo - deet - doe) Baby let's get high, john wayne (dat - doo - deet - doe) (dat - doo - deet - doe Dat - doo - deet - doe) Baby let's get high, john wayne  So here I go To the eye Of the storm Just to feel your love Knock me over Here I go Into our love storm  (dat - doo - deet - doe) (dat - doo - deet - doe Dat - doo - deet - doe) Baby let's get high, john wayne (dat - doo - deet - doe) (dat - doo - deet - doe Dat - doo - deet - doe) Baby let's get high, john wayne",Lady Gaga
134,Judas,/lady-gaga/judas.html,Born This Way: The Collection,"Oh oh oh oh oh oh I'm in love with Judas, Judas Oh oh oh oh oh oh I'm in love with Judas, Judas  Judas, Judas (4x) Gaga  Judas, Judas (4x) Gaga  When he comes to me, I am ready I'll wash his feet with my hair if he needs Forgive him when his tongue lies through his brain Even after three times, he betrays me  I'll bring him down Bring him down, down A king with no crown A king with no crown  I'm just a Holy Fool, oh baby it's so cruel But I'm still in love with Judas, baby I'm just a Holy Fool, oh baby it's so cruel But I'm still in love with Judas, baby  Oh oh oh oh oh oh I'm in love with Judas, Judas Oh oh oh oh oh oh I'm in love with Judas, Judas  Judas, Judas (4x) Gaga  I couldn't love a man so purely Even darkness forgave his goofy way I've learned love is like a brick You can build a house or sink a dead body  I'll bring him down Bring him down, down A king with no crown A king with no crown  I'm just a Holy Fool, oh baby it's so cruel But I'm still in love with Judas, baby I'm just a Holy Fool, oh baby it's so cruel But I'm still in love with Judas, baby  Oh oh oh oh oh oh I'm in love with Judas, Judas Oh oh oh oh oh oh I'm in love with Judas, Judas  Ew!  'In the most Biblical sense, I am beyond repentance Fame hooker, prostitute wench, vomits her mind But in the cultural sense I just speak in future tense Judas kiss me if offenced, or wear an ear condom next time  I wanna love you but something is putting me away from you Jesus is my virtue and Judas is the demon I claim to I claim to  I'm just a Holy Fool, oh baby it's so cruel But I'm still in love with Judas, baby I'm just a Holy Fool, oh baby it's so cruel But I'm still in love with Judas, baby  Oh oh oh oh oh oh I'm in love with Judas, Judas Oh oh oh oh oh oh I'm in love with Judas, Judas  Judas, Judas (4x) Gaga",Lady Gaga
135,Judas (DJ White Shadow Remix),/lady-gaga/judas-dj-white-shadow-remix.html,,"Judas, Juda-ah-ah-ah-ah Judas, Juda-ah-ah-ah-ah  Gaga  I'll bring him down A king with no crown I'll bring him down A king with no crown  Oh oh oh oh oh oh I'm in love with Judas, Judas Oh oh oh oh oh oh I'm in love with Judas, Judas  Judas, Juda-ah-ah-ah-ah Judas, Juda-ah-ah-ah-ah  I'll bring him down Bring him down, down, down, down I'll bring him down Bring him down, down, down, down  Judas, Juda-ah-ah-ah-ah Judas, Juda-ah-ah-ah-ah",Lady Gaga
136,Judas (Goldfrapp Remix),/lady-gaga/judas-goldfrapp-remix.html,Born This Way - The Remix,"Emit txen modnoc rae raew ro Decneffo fi em Ni kaeps tsuj I esnes larutluc  Woah woah woah woah woah I'm in love with Woah woah  Woah woah woah woah woah I'm in love with juda-as, juda-as  (reversed)  Ssik saduj Esnet erutuf ni kaeps tsuj  Ah-ah-ahhh-ow Ah-ah-ahhh-ow Judas is the demon I claim to Ah-ah-ahhh-ow Ah-ah-ahhh-ow  I wanna love you Ah-ah-ahhh-ow Ah-ah-ahhh-ow Judas is the demon I claim to  I wanna love you Jesus is my virtue I wanna love you Judas is the demon I claim to  I claim to I claim to  I claim to I claim to...  (reversed)  Ni kaeps tsuj I esnes larutluc Emit txen modnoc rae raew ro Decneffo fi em ssik",Lady Gaga
137,Judas (Hurts Remix),/lady-gaga/judas-hurts-remix.html,Born This Way: The Collection,"I claim to  Oh oh oh oh oh oh I'm in love with Judas, Judas, Judas Oh oh oh oh oh oh I'm in love with Judas, Judas, Judas  Gaga  When he comes to me, I am ready I'll wash his feet with my hair if he needs Forgive him when his tongue lies through his brain Even after three times, he betrays me  I'll bring him down Bring him down, down, down  Oh oh oh oh oh oh I'm in love with Judas, Judas Oh oh oh oh oh oh I'm in love with Judas, Judas  Judas  I couldn't love a man so purely Even darkness forgave his crooked way I've learned love is like a brick, you can Build a house or sink a dead body  A king with no crown A king with no crown  Oh oh oh oh oh oh I'm in love with Judas, Judas Oh oh oh oh oh oh I'm in love with Judas, Judas  I wanna love you but something is putting me away from you Jesus is my virtue and Judas is the demon I claim to",Lady Gaga
138,Just Another Day,/lady-gaga/just-another-day.html,Joanne,"Yeah man, play that New York drum, Homer Show 'em how we do it Downtown  [Verse 1] Just another way to prove I love you, when it's hard today I'll lay back in my chair and find a way And when you say that thing that you say That makes me mad I'll turn away I'll turn away I'll turn away [Pre-Chorus] And think of different ways to keep my spirits up And choreograph hours with playful, joyish thoughts  [Chorus] We both know I could learn a thing or two About relaxing, hey I love you And after all it's just another day  [Verse 2] Oh, I could use some two or three Or other kind of ways to be But today I won't be so hard on me I'll walk alone down a different street And smile at all the new strange I meet  [Pre-Chorus] And pick up unique style, I'll kick around today And create simple thoughts I'll laugh in humble ways  [Chorus] We both know I could learn a thing or two About behavin' But I love you And after all it's just another day  Come on, Mark!  Ladies and gentlemen, Brian Newman  [Chorus] We both know I could learn a thing or two About behavin' But I love you And after all, it's just another day  [Outro] Ooh oo, ooh oo Ooh oo, ooh oo Ooh oo, ooh oo And after all It's just another day",Lady Gaga
139,Just Dance (feat. Colby O'Donis),/lady-gaga/just-dance.html,Born This Way: The Collection,"Redone Konvict Ga Ga Oh, yeah  I've had a little bit too much (much) (oh oh oh oh) All of the people start to rush (start to rush by) A dizzy twister dance, can't find my drink or man Where are my keys, I lost my phone (phone) (oh oh oh Oh)  What's go-ing on-on the floor? I love this record baby but I can't see straight Anymore Keep it cool, what's the name of this club? I can't remember but it's alright, a-alright  Just dance, gonna be okay (da-da-doot-n) Just dance, spin that record babe (da-da-doot-n) Just dance, gonna be okay (duh-duh-duh) Dance, dance, dance, just ju-ju-just dance  Wish I could shut my playboy mouth (oh oh oh oh) How'd I turn my shirt inside out? (inside out right) Control your poison babe, roses have thorns they say And we're all gettin' hosed tonight (oh oh oh oh)  What's go-ing on-on the floor? I love this record baby but I can't see straight Anymore Keep it cool, what's the name of this club? I can't remember but it's alright, a-alright  Just dance, gonna be okay (da-da-doot-n) Just dance, spin that record babe (da-da-doot-n) Just dance, gonna be okay (duh-duh-duh) Dance, dance, dance, just ju-ju-just dance  When I come through on the dance floor checkin' out That catalogue Can't believe my eyes so many women without a flaw And I ain't gonna give it up, steady tryna pick it up Like a call I'ma hit it up beat it up latch on to it until Tomorrow yeah  Shawty I can see that you got so much energy The way you twirlin' up them hips round and round And there is no reason at all why you can't leave Here with me In the meantime stay, let me watch you break it down And  Dance, gonna be okay (da-da-doot-n) Just dance, spin that record babe (da-da-doot-n) Just dance, gonna be okay (da-da-doot-n) Just dance, spin that record babe (da-da-doot-n) Just dance, gonna be okay (duh-duh-duh) Dance, dance, dance, just ju-ju-just dance  Half psychotic sick hypnotic Got my blueprint it's symphonic Half psychotic sick hypnotic Got my blueprint electronic Half psychotic sick hypnotic Got my blueprint it's symphonic Half psychotic sick hypnotic Got my blueprint electronic  Go, use your muscle, carve it out, work it, hustle  I got it, just stay close enough to get it  Don't slow, drive it, clean it, Lysol bleed it Spend the last dough (I got it) In your pocko (I got it)  Just dance, gonna be okay (da-da-doot-n) Just dance, spin that record babe (da-da-doot-n) Just dance, gonna be okay (da-da-doot-n) Just dance, spin that record babe (da-da-doot-n) Just dance, gonna be okay (duh-duh-duh) Dance, dance, dance, just ju-ju-just dance",Lady Gaga
140,Kaboom,/lady-gaga/kaboom.html,,"You wanna get that You wanna get that You wanna get that But I need no money  You wanna get that You wanna get that You wanna get that But I need no money  Keep talking to me Like I'm a groupie He's like a party He wanna touch my booty We all are pumped in this club I'm tryin' to leave so and so what's up No drink left in my cup Better wake your soldier up  Don't wanna love just give me your bling bling Listen to me boy cause I need your need your thing thing Hey there boy not trying be funny Ima big girl and I need money Don't wanna love just give me your bling bling Listen to me boy, cause I need your need your thing thing Hey there boy not trying be funny I'm big girl and I need money  Kaboom (let me see your body work work. work your body Till you make your body hurt hurt) Kaboom (come get my system. I go fast. I leave in a bang bang) Kaboom (let me see your body work work. Work your body till you make your body hurt hurt) Kaboom (come get my system. I go fast. I leave in a bang bang)  Bang, bang boy Wanna beat on my drum Beat on my drum cause youll know ill come come Bang, bang boy Wanna beat on my drum Beat on my drum cause youll know ill come come  My sheets are thin I got the pillows Thats shit expensive Baby thats shits expensive I got a spot like an egyptian queen Stop messing around cause you know what I mean Wanna beat on my drum Cuz' you know I come come  Don't wanna love just give me your bling bling Listen to me boy cause I need your need your thing thing Hey there boy not trying be funny I'm a big girl and I need no money  Don't wanna love just give me your bling bling Listen to me boy cause I need your need your thing thing Hey there boy not trying be funny I'm a big girl and I need no money  Kaboom (let me see your body work work. Work your body till you make your body hurt hurt) Kaboom (come get my system. I go fast. I leave in a bang bang) Kaboom (let me see your body work work. Work your body till you make your body hurt hurt) Kaboom (come get my system. I go fast. I leave in a bang bang)  Bang bang boy wanna beat on my drum Bang bang boy cause youll know ill come come  Kaboom (let me see your body work work. Work your body till you make your body hurt hurt) Kaboom Kaboom (let me see your body work work. Work your body till you make your body hurt hurt) Kaboom",Lady Gaga
141,Kandy Life,/lady-gaga/kandy-life.html,,"We've got nothing left to lose but limousines and attitude Yeah, we're banking on us oh baby it's crazy We've got nothing left to make but icing on this little cake Fashion sense and vanity consume us cause we  We want that kandy life For me I'd like that kandy life Could we get a taste of that kandy life I know our style might be abridged But we are the ones, bitch  We got sour grapes to fry to limit this credit card life Oh we're banking on hits oh baby it's crazy We've got nothing left to lose but reservations and good booze Copy me celebrities consume us cause we  We want that kandy life For me I'd like that kandy life Could we get a taste of that kandy life I know our style might be abridged But we are the ones, bitch  I say change your pants and meet me in the Bathroom for a private tour and dance We'll share our candy, I'm not your buddy Baby vanity's for me, copy me cause we  We want that kandy life For me I'd like that kandy life Could we get a taste of that kandy life I know our style might be abridged But we are the ones, bitch",Lady Gaga
