,Nome da Música,link,album,letra,artista
18,Eu Amo,/manu-gavassi/eu-amo.html,,"Eu amo quando eu acordo de manhã Com mensagem no meu celular, Eu amo pessoas que me fazem rir E filmes que me fazem chorar,  Eu amo quando ouço uma música Que diz exatamente o que eu sinto, Eu amo gelatina de morango Quando faz sol no domingo,  Eu amo, amo, Pensar na vida antes de dormir, Eu amo, amo Quando decido rápido o que vestir,  Por que você não tenta também, Declare o seu amor pelas pequenas coisas Que te fazem bem!",Manu Gavassi
19,Eu Dou Risada,/manu-gavassi/eu-dou-risada.html,Clichê Adolescente,"Eu espero que você não morra de amores Enquanto se vê pela TV Seria uma pena se você levasse um tombo Desse trono que só você vê  Tome cuidado pra esse cachecol da John John Não enforcar você E eu me sinto tão mal, porque eu sei não é normal Alguém ser tão melhor que todos Quando eu nunca vou ser  E eu dou risada, e eu dou risada E eu dou risada sem saber porque E eu vou embora, eu vou embora Eu vou embora e deixo esse espelho de presente pra você Se ver e aprender Que existe algo muito errado em se ver E se ver, só se ver  Você é tão perfeito E por isso não tem jeito O mundo inteiro quer te namorar Mas garoto não se prenda Ouça e entenda Você nasceu pra não se comportar  Agora está sozinho sem ela e sem carinho Tudo bem ainda tem o instagram pra postar Com esse cabelo jogado E aquele seu papo furado Existem muitas pra te consolar  E eu dou risada, e eu dou risada E eu dou risada sem saber porque E eu vou embora, eu vou embora Eu vou embora e deixo esse espelho de presente pra você Se ver e aprender Que existe algo muito errado em se ver E se ver, só se ver  São Paulo combina com o seu humor As paredes não tem olhos, não existe amor Consigo te ver na Augusta usando uma jaqueta Oscar Freire E assoviando uma canção Assim, assim, alternativa demais para mim Por isso a gente teve um fim Melhor assim, melhor assim  E eu dou risada, e eu dou risada.",Manu Gavassi
20,Eu e Você,/manu-gavassi/eu-e-voce.html,Manu Gavassi,"É complicado eu e você Há uma forte ligação Entre eu e você Ás vezes não quero te ver Ás vezes finjo que não ligo Mas não dá para esconder  E até posso tentar ser só uma amiga Mas não vai adiantar,se você não se liga Melhor você parar de tentar consertar o que ficou pra trás eu não vou mais lembrar É só você parar de me tratar tão bem Eu tô tentando te esquecer mas toda vez que eu te vejo esqueço o porque  Pra você não sei mentir Sei que nem você pra mim não adianta fingir Eu quase morro quando diz que pra você sou diferente Já te fiz feliz  E até posso tentar ser só uma amiga Mas não vai adiantar se você não se liga Melhor você parar de tentar consertar O que ficou pra trás eu não vou mais lembrar É só você parar de me tratar tão bem Eu tô tentando te esquecer mas toda vez que eu te vejo esqueço o porque  Não sei a razão (não sei a razão) pro meu coração bater (pro meu coração bater) tão forte assim (tão forte assim) toda vez que te vê (toda vez que te vê)  Melhor você parar de tentar consertar O que ficou pra trás eu não vou mais lembrar É só você parar de me tratar tão bem Eu tô tentando te esquecer mas toda vez que eu te vejo esqueço o porque  Eu tô tentando te esquecer mas toda vez que eu te vejo esqueço o porque",Manu Gavassi
21,Eu Me Proíbo,/manu-gavassi/eu-me-proibo.html,Clichê Adolescente,"Eu me proíbo de pensar em você Porque eu já vivi, sei o que vai acontecer Eu me proíbo de pensar em você outra vez Eu te proíbo de passar perto de mim De me roubar um beijo e me deixar assim Me perguntando o porquê de algo que não vai mais acontecer Momentos passam devagar ou rápido demais Não sei se eu me arrependi ou se eu quero mais De você  Não, não vá embora se eu pedir Não, não fale nada fique aqui Eu sei, não vou saber me acostumar Se você não está, não, não Não, não me olhe mais assim Não, nem pense em não pensar em mim Eu sei não vou saber me acostumar Se você não está, não, não  Eu me proíbo de imaginar nós dois Falando sobre a vida e sobre o depois Eu me proíbo de querer você aqui Eu te proíbo de olhar pra mim Porque eu sou crescida e já conheço o fim Eu te proíbo de cantar pra mim outra vez Momentos passam devagar ou rápido demais Não sei se eu me arrependi ou se eu quero mais De você  Não, não vá embora se eu pedir Não, não fale nada fique aqui E sei, não vou saber me acostumar Se você não está, não, não Não, não me olhe mais assim Não, nem pense em não pensar em mim Eu sei não vou saber me acostumar Se você não está, não, não  Eu estou ficando louca Mais eu escondo bem Eu procuro um sinal Mais enquanto ele não vem Eu te proíbo de passar perto de mim De me roubar um beijo e me deixar assim Eu te proíbo de esquecer o que aconteceu",Manu Gavassi
22,Eu Te Quero (Com Zeeba),/manu-gavassi/eu-te-quero-com-zeeba.html,,"You don't need to say a word Now I won't be moving on I'm locking up that door We don't need to act so cool Cause I already fell for you I already fell you  Logo eu, emocionalmente instável Meio louca, visceral Achava improvável Ser simples assim Tão “drama queen” Amor sem caos é estranho pra mim Mas com você É fácil me contradizer É estranho até perceber É estranho querer tanto você Eu nunca pensei Em silêncio com você Eu me encontrei Nem precisa falar nada meu amor Eu sei Acostumada com um drama meio que cansei  Eu nunca pensei Em silêncio com você Eu me encontrei Nem precisa falar nada meu amor, ok Eu já entendi que eu te quero Eu te quero You don't need to say a word Now I won't be moving on I'm locking up that door We don't need to act so cool  Cause I already fell for you Already fell you And I didn't even notice  Nunca pensei, nunca pensei, nunca nunca pensei  I've been to a thousand different places To find out But I still don't know No, I don't really know Sometimes I get lost But I realized That I just got to paradise I really really really fell for you There's no explanation Nothing I can do Eu nunca pensei Em silêncio com você Eu me encontrei Nem precisa falar nada meu amor Eu sei Acostumada com um drama meio que cansei Eu nunca pensei Em silêncio com você Eu me encontrei Nem precisa falar nada meu amor, ok Eu já entendi que eu te quero Eu te quero You don't need to say a word Now I won't be moving on I'm locking up that door We don't need to act so cool  Cause I already fell for you Already fell you And I didn't even notice  Nunca pensei, nunca pensei, nunca nunca pensei",Manu Gavassi
23,Farsa,/manu-gavassi/farsa.html,Vício - EP,"Quem diria agora olha pra você, amor Quem diria agora você é o galã, eu vou Fugir pra bem longe do seu ego Pra ver se de longe eu não me estresso Lembrando, se você estivesse só, você estaria aqui  Acordava de noite, chorando Me pedindo pra nunca te deixar Bastou um pouco de gente te olhando Pra esquecer quem você é, mas vou te lembrar Porque eu sei tão bem, tão bem Eu sei tão bem como ninguém  Relaxa, eu não vou revelar a sua farsa Ninguém vai saber Relaxa, eu não faço mais parte dessa farsa, não Ninguém vai saber que há dois meses atrás chorava Me implorando e me pedindo pra ficar Nem disfarça, que agora está no topo e não precisa se preocupar Mas relaxa, você disfarça muito bem, meu bem A sua farsa  Você escolheu a fama, eu escolhi o seu amor Parece triste, mas não é porque eu me livrei que eu vou Fugir pra bem longe desse drama Porque você de longe não me engana Eu sei que se você estivesse só, você estaria aqui E eu que sempre saquei seu esquema Perdi meu tempo, mas agora não perco mais Ter uma só sempre foi o seu problema Seu teatro eu aprendi muito tempo atrás É eu sei tão bem, tão bem Eu sei tão bem, como ninguém  Relaxa, eu não vou revelar a sua farsa Ninguém vai saber Relaxa, eu não faço mais parte dessa farsa, não Ninguém vai saber que há dois meses atrás chorava Implorando e me pedindo pra ficar Nem disfarça, que agora está no topo e não precisa se preocupar Mas relaxa, você disfarça muito bem, meu bem  Então fala difícil pra impressionar Pra da sua rebeldia ninguém mais lembrar Fala baixinho pra eu escutar, não escutar, não escutar Bebe um pouquinho pra impressionar E pega a modelinho pra se afirmar Solteiro é bem melhor Mais manchete e tal Mas cuidado que a queda é proporcional  Relaxa, eu não vou revelar a sua farsa Ninguém vai saber Relaxa, eu não faço mais parte dessa farsa, não Ninguém vai saber que há dois meses atrás chorava Implorando e me pedindo pra ficar Nem disfarça, que agora está no topo e não precisa se preocupar Mas relaxa, eu não vou revelar a sua farsa Ninguém vai saber Relaxa, eu não faço mais parte dessa farsa, não Ninguém vai saber que há dois meses atrás chorava Implorando e me pedindo pra ficar Nem disfarça, que agora está no topo e não precisa se preocupar Mas relaxa Relaxa, você disfarça muito bem meu bem Relaxa Yeah, yeah, yeah Relaxa Yeah, yeah, yeah, yeah, yeah",Manu Gavassi
24,Fora de Foco,/manu-gavassi/fora-de-foco.html,MANU,"[Verso 1] A melhor hora é sempre quando você chega e fecha a porta Vem me encarado e se encosta Faz minha pele te chamar Deixa seu rastro Puxa meu cabelo e se faz de laço Me deixa sem ar Eu não consigo disfarçar  [Pré-refrão] Eu perco foco e não dá pra parar Ouço minha voz pedindo pra você ficar Talvez seja tarde, mas eu esqueci de notar Fora de foco e fora de mim Meu coração acelerando é sempre assim Chega mais perto então Te tenho na minha mão, na minha mão  [Refrão] Então vem que eu te quero aqui de novo Então vem, me tira o sono e eu te tiro o ar Então vem, todo tempo ainda é pouco Então vem, vem, vem, vem, vem, vem, vem  [Verso 2] A melhor hora é sempre quando você chega e fecha a porta Não fala nada e só encosta Deixa o seu corpo me ganhar Deixa o seu cheiro Faz bagunça na minha nuca e fala no ouvido Perco a noção do perigo Eu não consigo disfarçar  [Pré-refrão] Eu perco foco e não dá pra parar Ouço minha voz pedindo pra você ficar Talvez seja tarde, mas eu esqueci de notar Fora de foco e fora de mim Meu coração acelerando é sempre assim Chega mais perto então Te tenho na minha mão, na minha mão  [Refrão] Então vem que eu te quero aqui de novo Então vem, me tira o sono e eu te tiro o ar Então vem, todo tempo ainda é pouco Então vem, vem, vem, vem, vem, vem, vem  [Ponte] E o seu toque sabe de cor o trajeto Sabe o jeito certo de me eletrizar E me faz ser arrepio Me tem fácil demais Eu gosto tanto, eu gosto tanto  [Refrão] Então vem que eu te quero aqui de novo Então vem, me tira o sono e eu te tiro o ar Então vem, todo tempo ainda é pouco Então vem, vem, vem, vem, vem, vem, vem",Manu Gavassi
25,Garoto Errado,/manu-gavassi/garoto-errado.html,Manu Gavassi,"Alguém pode me explicar Oque eu faço Pra não me sentir assim, Eu já comecei a perceber, O efeito que você tem sobre mim.  Meu coração começa a disparar, Será que eu tô pirando, Você quer me provocar Você me olha e eu começo a rir Quando o melhor que eu faço é fugir !  Então me diz o que eu faço Pra tentar te esquecer, Eu nem sei o que eu gosto Tanto,tanto em você  Seu sorriso e seu jeitinho De tentar me irritar Se tiver uma maneira Vou tentar evitar  Eu juro,eu faço tudo Para eu não Me apaixonar  Será que são mesmo reais Os sinais que eu percebi, Talvez eu esteja me iludindo E você não esteja nem aí  Mesmo assim eu continuo a imaginar Eu e você pra mim parece combinar Eu sou a letra e você a melodia Com você eu cantaria todo dia !  Então me diz o que eu faço Pra tentar te esquecer, Eu nem sei o que eu gosto Tanto,tanto em você  Seu sorriso e seu jeitinho De tentar me irritar Se tiver uma maneira Vou tentar evitar  Eu juro,eu faço tudo Para eu não Me apaixonar  Eu já notei que eu tenho que tomar cuidado Porque você é o tipo certo de garoto errado É só você aparecer pra eu perder a fala E a confusão acontecer  Então me diz o que eu faço Pra tentar te esquecer, E me diz porque eu gosto Tanto,tanto de você  Foi seu sorriso e seu jeitinho De tentar me irritar Se tiver uma maneira Vou tentar evitar  Eu juro,eu faço tudo Eu juro,eu faço tudo Eu juro,eu faço tudo Para eu não Me apaixonar",Manu Gavassi
26,Heart Song,/manu-gavassi/heart-song.html,MANU,"[Verso 1] As luzes me chamam, não dá pra ficar A noite lá fora não vai mais voltar Te levo comigo é só você falar, falar Agora tudo em volta me faz esquecer Perigo ou amor, é só escolher É livre quem dança sem saber por quê, por quê [Pré-Refrão] Não dá pra fugir Quero ficar pra sempre aqui Nesse momento Nessa mesma vibração Agora já não dá O que passou não vai voltar E essa noite eu não preciso de ninguém  [Refrão] Eu só preciso do som do meu coração batendo Eu só preciso do som Eu só preciso do som Eu só preciso do som do meu coração batendo Eu só preciso do som Eu só preciso do som  [Verso 2] As luzes me chamam, brilham só pra mim Não lembro de quando eu me senti assim A noite começa e eu não quero o fim, o fim Agora tudo em volta me faz esquecer Perigo ou amor, é só escolher É livre quem dança sem saber por quê, por quê  [Refrão] Eu só preciso do som do meu coração batendo Eu só preciso do som Eu só preciso do som Eu só preciso do som do meu coração batendo Eu só preciso do som Eu só preciso do som  [Verso 2] As luzes me chamam, brilham só pra mim Não lembro de quando eu me senti assim A noite começa e eu não quero o fim, o fim Agora tudo em volta me faz esquecer Perigo ou amor, é só escolher É livre quem dança sem saber por quê, por quê  [Pré-Refrão] Não pra fugir Quero ficar pra sempre aqui Nesse momento Nessa mesma vibração Agora já não dá O que passou não vai voltar E essa noite eu não preciso de ninguém  [Refrão] Eu só preciso do som do meu coração batendo Eu só preciso do som Eu só preciso do som Eu só preciso do som do meu coração batendo Eu só preciso do som Eu só preciso do som  [Ponte] É livre quem dança sem saber por quê É livre quem dança sem saber por quê É livre quem dança sem saber por quê É livre quem dança sem saber por quê É livre quem dança  [Refrão] Eu só preciso do som do meu coração batendo Eu só preciso do som Eu só preciso do som Eu só preciso do som do meu coração batendo Eu só preciso do som Eu só preciso do som  [Refrão] Eu só preciso do som do meu coração batendo Eu só preciso do som Eu só preciso do som Eu só preciso do som do meu coração batendo Eu só preciso do som Eu só preciso do som",Manu Gavassi
27,Hey,/manu-gavassi/hey.html,MANU,"[Verso 1] Hey, já não te vejo mais faz tempo, faz tempo É, você me liga perguntando se eu lembro, até lembro Eu sei bem onde isso vai chegar Esse é meu jogo, eu te ensinei a jogar Não tá fazendo nada então vem pra casa Só não pira porque disso não passa  [Refrão] Eu te avisei Se a gente começa, não dá pra voltar atrás, eu sei Se a gente começa, não dá pra parar Ih, oh, oh Se eu te beijo agora, você fica e pede mais Oh, oh Se eu te beijo agora, você não esquece mais Se eu te beijo agora, você fica e pede mais Se eu te beijo agora, você não esquece mais  [Verso 2] Hey, não acredite em tudo que eu digo, é perigo, é Diz que me ama, qualquer coisa eu te aviso, te aviso Eu sei bem onde isso vai chegar Esse é meu jogo, eu te ensinei a jogar Não tá fazendo nada então vem pra casa Só não pira porque disso não passa  [Refrão] Eu te avisei Se a gente começa, não dá pra voltar atrás, eu sei Se a gente começa, não dá pra parar Ih, oh, oh Se eu te beijo agora, você fica e pede mais Oh, oh Se eu te beijo agora, você não esquece mais Se eu te beijo agora, você fica e pede mais Se eu te beijo agora, você não esquece mais",Manu Gavassi
28,Hipnose,/manu-gavassi/hipnose.html,MANU,"É como um sonho e você não quer acordar Te vejo me olhando e tentando decifrar E eu não consigo mais parar  Ei cuidado que eu sou problema Eu sei com essa cara ninguém diz Eu cansei te ver chorar me faz sorrir outra vez Sem parar, se for maldade me desculpa eu não consigo evitar Se for maldade me desculpa eu não consigo evitar Se for maldade me desculpa eu não consigo evitar  É como um vício e não dá pra explicar O nosso beijo é hipnose e te faz querer ficar E é difícil respirar  Ei cuidado que eu sou problema Eu sei com essa cara ninguém diz Eu cansei te ver chorar me faz sorrir outra vez Sem parar, se for maldade me desculpa eu não consigo evitar Se for maldade me desculpa eu não consigo evitar   Tire a jaqueta jeans agora e vem pra cá Quando eu te esquecer você vai implorar Eu já sofri muito agora eu sei jogar, eu sei jogar, eu sei jogar  Tire a jaqueta jeans agora e vem pra cá Quando eu te esquecer você vai implorar Eu já sofri muito agora eu sei jogar, eu sei jogar, eu sei jogar  Ei cuidado que eu sou problema Eu sei com essa cara ninguém diz Eu cansei te ver chorar me faz sorrir outra vez Sem parar, se for maldade me desculpa eu não consigo evitar  Ei cuidado que eu sou problema Eu sei com essa cara ninguém diz Eu cansei te ver chorar me faz sorrir outra vez Sem parar  Se for maldade me desculpa eu não consigo evitar",Manu Gavassi
29,Já Não Importa Mais,/manu-gavassi/ja-nao-importa-mais.html,,"E se eu disser que seu futuro, se encontra em suas mãos Mas o medo de arriscar te faz ter a sensação Que os seus sonhos são frustrados e não vão acontecer Mas pra ser realidade só depende de você!  Só depende de você, pra fazer acontecer Então faça a sua parte, porque a minha vou fazer  [refrão]  Eu vou seguir, sem descansar Até que eu possa encontrar O meu lugar !  Sem desistir, vou alcançar, e a minha estrela vai brilhar E nunca, se apagará !  O meu lugar ! (4x)  A minha força vem do alto, mas mantenho os pés no chão Reconheço quem me apoia do início até o final  E não importa o que digam, nunca pare de lutar,a A historia da sua vida, só você pode mudar !  [refrão]  Eu vou seguir, sem descansar Até que eu possa encontrar O meu lugar !  Sem desistir, vou alcançar, e a minha estrela vai brilhar E nunca, se apagará ! (2x)  O meu lugar ! (4x)",Manu Gavassi
30,Linda Melodia,/manu-gavassi/linda-melodia.html,,"Não sei como aconteceu Eu te olhei, logo vi que você percebeu que entre a gente há algo mais Nem tentei disfarçar não vou mais voltar a trás  Você me olhou e eu transformei tudo aquilo que eu sentia na mais linda melodia  E eu parei de procurar tudo aquilo que eu queria em você eu consegui encontrar  Quero parar este momento pra tentar entender o que é este sentimento  Quero ouvir você falar que eu sou tudo que pediu, que te faço sonhar  Você me olhou e eu transformei tudo aquilo que eu sentia na mais linda melodia  E eu parei de procurar tudo aquilo que eu queria, em você eu consegui encontrar  Oh o oh Em você eu consegui encontrar",Manu Gavassi
31,Me Beija,/manu-gavassi/me-beija.html,MANU,"Você diz que ninguém fica mais linda que eu usando a sua roupa Te respondo que eu fico melhor sem (você me deixa louca) Chego bem mais perto do que a gente tá Te vejo tão perto que posso escutar Você abrindo o jogo pra me provocar, só pra me provocar  [Pré-refrão] Se o mundo acabasse agora, eu não sairia daqui Se o mundo acabasse agora, agora  [Refrão] Então me beija como se fosse acabar E não me solta, me beija como se fosse acabar Me beija como se fosse acabar Não fala nada, me beija como se fosse acabar  Você diz que não tem mais controle se eu beijo a sua boca Mas eu te mostro que tanto faz, temos a tarde toda Chego bem mais perto do que a gente tá Te vejo tão perto que posso escutar Você abrindo o jogo pra me provocar, só pra me provocar  [Pré-refrão] Se o mundo acabasse agora, eu não sairia daqui Se o mundo acabasse agora, agora  [Refrão] Então me beija como se fosse acabar E não me solta, me beija como se fosse acabar Me beija como se fosse acabar Não fala nada, me beija como se fosse acabar  [Ponte] Deixa a pressa na sala de estar Esquece o seu tempo em mim, vem cá Deixa a pressa na sala de estar Esquece o seu tempo em mim, vem cá Que já é cedo de novo Não dá pra te largar um segundo e parar Quero sua boca na minha Fazer você arrepiar Que já é cedo de novo Não dá pra te largar um segundo e parar Quero sua boca na minha Fazer você arrepiar  [Refrão] Então me beija como se fosse acabar E não me solta, me beija como se fosse acabar Me beija como se fosse acabar Não fala nada, me beija como se fosse acabar Como se fosse acabar, como se fosse acabar Então me beija como se fosse acabar Não fala nada e me beija, me beija",Manu Gavassi
32,Meio Sorriso,/manu-gavassi/meio-sorriso.html,Clichê Adolescente,"O tempo passa e está sempre tudo bem Até quando não está Na sua boca eu vejo as palavras Que esqueceu de falar Você esqueceu de se importar E agora o que restou, nada  E eu não sei mais porquê Eu me contento com o pouco que você me da E eu não consigo entender Minha fraqueza pelos seus meios sorrisos Que aparecem só quando você quer Pra me acalmar  Você me olha e está sempre tudo bem Mais eu sei que não está Eu me esforço pra ser o que você quer Você esqueceu de notar Você esqueceu de se importar E agora o que restou, nada   E eu não sei mais porquê Eu me contento com o pouco que você me da E eu não consigo entender Minha fraqueza pelos seus meios sorrisos Que aparecem só quando você quer Que aparecem só quando você quer Pra me acalmar  E eu não sei mais porquê E eu não sei mais porquê Eu me contento com o pouco que você me da E eu não consigo entender Não, não E eu não sei mais porquê Eu me contento com o pouco que você me da E eu não consigo entender Não, não, não E eu não sei mais porquê E eu não consigo entender Não, não",Manu Gavassi
33,Memories,/manu-gavassi/memories.html,,No one said that it was easy to forget about all the stuff you said No one said you would believe me I won't care about all the dreams I had  Now I just want you to be with me All my plans are made for us All the love that you gave up I don't know what else to do No no no no no All my songs I've wrote for you All the things we've used to do Now are just my memories Just my memories  I keep trying to get over you And I admit that we weren't mean to be I keep trying to don't look at you Let's pretend that our story ends  Now I just want you to stay with me All my plans are made for us All the love that you gave up I don't know what else to do No no no no no All my songs I've wrote for you All the things we've used to do Now are just my memories  Please don't let me here just wondering how you feel Come and tell me if it is real Is it real?  Guess it's just my memories Just my memories,Manu Gavassi
34,Mentiras Bonitas,/manu-gavassi/mentiras-bonitas.html,MANU,"[Verso 1] Mal te conheço e nem sei se deveria, tão errado Você me diz que ainda é cedo pra dormir eu também acho Eu deveria estar cansada desse tipo, desse plano E desses olhos de quem mente e você sabe que eu amo  [Pré-refrão] Chega perto e não dá mais pra voltar, eu sei Se eu soubesse, eu erraria sim de novo, outra vez Chega perto e não dá mais pra voltar, eu sei, eu sei  [Refrão] Enquanto começa eu consigo ver o fim Sua boca cheia de mentiras bonitas pra mim Enquanto começa eu consigo ver o fim Sua boca cheia de mentiras bonitas pra mim Enquanto começa eu consigo ver o fim Enquanto começa eu consigo ver o fim Sua boca cheia de mentiras bonitas pra mim Enquanto começa eu consigo ver o fim  [Verso 2] Você vai ver Eu brinco com o seu coração só porque eu posso Você me diz que agora tarde, eu concordo Eu deveria estar cansada desse tipo, desse plano E desses olhos de quem mente e você sabe que eu amo  [Pré-refrão] Chega perto e não dá mais pra voltar, eu sei Se eu soubesse, eu erraria sim de novo, outra vez Chega perto e não dá mais pra voltar, eu sei, eu sei  [Refrão] Enquanto começa eu consigo ver o fim Sua boca cheia de mentiras bonitas pra mim Enquanto começa eu consigo ver o fim Sua boca cheia de mentiras bonitas pra mim Enquanto começa eu consigo ver o fim Enquanto começa eu consigo ver o fim Sua boca cheia de mentiras bonitas pra mim Enquanto começa eu consigo ver o fim",Manu Gavassi
