,author,text
500,Clarice Lispector,Que importa o sentido? O sentido sou eu.
501,Clarice Lispector,"Sim, meu Deus. Que se possa dizer sim."
502,Clarice Lispector,"Já que ela não era uma pessoa triste, procurou continuar como se nada tivesse perdido. Ela não sentiu desespero. Também o que é que ela podia fazer? Pois ela era crônica. Tristeza era luxo."
503,Clarice Lispector,"E Macabéa, com medo de que o silêncio já significasse uma ruptura, disse ao recém-namorado:- Eu gosto tanto de parafuso e prego, e o senhor?"
504,Clarice Lispector,Parece que às vezes sou espontânea demais e isso me torna engraçada.
505,Clarice Lispector,"Já que se há de escrever, que pelo menos não se esmaguem com palavras as entrelinhas. O melhor ainda não foi escrito. O melhor está nas entrelinhas."
506,Clarice Lispector,"Como começar pelo início, se as coisas acontecem antes de acontecer?"
507,Clarice Lispector,Eu escrevo para me livrar da carga difícil de uma pessoa ser ela mesma.
508,Clarice Lispector,- Ela é tão livre que um dia será presa.- Presa por quê?- Por excesso de liberdade.- Mas essa liberdade é inocente?- É. Até mesmo ingênua.- Então por que a prisão?- Porque a liberdade ofende.
509,Clarice Lispector,O que estraga a felicidade é o medo.
510,Clarice Lispector,Toda mulher leva um sorriso no rosto e mil segredos no coração.
511,Clarice Lispector,"Mas sei de uma coisa: meu caminho não sou eu, é o outro, é os outros. Quando eu puder sentir plenamente o outro então estarei salva e pensarei: eis o meu porto de chegada."
512,Clarice Lispector,"Jamais perca a sensibilidade, mesmo que às vezes ela arranhe a alma."
513,Clarice Lispector,Não posso perder um minuto do tempo que faz minha vida. Amar os outros é a única salvação individual que conheço: ninguém estará perdido se der amor e às vezes receber amor em troca.
514,Clarice Lispector,Estou cansada. Meu cansaço vem muito porque sou pessoa extremamente ocupada: tomo conta do mundo.(in: Água Viva)
515,Clarice Lispector,De repente as coisas não precisam mais fazer sentido
516,Clarice Lispector,Pouco sei sobre o amor. Apenas lembro-me que o temia e o procurava.
517,Clarice Lispector,"""Não perguntavam por mim, mas deram por minha falta. Na trama da minha ausência, inventaram tela falsa."""
518,Clarice Lispector,"Tudo me atinge - vejo demais, ouço demais, tudo exige demais de mim."
519,Clarice Lispector,Estou escrevendo porque não sei o que fazer de mim.
520,Clarice Lispector,"Faz de conta que ela não estava chorando por dentro, pois agora, mansamente, embora de olhos secos, o coração estava molhado; ela saíra agora da voracidade de viver."
521,Clarice Lispector,"Tenho me convivido muito ultimamente e descobri com surpresa que sou suportável, às vezes até agradável de ser. Bem. Nem sempre."
522,Clarice Lispector,"Para que escrevo? E eu sei? Sei não. Sim, é verdade, às vezes também penso que eu não sou eu, pareço pertencer a uma galáxia longínqua de tão estranho que sou de mim. Sou eu? Espanto-me com o meu encontro."
523,Clarice Lispector,"Fotografia é o retrato de um concavo,de uma falta,de uma ausencia"
524,Clarice Lispector,Estou atrás do que fica atrás do pensamento. Inútil querer me classificar: eu simplesmente escapulo.
525,Clarice Lispector,"O pecado me atrai, o que é proibido me fascina."
526,Clarice Lispector,"Esquenta-me com a tua adivinhação de mim, compreende-me porque eunão estou me compreendendo. Estou somente amando a barata. E é um amorinfernal.GH. 115"
527,Clarice Lispector,"Melhor assim. Não quero mais depender de ninguém. Quero é o ""Danúbio Azul"". E não ""Valsa Triste"" de Sibellius, se é que é assim que se escreve o seu nome."
528,Clarice Lispector,"As árvores estavam carregadas, o mundo era tão rico que apodrecia!"
529,Clarice Lispector,A eternidade é o estado das coisas neste momento.
530,Clarice Lispector,"""Quando começa a ficar bom ou eu desconfio ou dou um passo para trás."""
531,Clarice Lispector,"Deus vinde a mim e não tenho alegria e minha vida é escura como a noite sem estrelas e Deus, por que não existes dentro de mim? Por que me fizeste separada de ti?"
532,Clarice Lispector,Aquilo que eu não sei é a minha melhor parte!
533,Clarice Lispector,Acho que devemos fazer coisa proibida – senão sufocamos. Mas sem sentimento de culpa e sim como aviso de que somos livres.
534,Clarice Lispector,Nunca sofra por não ser uma coisa ou por sê-la.
535,Clarice Lispector,"Quero que me dêem isto: não a explicação, mas a compreensão."
536,Clarice Lispector,A dor parece uma ofensa à nossa integridade física.
537,Clarice Lispector,Você pode até me empurrar de um penhasco que eu vou dizer:- E daí? Eu adoro voar.
538,Clarice Lispector,"E tudo isso já faz parte de um todo, de um mistério. Sou uma só. (...) Sou um ser. E deixo que você seja. Isso lhe assusta? Creio que sim. Mas vale a pena. Mesmo que doa. Dói só no começo."
539,Clarice Lispector,Eu só trabalho com achados e perdidos.
540,Clarice Lispector,O futuro é meu enquanto eu viver.
541,Clarice Lispector,Hoje eu acordei com uma tal nostalgia de ser feliz.
542,Clarice Lispector,É preciso não ter medo de criar.
543,Clarice Lispector,"Ah, está se tornando difícil escrever. Porque sinto como ficarei de coração escuro ao constatar que, mesmo me agregando tão pouco à alegria, eu era de tal modo sedenta que um quase nada já me tornava uma menina feliz."
544,Clarice Lispector,Ser feliz é uma responsabilidade tão grande...
545,Clarice Lispector,E nesse silêncio profundo se esconde a minha vontade de gritar.
546,Clarice Lispector,"Eu antes vivia de um mundo humanizado,mas o puramente vivo derrubou a moralidade que eu tinha.É qye um mundo todo vivo tem a força de um Inferno"
547,Clarice Lispector,Sinto a falta dele como se me faltasse um dente na frente: excrucitante.
548,Clarice Lispector,Perder-se é um achar perigoso.
549,Clarice Lispector,Coragem e covardia são um jogo que se joga a cada instante. Assusta a visão talvez irremediável e que talvez seja a da liberdade.
550,Clarice Lispector,"Estranhei tudo. E, por me estranhar, vi-me por um instante como sou. Gostei ou não? Simplesmente aceitei."
551,Clarice Lispector,"Não suporto tentações, pois caio em todas elas."
552,Clarice Lispector,Eu e minha liberdade que não sei usar
553,Clarice Lispector,... existe a quem falte o delicado essencial. (A Hora da Estrela)
554,Clarice Lispector,Saudade é um dos sentimentos mais urgentes que existem
555,Clarice Lispector,"Que alívio! Felicidade, meu bem, é alívio..."
556,Clarice Lispector,"""Não se pode andar nú nem de corpo nem de espírito."""
557,Clarice Lispector,"A vida, meu amor, é uma grandesedução onde tudo o que existe se seduz. Aquele quarto que estava deserto e porisso primariamente vivo. Eu chegara ao nada, e o nada era vivo e úmido.GH 61"
558,Clarice Lispector,Tenho medo de revelar de quanto eu preciso e de como sou pobre.
559,Clarice Lispector,"Oh, Deus, e eu que faço concorrência a mim mesma. Me detesto. Felizmente os outros gostam de mim. É uma tranquilidade."
560,Clarice Lispector,Minhas desequilibradas palavras são o luxo de meu silêncio.
561,Clarice Lispector,"""Ninguém sabia que ela estava sendo infeliz a ponto de precisar buscar vida.""""Ela só sabia viver."""
562,Clarice Lispector,"""Não, não quero mais gostar de ninguém porque dói. Não suporto mais a morte de ninguém que me é caro. Meu mundo é feito de pessoas que são minhas – e eu não posso perdê-las sem me perder."""
563,Clarice Lispector,"Divertir os outros, um dos modos mais emocionantes de existir."
564,Clarice Lispector,Minha bondade tem limites: não posso proteger quem me ofende.
565,Clarice Lispector,(...) sabendo que nossa indiferença é angústia disfarçada.
566,Clarice Lispector,Sempre conservei uma aspa à esquerda e outra à direita de mim.
567,Clarice Lispector,"""A virtude da vida não está em fazer aquilo que se gosta, e sim gostar daquilo que se faz. Por isso seja forte, não como as ondas que tudo destrói, mas como as pedras que tudo suporta!"""
568,Clarice Lispector,"Quase sempre amamos a quem nos ama mal, e desprezamos quem melhor nos quer..."
569,Clarice Lispector,E todos os dias ficarei tão alegre que incomodarei os outros
570,Clarice Lispector,"Estou com saudade de mim. Ando pouco recolhida, atendendo demais ao telefone, escrevo depressa, vivo depressa. Onde está eu?"
571,Clarice Lispector,Ser livre é seguir-se afinal.(Perto do Coração Selvagem)
572,Clarice Lispector,Sou fraca diante da beleza do que existe e do que vai existir
573,Clarice Lispector,"Redondo sem início e sem fim, eu sou o ponto antes do zero e do ponto final."
574,Clarice Lispector,"Hoje estou muito delicada, me interessam principalmente flores e passarinhos."
575,Clarice Lispector,"Gosto de um modo carinhoso do inacabado, do malfeito, daquilo que desajeitadamente tenta um pequeno vôo e cai sem graça no chão."
576,Clarice Lispector,"Mas enquanto eu tiver a mim, não estarei só."
577,Clarice Lispector,“No fundo sou sozinha. Há verdades que nem a Deus eu contei. E nem a mim mesma. Sou um segredo fechado a sete chaves. Por favor me poupe. Estou tão só. Eu e meus rituais. O telefone não toca. Dói. Mas é Deus que me poupa.”
578,Clarice Lispector,"Disso tudo, restam nervos muito sensíveis e uma predisposição séria para ficar calada. Mas aceito tanto agora. Nem sempre pacificamente, mas a atitude é de aceitar."
579,Clarice Lispector,Pensando bem: quem não é um acaso na vida?
580,Clarice Lispector,Tenha felicidade bastante para fazê-la doce. Dificuldades para fazê-la forte. Tristeza para fazê-la humana. E esperança suficiente para fazê-la feliz.
581,Clarice Lispector,Observo em mim mesma as mudanças de estação: eu claramente mudo com elas.
582,Clarice Lispector,Um pouco de aventura liberta a alma cativa do algoz cotidiano.
583,Clarice Lispector,Estou naqueles momentos silenciosos em que pouca coisa parece fazer sentido.
584,Clarice Lispector,"E porque minha alma é tão ilimitada que já não é eu, e porque ela está tão além de mim- é que sempre sou remota a mim mesma, sou-me inalcançavel como me é inalcançavel um astro."
585,Clarice Lispector,"""E eis que de repente agoravi que não sou pura"""
586,Clarice Lispector,Sobreviver chama-se manter luta contra a vida que é mortal.
587,Clarice Lispector,Quem não é um acaso na vida?
588,Clarice Lispector,Tenho pensamentos que não podem ser traduzidos em palavras.
589,Clarice Lispector,"As mulheres devem arriscar sempre e se ""divertir"" com todos os homens que as desejam, uma hora tudo vai dar certo."
590,Clarice Lispector,"As coisas estavam de algum modo tão boas que podiam se tornar muito ruins porque o que amadurece plenamente pode, apodrecer."
591,Clarice Lispector,"Quem sabe, até, eu ERA só aprendiz de anjo..."
592,Clarice Lispector,"E a escuridão se torna tão maior. Estou caindo numa tristeza sem dor. Não é mau. Faz parte. Amanhã provavelmente terei alguma alegria, também sem grande êxtases, só alegria, e isso também não é mau. É, mas não estou gostando muito deste pacto com a mediocridade de viver."
593,Clarice Lispector,"Esse primeiro calor ainda fresco traz: tudo. Apenas isso, e indiviso: tudo.E tudo é muito para um coração de repente enfraquecido que só suporta o menos, só pode querer o pouco e aos poucos."
594,Clarice Lispector,Talvez a pergunta vazia fosse apenas para que um dia alguém não viesse a dizer que ela nem ao menos havia perguntado. Por falta de quem lhe respondesse ela mesma parecia se ter respondido: é assim porque é assim.
595,Clarice Lispector,Ser um ser permissível a si mesmo é a glória de existir.
596,Clarice Lispector,"Se tenho que ser um objeto, que seja um objeto que grita.”"
597,Clarice Lispector,"Eu não escrevo o que quero, escrevo o que sou."
598,Clarice Lispector,"Carnaval era meu, meu. No entanto, na realidade, eu dele pouco participava."
599,Clarice Lispector,Eu me permito mais liberdade e mais experiências.E aceito o acaso.Anseio pelo que ainda não experimentei.Maior espaço psíquico.Estou felizmente mais doida.
600,Clarice Lispector,"Chore, grite, ame e diga que valeu, que doeu, que daqui pra frente só vai melhorar. Perdoe, insista, respeite, ame novamente."
601,Clarice Lispector,O que eu sinto eu não ajo. O que ajo não penso. O que penso não sinto. Do que sei sou ignorante. Do que sinto não ignoro. Não me entendo e ajo como se entendesse.
602,Clarice Lispector,"De mim, só se sabe que respiro"
603,Clarice Lispector,É preciso coragem para me aventurar numa tentativa de concretização do que sinto. É como se eu tivesse uma moeda e não soubesse em que país ela vale.
604,Clarice Lispector,O verão está instalado no meu coração.
605,Clarice Lispector,Esperar que algo amadureça é uma experiência sem par: como na criação artística em que se conta com o vagaroso trabalho do inconsciente.
606,Clarice Lispector,"Minha coragem foi a de um sonâmbulo, que simplesmente vai..."
607,Clarice Lispector,"Eu sou sozinha no mundo e não acredito em ninguém; todos mentem, às vezes até na hora do amor, eu não acho que um ser fale com o outro, a verdade só me vem quando estou sozinha."
608,Clarice Lispector,"Me abrace, que no abraço mais do que em palavras, as pessoas se gostam."
609,Clarice Lispector,Sou tão misteriosa que não me entendo.
610,Clarice Lispector,Você as vezes não estranha de ser você?
611,Clarice Lispector,Dar a mão a alguém foi o que eu sempre esperei da alegria.
612,Clarice Lispector,Eu não: quero é uma realidade inventada.
613,Clarice Lispector,"Confie na minha transparência. Sou eternamente explícita. Se não gosto, não faço charme. Doa a quem doer, minha sinceridade e bem-estar são colocados em primeiro lugar, não nego."
614,Clarice Lispector,"Sou composta por urgências: minhas alegrias são intensas; minhas tristezas, absolutas. Me entupo de ausências, me esvazio de excessos. Eu não caibo no estreito, eu só vivo nos extremos."
615,Clarice Lispector,"Respeite mesmo o que é ruim em você - respeite sobretudo o que imagina que é ruim em você - não copie uma pessoa ideal, copie você mesma - é esse seu único meio de viver."
616,Clarice Lispector,"Porque eu fazia do amor um cálculo matemático errado: pensava que, somando as compreensões, eu amava. Não sabia que, somando as incompreensões é que se ama verdadeiramente. Porque eu, só por ter tido carinho, pensei que amar é fácil."
617,Clarice Lispector,Saudade do teu grande abraço. Perto do Coração Selvagem
618,Clarice Lispector,"""Entre as marteladas eu ouço o silêncio.""Um Sopro de Vida"
619,Clarice Lispector,"Sua sensibilidade incomodava sem ser dolorosa, como uma unha quebradiça."
620,Clarice Lispector,Acordei hoje com tal nostalgia de ser feliz
621,Clarice Lispector,"Sabe o que eu quero de verdade? Jamais perder a sensibilidade, mesmo que às vezes ela arranhe um pouco a alma. Porque sem ela não poderia sentir a mim mesma..."
622,Clarice Lispector,"Às vezes melancolia sem causa escurecia-me o rosto, uma saudade morna e incompreensível de épocas nunca vividas me habitava."
623,Clarice Lispector,"Parece drama, parece idiotice. Porque não é você que está sentindo."
624,Clarice Lispector,Sou um coração batendo no mundo.
625,Clarice Lispector,"""Passo o tempo todo pensando – não raciocinando, não meditando – mas pensando, pensando sem parar. E aprendendo, não sei o quê, mas aprendendo."""
626,Clarice Lispector,Tenho o péssimo hábito de fugir de algumas coisas que amo.
627,Clarice Lispector,"Eu acho que quando não escrevo, estou morta"
628,Clarice Lispector,"Não fossem os caminhos de emoção a que leva o pensamento, pensar já teria sido catalogado como um dos modos de se divertir."
629,Clarice Lispector,Mais vale em certas circunstâncias esquecer de si e deixar surpreender.
630,Clarice Lispector,Já escondi um amor com medo de perdê-lo.
631,Clarice Lispector,"Não me manipule, nasci pra viver livre..."
632,Clarice Lispector,"""Ninguém é maduro quando se trata de amor."""
633,Clarice Lispector,Eu sou mais forte do que eu.
634,Clarice Lispector,"Se tiver coragem, eu me deixarei continuar perdida. Mas tenho medo do que é novo e tenho medo de viver o que não entendo. Quero sempre ter a garantia de pelo menos estar pensando que entendo, não sei me entregar à desorientação."
635,Clarice Lispector,"Como um gato de dorso arrepiado, arrepio-me diante de mim"
636,Clarice Lispector,"Que medo alegre, o de te esperar."
637,Clarice Lispector,"Não me deixe ir, posso não mais voltar."
638,Clarice Lispector,"""Outro sinal de se estar em caminho certo é o de não ficar aflita por não entender; a atitude deve ser: não se perde por esperar, não se perde por não entender."""
639,Clarice Lispector,"Chego a chorar, manso de tristeza. Depois levanto e de novo recomeço."
640,Clarice Lispector,"""Não há dúvida:Pensar me irrita e antes de eucomeçar a pensar eu sabia muitobem o que eu sabia"""
641,Clarice Lispector,"""O horror será a minha responsibilidade até que se complete a metamorfose e que o horror se transforme em claridade."""
642,Clarice Lispector,O destino de uma mulher é ser mulher.
643,Clarice Lispector,Tenho medo de esperar e nada acontecer.
644,Clarice Lispector,Fiz quase tudo certo. Errei quando coloquei sentimento.
645,Clarice Lispector,É como se cada parte do meu corpo implorasse por você.
646,Clarice Lispector,"""E sabe de algum modo obscuro que seus cabelos escorridos são de um náufrago. Porque sabe - sabe que fez um perigo. Um perigo tão antigo quanto o ser humano."""
647,Clarice Lispector,Faz de conta que a vida dela não era um faz de conta.
648,Clarice Lispector,"Eu prefiro o difícil, o impossível, o inesperado, e só."
649,Clarice Lispector,Posso de repente entender e não sentir.
650,Clarice Lispector,"Pegue para você o que lhe pertence, e o que lhe pertence é tudo o que sua vida exige. Parece uma vida amoral. Mas o que é verdadeiramente imoral é ter desistido de si mesma."
651,Clarice Lispector,"Eu estava agora tão maior que não me via mais. Tão grande como uma paisagem ao longe (...) Como poderei dizer senão timidamente assim: a vida se me é. A vida se me é, e eu não entendo o que diga. Então adoro."
652,Clarice Lispector,"Entregar-se a pensar é uma grande emoção, e só se tem coragem de pensar na frente de outrem quando a confiança é grande a ponto de não haver constrangimento em usar, se necessário, a palavra outrem."
653,Clarice Lispector,Mas de algum modo as pessoas são eternas.
654,Clarice Lispector,"O que é um espelho? É o único material inventado que é natural. Quem olha um espelho, quem consegue vê-lo sem se ver,quem entende que a sua profundidade consiste em ele ser vazio... esse alguém percebeu o seu mistério de coisa."
655,Clarice Lispector,Perder-se também é caminho.
656,Clarice Lispector,No mais fino e doído do seu sentimento ela pensava: - Vou ser Feliz!
657,Clarice Lispector,"“Em vida, observo muito, sou ativa nas observações, tenho o senso do ridículo, do bom humor, da ironia, e tomo um partido…”"
658,Clarice Lispector,"Quero pegar, sentir, tocar, ser. E tudo isso já faz parte de um todo, de um mistério. Sou uma só. (...) Sou um ser. E deixo que você seja. Isso lhe assusta? Creio que sim. Mas vale a pena."
659,Clarice Lispector,"Já chamei pessoas próximas de ""amigo"" e descobri que não eram... Algumas pessoas nunca precisei chamar de nada e sempre foram e serão especiais para mim."
660,Clarice Lispector,"Porque na pobreza de corpo e espírito eu toco na santidade, eu que quero sentir o sopro do meu além. Para ser mais do que eu, pois tão pouco sou."
661,Clarice Lispector,Antes o sofrimento legítimo do que o prazer forçado.
662,Clarice Lispector,"Perdi o jeito de ser gente. Não sei mais como se é. E uma espécie toda nova da ""solidão de não pertencer"" começou a me invadir como heras num muro."
663,Clarice Lispector,Agora que já vivi o meu caso posso rememorá-lo com mais serenidade. Não tentarei fazer-me perdoar. Tentarei não acusar. Aconteceu simplesmente.
664,Clarice Lispector,"""Adiar o momento em que terei que começar a dizer, sabendo que nada mais me resta a dizer. Estou adiando o meu silêncio."""
665,Clarice Lispector,"Sinto-me quase duas: uma me ama demais e a outra, nem sei quem é..."
666,Clarice Lispector,"Eu venho de uma longa saudade. Eu, a quem elogiam e adoram. Mas ninguém quer nada comigo. Meu fôlego de sete gatos amedronta os que poderiam vir. Com exceção de uns poucos, todos têm medo de mim como se eu mordesse."
667,Clarice Lispector,"Parece-me que eu vagamente sentia que, enquanto sofresse fisicamente de um modo tão insuportável, isso seria a prova de estar vivendo ao máximo."
668,Clarice Lispector,Eu que detesto domingo por ser oco.(in: Água Viva)
669,Clarice Lispector,"Fico com medo. Mas o coração bate. O amor inexplicável faz o coração bater mais depressa. A garantia única é que eu nasci. Tu és uma forma de ser eu, e eu uma forma de te ser: Eis os limites de minha possibilidade."
670,Clarice Lispector,"O que obviamente não presta sempre me interessou muito. Gosto de um modo carinhoso do inacabado, do malfeito, daquilo que desajeitadamente tenta um pequeno vôo e cai sem graça no chão."
671,Clarice Lispector,"E doidamente me apoderodos desvãos de mim,meus desvarios me sufocamde tanta beleza.Eu sou antes,eu sou quase,eu sou nunca."
672,Clarice Lispector,"Quando de noite ele me chamar para a atração do inferno, irei. Desço como um gato pelos telhados. Ninguém sabe, ninguém vê. Só os cães ladram pressentindo o sobrenatural."
673,Clarice Lispector,"Então escrever é o modo de quem tem a palavra como isca: a palavra pescando o que não é palavra.Quando essa não-palavra - a entrelinha - morde a isca, alguma coisa se escreveu."
674,Clarice Lispector,"Experimentei quase tudo, inclusive a paixão e o seu desespero. E agora só queria ter o que eu tivesse sido e não fui."
675,Clarice Lispector,Não ter forças para lutar era o meu único perdão.
676,Clarice Lispector,Sinto saudades de coisas que tivee de outras que não tivemas quis muito ter!Sinto saudades de coisasque nem sei se existiram.
677,Clarice Lispector,"Quando eu ficava sozinha, não havia uma queda, havia apenas um grau a menos daquilo que eu era com os outros, e isso sempre foi a minha natureza e a minha saúde."
678,Clarice Lispector,Onde aprender a odiar para não morrer de amor?
679,Clarice Lispector,"""O que os outros recebem de mim reflete-se então de volta para mim, e forma a atmosfera do que se chama: eu."""
680,Clarice Lispector,"Morri de muitas mortes e mantê-las-ei em segredo até que a morte do meu corpo venha, e alguém, adivinhando, diga: esta, esta viveu."
681,Clarice Lispector,Um coração como poucos. Um coração a moda antiga
682,Clarice Lispector,Que eu tenha coragem de me enfrentar
683,Clarice Lispector,Estou cheia de saudade de você mas aguento firme.
684,Clarice Lispector,Engulo a loucura porque ela me alucina calmamente.
685,Clarice Lispector,"Sonhar é bom, é como voar suspensa por balões."
686,Clarice Lispector,Por enquanto estou inventando a tua presença.
687,Clarice Lispector,Ocupei-me o tempo todo para disfarçar a saudade.
688,Clarice Lispector,Escrevo-te porque não me entendo.
689,Clarice Lispector,Eu romperei todos os nãos que existem dentro de mim.
690,Clarice Lispector,"""Que é que eu faço, é de noitee eu estou viva. Estar vivaestá me matando aos poucos,e eu estou toda alerta no escuro"""
691,Clarice Lispector,Sei o que é absoluto porque existo e sou relativa. Minha ignorância é realmente a minha esperança: não sei adjetivar.Olhando para o céu fico tonta de mim mesma.
692,Clarice Lispector,"Gosto de fazer as pessoas felizes, mesmo quando eu estou triste."
693,Clarice Lispector,"Eu também não sei não pensar. Acontece sem esforço. Só é difícil quando procuro obter essa escuridão silenciosa. Quando estou distraído, caio na sombra e no oco e no doce macio nada-de-mim.in Um Sopro de Vida."
694,Clarice Lispector,"O fato é que tenho nas minhas mãos um destino e, no entanto, não me sinto com o poder de livremente inventar. Sigo uma oculta linha fatal.Sou obrigado a procurar uma verdade que me ultrapassa."
695,Clarice Lispector,"Não sei o que fazer do que vivi,tenho medo dessa desorganização profunda. Não confio no que me aconteceu. Aconteceu-me alguma coisa que eu,pelo fato de não a saber como viver,vivi uma outra?!"
696,Clarice Lispector,"""Eu medito sem palavras e sobre o nada.”"
697,Clarice Lispector,Sinto que viver é inevitável.
698,Clarice Lispector,"Porque, às vezes, acordar tem lá suas muitas desvantagens."
699,Clarice Lispector,"Não me mostre o que esperam de mim porque vou seguir meu coração, não me façam ser o que não sou. Não me convidem a ser igual porque sinceramente sou diferente."
700,Clarice Lispector,"Redondo sem início e sem fim, eu sou o ponto antes do zero e do ponto final. Do zero ao infinito vou caminhando sem parar."
701,Clarice Lispector,"""Mas quero ter a liberdade de dizer coisas sem nexo como profunda forma de te atingir. Só o errado me atrai, e amo o pecado, a flor do pecado"""
702,Clarice Lispector,"Sentia que ""podia"". Fora feita para ""libertar"". ""Libertar"" era uma palavra imensa, cheia de mistérios e dores."
703,Clarice Lispector,Escrevo muito simples e muito nu. Por isso fere.
704,Clarice Lispector,Só os grandes amam a monotonia.
705,Clarice Lispector,"Gostaria mesmo que voce me visse e assistisse a minha vida sem eu saber,ver o que pode suceder quando se pactua com a comodidade da alma."
