,author,text
877,Clarice Lispector,"Pelas plantas dos pés subia um estremecimento de medo, o sussurro de que a terra poderia aprofundar-se. E de dentro erguiam-se certas borboletas batendo asas por todo o corpo."
878,Clarice Lispector,Abro o jogo! Só não conto os fatos de minha vida:sou secreta por natureza.Há verdades que nem a Deus eucontei. E nem a mim mesma. Souum segredo fechado a sete chaves.Por favor me poupem.
879,Clarice Lispector,Já escondi um amor.
880,Clarice Lispector,"Olhando a extrema beleza dos pássaros amarelos calculo o que seria se eu perdesse totalmente o medo. O conforto da prisão burguesa tantas vezes me bate no rosto. E, antes de aprender a ser livre, tudo eu aguentava - só para não ser livre."
881,Clarice Lispector,"E como nasci? Por um quase. Podia ser outra. Podia ser um homem. Felizmente nasci mulher. E vaidosa. Prefiro que saia um bom retrato meu no jornal do que os elogios.Tenho várias caras. Uma é quase bonita, outra é quase feia. Sou um o quê? Um quase tudo."
882,Clarice Lispector,"Tudo no mundo começou com um sim. Uma molécula disse sim a outra molécula e nasceu a vida. Mas antes da pré-história havia a pré-história da pré-história e havia o nunca e havia o sim. Sempre houve. Não sei o quê, mas sei que o universo jamais começou."
883,Clarice Lispector,"Deus, o que nos prometei em troca de morrer? Pois o céu e o inferno nós já os conhecemos - cada um de nós em segredo quase de sonho já viveu um pouco do próprio apocalipse. E a própria morte."
884,Clarice Lispector,"Alguns, bem sei, já até me disseram, me acham perigosa, Mas também sou inocente. Sei, e talvez só eu e alguns saibam, que se tenho perigo tenho também uma pureza. E ela só é perigosa para quem tem perigo dentro de si. Às vezes a raiz do que é ruim é uma pureza que não pôde ser."
885,Clarice Lispector,Sinto-me derrotada pela minha própria corruptalidade e vejo que sou intrissecantemente má.
886,Clarice Lispector,"Ser feliz é uma responsabilidade muito grande. Pouca gente tem coragem. Tenho coragem mas com um pouco de medo. Pessoa feliz é quem aceitou a morte. Quando estou feliz demais, sinto uma angústia amordaçante: assusto-me. Sou tão medrosa. Tenho medo de estar viva porque quem tem vida um dia morre. E o mundo me violenta.in Um Sopro de Vida"
887,Clarice Lispector,""" E eu impávida finjo que não tenho dono. Pontas de cigarro apagadas eu recebo. Um dia vou pegar fogo. De noite fico sozinha no escuro, vazia, pousada num canto do chão. Meu silên­cio fede. Ai de mim, que sou o receptáculo da morte das coisas."""
888,Clarice Lispector,Acordei hoje com tal nostalgia de ser feliz. Eu nunca fui livre na minha vida inteira. Por dentro eu sempre me persegui. Eu me tornei intolerável para mim mesma. Vivo numa dualidade dilacerante. Eu tenho uma aparente liberdade mas estou presa dentro de mim.
889,Clarice Lispector,Meu problema é o medo de ficar louco. Tenho que me controlar. Existem leis que regem a comunicação. A impessoalidade é uma condição. A separatividade e a ignorância são o pecado num sentido geral. E a loucura é a tentação de ser totalmente o poder.
890,Clarice Lispector,"Eu tenho que ser minha amiga, senão não aguento a solidão. Quando estou sozinha procuro não pensar porque tenho medo de de repente pensar uma coisa nova demais para mim mesma. Falar alto sozinha e para ""o quê"" é dirigir-se ao mundo, é criar uma voz potente que consegue - consegue o quê?"
891,Clarice Lispector,Saudade é um pouco como fome. Só passa quando se come a presença. Mas às vezes a saudade é tão profunda que a presença é pouco: quer-se absorver a outra pessoa toda. Essa vontade de um ser o outro para uma unificação inteira é um dos sentimentos mais urgentes que se tem na vida.
892,Clarice Lispector,"""Estou cada vez mais viva, soube vagamente. Começou a correr. Estava subitamente mais livre, com mais raiva de tudo, sentiu triunfante. No entanto não era raiva, mas amor. Amor tão forte que só esgotava sua paixão na força do ódio."""
893,Clarice Lispector,"Olhe, tenho uma alma muito prolixa e uso poucas palavras. Sou irritável e firo facilmente. Também sou muito calmo e perdoo logo. Não esqueço nunca. Mas há poucas coisas de que eu me lembre."
894,Clarice Lispector,"Há um tipo de choro bom e há outro ruim. O ruim é aquele em que as lágrimas correm sem parar e, no entanto, não dão alívio. Só esgotam e exaurem. Homem chorar comove. Ele, o lutador, reconheceu sua luta às vezes inútil. Respeito muito o homem que chora. Eu já vi homem chorar."
895,Clarice Lispector,Ninguém pode entrar no coração de ninguém
896,Clarice Lispector,Enquanto isso as nuvens são brancas e o céu é todo azul.
897,Clarice Lispector,"""E todos os dias ficarei tão alegre que incomodarei os outros, o que pouco me importa, já que eu tantas vezes sou incomodada pela alegria superficial e digestiva dos outros."""
898,Clarice Lispector,Eu sei de muito pouco. Mas tenho a meu favor tudo o que não sei e – por ser um campo virgem – está livre de preconceitos. Tudo o que não sei é a minha parte maior e melhor: é minha largueza. É com ela que eu compreenderia tudo. Tudo o que eu não sei é que constitui a minha verdade.
899,Clarice Lispector,"Agora preciso de tua mão, não para que eu não tenha medo, mas para que tu não tenhas medo. Sei que acreditar em tudo isso será, no começo, a tua grande solidão. Mas chegará o instante em que me darás a mão, não mais por solidão, mas como eu agora: Por amor."
900,Clarice Lispector,"Eu já começara a adivinhar que ele me escolhera para eu sofrer, às vezes adivinho. Mas, adivinhando mesmo, às vezes aceito: como se quem quer me fazer sofrer esteja precisando danadamente que eu sofra."
901,Clarice Lispector,O pequeno êxtase da palavra fluir junto do pensamento e do sentimento: nessa hora como é bom ser uma pessoa. Eu me encontro nos outros. Tudo o que dá certo é normal. O estranho é a luta que se é obrigado a travar para obter o que simplesmente seria o normal.
902,Clarice Lispector,"À duração de minha existência dou uma significação oculta que me ultrapassa. Sou um ser concomitante: reúno em mim o tempo passado, o presente e o futuro, o tempo que lateja no tique-taque dos relógios."
903,Clarice Lispector,"Às vezes sentava-me na rede, balançando-me com o livro no colo, sem tocá-lo, em êxtase puríssimo."
904,Clarice Lispector,"Se você procura alguém coerente, sensata, politicamente correta, racional, cheia de moralismo… Esqueça-me! Se você sabe conviver... com pessoas intempestivas, emotivas, vulneráveis, amáveis, que explodem na emoção: acolha-me."
905,Clarice Lispector,"Eu queria escrever luxuoso. Usar palavras que rebrilhaassem molhadas e fossem peregrinas. Às vezes solenes em púrpura, às vezes abismais esmeraldas, às vezes leves na mais fina seda macia"
906,Clarice Lispector,"Às vezes sentava-se na rede, balançando-me com o livro aberto no colo, sem tocá-lo, em êxtase puríssimo.Não era mais uma menina com um livro: era uma mulher com seu amante."
907,Clarice Lispector,"A Virgem de Todas as MulheresToda mulher, ao saber que está grávida, leva a mão à garganta: ela sabe que dará à luz um ser que seguirá forçosamente o caminho de Cristo, caindo na sua via muitas vezes sob o peso da cruz. Não há como escapar."
908,Clarice Lispector,"A impaciência enorme não é em relação à coisa propriamente dita, mas à paciência monstruosa que se tem. Como se dissesse: 'não suporto um minuto mais ser tão paciente', 'essa paciência de relojoeiro me enerva' etc.: é uma impaciente paciência."
909,Clarice Lispector,"""Abro o jogo! Só não conto os fatos de minha vida:sou secreta por natureza.Há verdades que nem a Deus eucontei. E nem a mim mesma. Souum segredo fechado a sete chaves.Por favor me poupem""."
910,Clarice Lispector,Amor é quando é concedido participar um pouco mais.Amor é a grande desilusão de tudo mais.Amor é finalmente a pobreza.Amor é não ter inclusive amor.É a desilusão do que se pensava que era amor.Amor não é prêmio por isso não envaidece.
911,Clarice Lispector,"As vezes também penso que eu não sou, pareço pertencer a uma galáxia longínqua de tão estranho que sou de mim. Sou eu? Espanto-me com o meu encontro."
912,Clarice Lispector,Saber desistir. Abandonar ou não abandonar — esta é muitas vezes a questão para um jogador. A arte de abandonar não é ensinada a ninguém. E está lon­ge de ser rara a situação angustiosa em que devo de­cidir se há algum sentido em prosseguir jogando.
913,Clarice Lispector,"Até que por horas desisti. E, por Deus tive o que eu não gostaria. Não foi ao longo de um vale fluvial que andei - eu sempre pensara que encontrar seria fértil e úmido como vales fluviais. Não contava que fosse esse grande desencontro."
914,Clarice Lispector,... não passava de um coração solitário pulsando com dificuldade no espaço.
915,Clarice Lispector,- Faço o possível para escrever por acaso. Eu quero que a frase aconteça. Não sei expressar-me por palavras. O que sinto não é traduzível. Eu me expresso melhor pelo silêncio. Expressar-me por meio de palavras é um desafio. Mas não correspondo à altura do desafio. Saem pobres palavras.
916,Clarice Lispector,Para que eu continue humana meu sacrifício será o de esquecer? Agora saberei reconhecer na face comum de algumas pessoas que - que elas esqueceram. E nem sabem mais que esqueceram o que esqueceram.
917,Clarice Lispector,"Estou com saudade de mim. Ando pouco recolhida, atendendo demais ao telefone, escrevo depressa, vivo depressa. Onde está eu? Preciso fazer um retiro espiritual e encontrar-me enfim - enfim, mas que medo - de mim mesma."
918,Clarice Lispector,"""Se eu me confiar e me considerar verdadeira, estarei perdida porque não saberei onde engasgar meu novo modo de ser - se eu for adiante nas minhas visões fragmentárias, o mundo inteiro terá que se transformar paraeu caber nele."""
919,Clarice Lispector,"E eis que depois de uma tarde de “quem sou eu” e de acordar à uma da madrugada ainda em desespero – eis que às três horas da madrugada acordei e me encontrei. Fui ao encontro de mim. Calma, alegre, plenitude sem fulminação. Simplesmente eu sou eu. E você é você. É vasto, vai durar."
920,Clarice Lispector,"Cada novo livro é uma viagem. Só que é uma viagem de olhos vendados em mares nunca dantes revelados - a mordaça nos olhos, o terror da escuridão é total. Quando sinto uma inspiração, morro de medo porque sei que de novo vou viajar e sozinho num mundo que me repele.in Um Sopro de Vida."
921,Clarice Lispector,"Certamente hoje é grãos de terra. Olha para cima, para o céu, durante todo o tempo.Às vezes chove, ela fica cheia e redonda nos seus grãos.Depois vai secando com o estio e qualquer vento a dispersa.Ela é eterno agora."
922,Clarice Lispector,"O amor é tão mais fatal do que eu havia pensado, o amor é tão inerente quanto a própria carência, e nós somos garantidos por uma necessidade que se renovará continuamente. O amor já está, está sempre. Falta apenas o golpe da graça - que se chama paixão."
923,Clarice Lispector,"É que o mundo de fora também tem o seu ‘dentro’, daí a pergunta, daí os equívocos. O mundo de fora também é íntimo. Quem o trata com cerimônia e não o mistura a si mesmo não o vive, e é quem realmente o considera ‘estranho’ e ‘de fora’. A palavra ‘dicotomia’ é uma das mais secas do dicionário."
924,Clarice Lispector,Estou cansada de tanta gente me achar simpática. Quero os que me acham antipática porque com esses eu tenho afinidade: tenho profunda antipatia por mim.O que farei de mim? Quase nada. [...] Há um limite de se ser. Já cheguei a esse limite.
925,Clarice Lispector,"O Senhor pode conferir. Eu fiz tudo certo, só errei quando coloquei sentimento. Só fiz bobagens e me dei mal quando ouvi este louco coração de criança que insiste em não endurecer e se recusa a envelhecer."
926,Clarice Lispector,"Não me provoque, tenho armas escondidas...Não me manipule, nasci para ser livre...Não me engane, posso não resistir...Não grite, tenho o péssimo hábito de revidar...Não me magoe, meu coração já tem muitas mágoas.."
927,Clarice Lispector,"Decifra-me, mas não me conclua, eu posso te surpreender."
928,Clarice Lispector,"A verdade não me faz sentido! É por isso que a temia e a temo.Desamparada,eu te entrego tudo - para que faças disso uma coisa alegre.Por te falar eu te assustarei e te perderei? mas se eu não falar eu me perderei,e por me perder,eu te perderia."
929,Clarice Lispector,"Não, é que vivo em eterna mutação, com novas adaptações a meu renovado viver e nunca chego ao fim de cada um dos modos de existir. Vivo de esboços não acabados e vacilantes. Mas equilibro-me como posso, entre mim e eu, entre mim e os homens, entre mim e o Deus."
930,Clarice Lispector,...passava o resto do dia representando com obediência o papel de ser.
931,Clarice Lispector,"Eu ponhei cada coisa em seu lugar. É isso mesmo: ponhei. Porque ""pus"" parece de ferida feia e marrom na perna de mendigo e a gente se sente tão culpada por causa da ferida com pus do mendigo e o mendigo somos nós, os degredados."
932,Clarice Lispector,"Haveria um grande silêncio em mim, mesmo que eu falasse..."
933,Clarice Lispector,"Vida incomoda bastante, alma que não cabe bem no corpo."
934,Clarice Lispector,"""A prova de que estou recuperando a saúde mental, é que estou cada minuto mais permissiva: eu me permito mais liberdade e mais experiências. E aceito o acaso. Anseio pelo que ainda não experimentei. Maior espaço psíquico. Estou felizmente mais doida."""
935,Clarice Lispector,"Segunda-feira é mais difícil porque é sempre a tentativa do começo de vida nova. Façamos cada domingo de noite um réveillon modesto, pois se meia-noite de domingo não é começo de Ano Novo é começo de semana nova, o que significa fazer planos e fabricar sonhos."
936,Clarice Lispector,"Ah, meu amor, não tenhas medo da carência: ela é o nosso destino maior. O amor é tão mais fatal do que eu havia pensado, o amor é tão inerente quanto a própria carência, e nós somos garantidos por uma necessidade que se renovará continuamente. O amor já está, está sempre."
937,Clarice Lispector,"Teu SegredoFlores envenenadas na jarra. Roxas azuis, encarnadas, atapetam o ar. Que riqueza de hospital. Nunca vi mais belas e mais perigosas. É assim então o teu segredo. Teu segredo é tão parecido contigo que nada me revela além do que já sei. E sei tão pouco como se o teu enigma fosse eu. Assim como tu és o meu."
938,Clarice Lispector,Abro o jogo! Só não conto os fatos de minha vida: sou secreta por natureza. Há verdades que nem a Deus eu contei. E nem a mim mesma. Sou um segredo fechado a sete chaves. Por favor me poupem.
939,Clarice Lispector,"Vida não tem adjetivo. É uma mistura em cadinho estranho mas que me dá em última análise, em respirar. E às vezes arfar. E às vezes mal poder respirar. É. Mas às vezeshá também o profundo hausto de ar que até atinge o fino frio do espírito, preso ao corpo por enquanto."
940,Clarice Lispector,Pertencer não vem apenas de ser fraca e precisar unir-se a algo ou a alguém mais forte. Muitas vezes a vontade intensa de pertencer vem em mim de minha própria força - eu quero pertencer para que minha força não seja inútil e fortifique uma pessoa ou uma coisa.
941,Clarice Lispector,"Minha alma tem o peso da luz. Tem o peso da música. Tem o peso da palavra nunca dita, prestes quem sabe a ser dita. Tem o peso de uma lembrança. Tem o peso de uma saudade. Tem o peso de um olhar. Pesa como pesa uma ausência. E a lágrima que não se chorou. Tem o imaterial peso da solidão no meio de outros."
942,Clarice Lispector,"""Pensar é um ato.Sentir é um fato."""
943,Clarice Lispector,"""Ainda não se cansara de existir e bastava-se tanto que às vezes, de grande felicidade, sentia a tristeza cobrí-la como a sombra de um manto, deixando-a fresca e silenciosam como um entardecer. Ela nada esperava. Ela era em si, o próprio fim."""
944,Clarice Lispector,"""Só poderia haver um encontro de seus mistérios se um se entregasse ao outro: a entrega de dois mundos incognoscíveis feita com a confiança com que se entregariam duas compreensões."""
945,Clarice Lispector,"Aceitar-me plenamente? É uma violentação de minha vida. Cada mudança, cada projeto novo causa espanto: meu coração está espantado. É por isso que toda minha palavra tem um coração onde circula sangue.(Um sopro de vida)"
946,Clarice Lispector,"Será horrível demais querer se aproximar dentro de si mesmo do límpido eu? Sim, e é quando o eu passa a não existir mais, a não reivindicar nada, passa a fazer parte da árvore da vida — é por isso que luto por alcançar. Esquecer-se de si mesmo e no entanto viver tão intensamente."
947,Clarice Lispector,"Mente-se e cai-se na verdade. Mesmo na liberdade, quando escolhia alegres novas veredas, reconhecia-as depois. Ser livre era seguir-se afinal, e eis de novo o caminho traçado. Ela só veria o que já possuia dentro de si. Perdido pois o goto de  imaginar."
948,Clarice Lispector,"Divido-me milhares de vezes em quantas vezes quanto os instantes que decorrem, fragmentaria que sou e precários os momentos -só me comprometo com a vida que nasca com o tempo e com ele cresca: só no no tempo a espaco para mim."
949,Clarice Lispector,... A nossa vida é truculenta:nasce-se com sanguee com sangue corta-se a uniãoque é o cordão umbilical.E quantos morrem com sangue.É preciso acreditar no sanguecomo parte de nossa vida.A truculência.É amor também. (Nossa truculência)
950,Clarice Lispector,"Nunca deixe de fazer algo de bom que o seu coração pede… O tempo pode passar  e a oportunidade também…  Não esqueça que:Meta, a gente busca. Caminho, a gente acha. Desafio, a gente topa. Vida, a gente enfrenta. Saudade, a gente mata.  Sonho, a gente realiza…"
951,Clarice Lispector,"Haverá um ano em que haverá um mês, em que haverá uma semana em que haverá um dia em que haverá um hora em que haverá um minuto em que haverá um segundo e dentro do segundo haverá o não tempo sagrado da morte transfigurada."
952,Clarice Lispector,Recuso-me a ficar triste. Sejamos alegres. Quem não tiver medo de ficar alegre e experimentar uma só vez sequer a alegria doida e profunda terá o melhor de nossa verdade. Eu estou- apesar de tudo oh apesar de tudo- estou sendo alegre neste instante-já que passa se eu não fixá-lo com palavras [..]
953,Clarice Lispector,"Escrever é procurar entender, é procurar reproduzir o irreproduzível, é sentir até o último fim o sentimento que permaneceria apenas vago e sufocador. Escrever é também abençoar uma vida que não foi abençoada."
954,Clarice Lispector,Saudade do que poderia ter sido e não foi.
955,Clarice Lispector,"Não me prendo a nada que me defina. Sou companhia, mas posso ser solidão;tranquilidade e inconstância, pedra e coração. Sou abraços, sorrisos, ânimos, bom humor, sarcasmo, preguiça e sono. Música alta e silêncio. Serei o que você quiser, mas só quando eu quiser."
956,Clarice Lispector,"Um domingo de tarde sozinha em casa dobrei-me em dois para a frente - como em dores de parto - e vi que a menina em mim estava morrendo. Nunca esquecerei esse domingo. Para cicatrizar levou dias. E eis-me aqui. Dura, silenciosa e heróica. Sem menina dentro de mim."
957,Clarice Lispector,"Amanheci em cólera. Não, não, o mundo não me agrada. A maioria das pessoas estão mortas e não sabem, ou estão vivas com charlatanismo. E o amor, em vez de dar, exige. E quem gosta de nós quer que sejamos alguma coisa de que eles precisam. Mentir dá remorso. E não mentir é um dom que o mundo não merece..."
958,Clarice Lispector,(...) faze com que eu perca o pudor de desejar quena hora de minha morte haja uma mão humana amada para apertar a minha (...)
959,Clarice Lispector,"Clarice Lispector já avisava: ""Não importa se você faz certo ou errado. As pessoas sempre vão encontrar um motivo para te criticar""."
960,Clarice Lispector,"Era um pouco de febre, sim. Se existisse pecado, ela pecara. Toda a sua vida fora um erro, ela era fútil. Onde estava a mulher da voz? Onde estavam as mulheres apenas fêmeas? E a continuação do que ela iniciara quando criança? Era um pouco de febre."
961,Clarice Lispector,"O que sou então? Sou uma pessoa que tem um coração que por vezes percebe, sou uma pessoa que pretendeu pôr em palavras um mundo ininteligível e um mundo impalpável. Sobretudo uma pessoa cujo coração bate de alegria levíssima quando consegue em uma frase dizer alguma coisa sobre a vida humana ou animal.”"
962,Clarice Lispector,"""Eu te odeio"", disse ela para um homem cujo crime único era o de não amá-la. ""Eu te odeio"", disse muito apressada. Mas não sabia sequer como se fazia. Como cavar na terra até encontrar a água negra, como abrir passagem na terra dura e chegar jamais a si mesma?"
963,Clarice Lispector,"Escrevo porque sou um desesperado e estou cansado, não suporto mais a rotina de me ser e se não fosse a sempre novidade que é escrever, eu me morreria simbolicamente todos os dias."
964,Clarice Lispector,"As palavras me antecedem e ultrapassam, elas me tentam e me modificam, e se não tomo cuidado será tarde demais:as coisas serão ditas sem eu as ter dito."
965,Clarice Lispector,"Quando o amor é grande demais torna-se inútil: já não é mais aplicável, e nem a pessoa amada tem a capacidade de receber tanto. Fico perplexa como uma criança ao notar que mesmo no amor tem-se que ter bom senso e senso de medida. Ah, a vida dos sentimentos é extremamente burguesa."
966,Clarice Lispector,"Sonhe com o que você quiser. Vá para onde você queira ir.Seja o que você quer ser, porque você possui apenas uma vidae nela só temos uma chance de fazer aquilo que queremos.Tenha felicidade bastante para fazê-la doce. Dificuldadespara fazê-la forte. Tristeza para fazê-la humana. Eesperança suficiente para fazê-la feliz."
967,Clarice Lispector,Eu me exponho melhor no silêncio.
968,Clarice Lispector,Clarice Lispectoreu sou um misterio para mim
969,Clarice Lispector,"A outra - aincógnita e anônima -, essa outra minha existência que era apenas profunda, era o que provavelmente me dava a segurança de quem tem sempre na cozinha uma chaleira em fogo baixo: para o que desse e viesse, eu teria a qualquer momento água fervendo."
970,Clarice Lispector,"Me provoque, me desafie,me tire do sério, Me tire do tédio, vire meu mundo do avesso, mas pelo amor de DEUS, me faça sentir... um beliscãozinho que for, me dê. Eu quero rir até a barriga doer, chorar com cara de sapo. Você aguentaria viver na montanha russa do meu coração?"
971,Clarice Lispector,"Escrevo por não ter nada a fazer no mundo: sobrei e não há lugar para mim na terra dos homens. Escrevo porque sou um desesperado e estou cansado, não suporto mais a rotina de me ser e se não fosse sempre a novidade que é escrever, eu me morreria simbolicamente todos os dias"
972,Clarice Lispector,"Sinto saudades de quem me deixou e de quem eu deixei! De quem disse que viria e nem apareceu; de quem apareceu correndo, sem me conhecer direito, de quem nunca vou ter a oportunidade de conhecer. Sinto saudades dos que se foram e de quem não me despedi direito."
973,Clarice Lispector,...entre as aleluias e as agonias de ser...
974,Clarice Lispector,Deve-se viver apesar de...
975,Clarice Lispector,A violeta é introvertida e sua introspecção é profunda.Dizem que se esconde por modéstia.Não é.Esconde-se para poder captar o próprio segredo.Seu quase-não-perfume é glória abafada mas exige da gente queo busque.Não grita nunca seu perume.Violeta diz levezas que não se podem dizer.
976,Clarice Lispector,"… eu só escrevo quando eu quero, eu sou uma amadora e faço questão de continuar a ser amadora. Profissional é aquele que tem uma obrigação consigo mesmo de escrever, ou então em relação ao outro. Agora, eu faço questão de não ser profissional, para manter minha liberdade."
977,Clarice Lispector,"Tudo tem que ser bem de leve paraeu não me assustar e não assustar osque amo.Pedem-me pouco, pedem-me quase nada.O terrível é que eu tenho muito para dare tenho que engolir esse muito e aindapor cima dizer com delicadeza : obrigadapor receberem de mim um pouquinho de mim."
978,Clarice Lispector,"""Ela sabia o que era desejo - embora não soubesse que sabia.Era assim: ficava faminta mas não de fome, era um gosto meio doloroso que subia do baixo-ventre e arrepiava o bico dos seios e os braços vazios sem abraço. Tornava-se toda dramática e viver doía."""
979,Clarice Lispector,"Mas estou já cansada de minhas hesitações, que já me trouxeram bastante aborrecimento. Tenho sempre que me lembrar que tudo que consegui na vida foi à custa de ousadias, embora pequenas. Quando a gente cai nessa atmosfera de indecisão, se sente perdida.In: Minhas queridas."
980,Clarice Lispector,"Eu peço a Deus tudo o que eu quero e preciso. É o que me cabe. Ser ou não ser atendida - isso não cabe a mim, isso já é matéria-mágica que se me dá ou se retrai. Obstinada, eu rezo. Eu não tenho o poder. Tenho a prece."
981,Clarice Lispector,"Ah, meu amor, não tenhas medo da carência: ela é o nosso destino maior. O amor é tão mais fatal do que eu havia pensado, o amor é tão inerente quanto a própria carência, e nós somos garantidos por uma necessidade que se renovará continuamente. O amor já está, está sempre. Falta apenas o golpe da graça - que se chama paixão."
